標題,連結,內文,來源,時間,圖片,is_disaster,國家,地點,災害,event,content,summary,region,overview
快訊》國家級警報! 北北桃山區暴雨恐致災 警戒持續至10時09分,https://newtalk.tw/news/view/2025-03-15/960618,"中央氣象署發布山區暴雨災防訊息，示警區域包括桃園市復興區、新北市石碇區、新北市三峽區、新北市平溪區、新北市汐止區、台北市士林區。
包括新北市北港溪(汐止柯子林)、新北市基隆河(平溪望古瀑布)、新北市大豹溪、新北市永定溪(石碇蚯蚓坑)、新北市石碇溪(石碇淡蘭吊橋)、桃園市霞雲溪(優霞雲瀑布區)、台北市雙溪(雙溪淨水場至聖人瀑布)發布災防告警，持續時間至10時09分；中央氣象署提醒此區域已有暴雨或有暴雨發生的機率，留意溪水暴漲並儘速遠離。
北北桃山區暴雨恐致災 警戒持續至10時09分。",Newtalk新聞,2025-03-15,https://images.newtalk.tw/resize_action2/800/album/news/961/67d4ca6d9099b.jpg,True,台灣,"桃園市復興區,新北市石碇區,新北市三峽區,新北市平溪區,新北市汐止區,台北市士林區,新北市北港溪(汐止柯子林),新北市基隆河(平溪望古瀑布),新北市大豹溪,新北市永定溪(石碇蚯蚓坑),新北市石碇溪(石碇淡蘭吊橋),桃園市霞雲溪(優霞雲瀑布區),台北市雙溪(雙溪淨水場至聖人瀑布)",暴雨,台灣北北桃山區暴雨,中央氣象署發布山區暴雨災防訊息，示警區域包括桃園市復興區、新北市石碇區等地，持續時間至10時09分。,此次暴雨警戒範圍包括桃園市復興區、新北市石碇區等地，預計可能造成溪水暴漲，影響範圍廣泛，需注意安全。,國內,桃園市復興區、新北市石碇區等地發布山區暴雨警戒，預計可能造成溪水暴漲，影響範圍廣泛，需注意安全。持續時間至10時09分。
雅加達淹水近郊陷癱瘓 專家：都市規畫和抗災力不足,https://money.udn.com/money/story/5599/8590861,"雅加達與近郊城市近日發生大規模洪災，其中災情最嚴峻的勿加西，當地官員一度宣布整座城市「陷入癱瘓」，至今仍有上百名居民被撤離到收容中心。專家指出，當地過度開發導致缺少集水區是造成嚴重洪災的主因。
過去幾天的豪雨，導致印尼首都雅加達及周邊城市出現淹水情形，特別是位於西爪哇省的勿加西（Bekasi）災情最慘重。直至5日晚間，勿加西12個行政區中，仍有8個行政區淹水，整座城市幾乎都泡在水中。市長德瑞（Tri Adhianto）一度宣布，城市「陷入癱瘓」。
當地的購物中心更因附近河堤坍塌，洪水灌入商場地下室，一度有數十人被困在高樓層區域數小時等待救援。
專家表示，勿加西過度開發是導致洪災特別嚴重的主因之一，並指出，因該地區建築密度高，集水區不足。
印尼加札馬達大學（UGM）減災專家賈蒂（DjatiMardiatno）今天告訴雅加達郵報（Jakarta Post），「降雨增加或如過度開發等風險因素增加，都會導致洪水災情更為嚴峻」。他認為，勿加西嚴重水災是這2個原因結合所致。
報導引述高力國際（Colliers International）2023年的數據指出，至2025年，勿加西將成為大雅加達擁有最多購物中心的區域。
賈蒂坦承，強降雨是造成淹水的原因，但大雅加達地區的問題是過度開發。他說：「當你在土地上建造一棟建築物時，應該有另一個新的開放空間來儲存洪水，但雅加達的問題是，蓋了建築物的空地，幾乎沒有任何能替代的（空間）。」
他續指，茂物（Bogor）的河川溢流導致了勿加西河暴發洪災，這代表減災工作並未與周邊城市結合，並補充，「若沒有良好的空間規畫和災害管理，例如建造水庫或對河川進行管理，勿加西將繼續面臨洪水威脅」。",經濟日報,2025-03-06,,True,印尼,"雅加達,勿加西,西爪哇省,茂物",洪水,印尼勿加西洪水,雅加達及周邊城市近日發生大規模洪災，勿加西災情最嚴重，城市一度癱瘓，居民被撤離。專家指出，過度開發導致集水區不足是主因。,勿加西12個行政區中有8個淹水，市長宣布城市癱瘓。數十人被困在購物中心高樓層等待救援。至今仍有上百名居民被撤離，專家認為過度開發和缺乏集水區是洪災嚴重的主因。,國外,印尼勿加西發生大規模洪災，12個行政區中有8個淹水，市長宣布城市癱瘓。數十人被困在購物中心高樓層等待救援，專家認為過度開發和缺乏集水區是洪災嚴重的主因。
快訊》大雷雨炸北.北.桃持續至7時30分慎防強風.冰雹.淹水| 生活,https://newtalk.tw/news/view/2025-03-15/960612,"中央氣象署針對「台北市、新北市、桃園市」發布大雷雨即時訊息，持續時間至07時30分止。
旺盛發展的對流常伴隨打雷、閃電與劇烈降雨，並可能出現較強陣風甚或伴隨冰雹發生，若發生於溪流河川上游易於下游出現溪(河)水暴漲，排水不良區域則易發生淹(積)水現象，強大雨勢威脅各項戶外活動並將造成能見度欠佳影響行車安全，山區易發生坍方、落石、土石流，提醒民眾注意。",Newtalk新聞,2025-03-15,https://images.newtalk.tw/resize_action2/800/album/news/961/67d4b7a568bac.jpg,True,台灣,"台北市,新北市,桃園市",大雨,台灣台北大雷雨,中央氣象署發布大雷雨即時訊息，台北市、新北市、桃園市至7時30分止，伴隨強風、冰雹、淹水。,大雷雨可能導致溪河水暴漲、淹水、影響行車安全及山區坍方、落石、土石流，提醒民眾注意。,國內,台北市、新北市、桃園市遭遇大雷雨，導致溪河水暴漲、淹水、山區坍方、落石及土石流，影響行車安全。
氣旋致災19萬家戶商家無電可用 澳洲啟動災民所得補助,https://money.udn.com/money/story/5599/8598482,"從熱帶氣旋減弱為熱帶低氣壓的艾佛瑞德（Alfred）帶來的暴雨，今天導致澳洲東岸大範圍地區淹水，超過19萬戶家庭和商家陷入停電，工程人員正努力搶修復電。
法新社報導，儘管風勢和雨勢已經逐漸減弱，澳洲當局仍警告艾佛瑞德餘威猶存，可能會在跨越新南威爾斯州和昆士蘭州、綿延400公里的東岸地區，帶來洪水災情和惡劣天氣的風險。
澳洲總理艾班尼斯（Anthony Albanese）在新南威爾斯州利斯摩（Lismore）勘災記者會上表示：「天氣系統影響還沒結束，我們不可掉以輕心。」
澳洲氣象局表示，艾佛瑞德24小時內在昆士蘭州首府布里斯本部分地區降下30釐米的雨量。
澳洲當地媒體的影像顯示，洪水淹沒了市區和周邊一些街道，受洪水影響最嚴重的地區車輛幾乎淹沒。
電力公司表示，昆士蘭州超過18萬5000戶家庭和商家目前仍陷入停電，新南威爾斯州也有1萬戶停電。
艾佛瑞德造成澳洲東岸大範圍洪災、停電和財產損失，澳洲政府今天表示，將啟動協助受災勞工的所得補貼計畫。
路透社報導，艾班尼斯今天在勘災記者會上表示，11日起所得低於平均週薪的勞工可以申請13週的所得補助。
這項所得補助計畫與澳洲的失業救濟金計畫相同，單身沒有小孩的勞工每兩週可以領取778澳元（約新台幣16000元）。澳洲當局週末還宣布將發放1000澳元的災害補貼金。
從熱帶氣旋減弱為熱帶低氣壓的艾佛瑞德8日登陸布里斯本北邊，重創新南威爾斯州和昆士蘭州。
澳洲當局表示，這場風災造成1人死亡，以及12名協助救災的官兵因天雨路滑車輛事故而受傷。
澳洲保險委員會（Insurance Council of Australia）今天表示，保險公司已經收到近3000件理賠申請案。
澳洲保險委員會執行長霍爾（Andrew Hall）表示，目前還無法判定總保險理賠金額，但隨著居民重返家園，確定災情後，預期還會有數千起申請理賠案件。",經濟日報,2025-03-10,,True,澳洲,"新南威爾斯州,昆士蘭州,利斯摩,布里斯本",洪水,澳洲東岸洪水,熱帶氣旋艾佛瑞德帶來暴雨，導致澳洲東岸大範圍地區淹水，超過19萬戶家庭和商家停電，政府啟動災民所得補助。,艾佛瑞德造成澳洲東岸大範圍洪災，導致1人死亡，12名救災官兵受傷，超過19萬戶家庭和商家停電。政府啟動所得補助計畫，提供13週的補助，單身無小孩勞工每兩週可領取778澳元。保險公司收到近3000件理賠申請，預計還會有更多申請案。,國外,艾佛瑞德熱帶低氣壓於2025年3月8日登陸澳洲東岸，造成新南威爾斯州和昆士蘭州大範圍洪災，1人死亡，12名救災官兵受傷，超過19萬戶家庭和商家停電。政府啟動所得補助計畫，保險公司收到近3000件理賠申請，災情持續發展中。
日本規模4.7近海地震無海嘯威脅 石川縣最大震度4,https://money.udn.com/money/story/5599/8617940?from=edn_newest_index,"日本放送協會（NHK）報導，能登半島近海今天下午1時25分（台北時間中午12時25分）左右發生推估規模4.7地震，最大震度4出現在石川縣。這起地震不會帶來海嘯威脅。
根據氣象廳觀測，這起地震推估規模4.7，震央位於能登半島外海，深度約10公里。
最大震度4出現在石川縣志賀町；石川縣中能登町、羽咋市、寶達志水町、河北市測得震度3；北陸地區各縣，以及新潟縣、岐阜縣、滋賀縣、長野縣等地也測得震度2或1不等。",經濟日報,2025-03-19,,True,日本,"能登半島,石川縣,志賀町,中能登町,羽咋市,寶達志水町,河北市,北陸地區,新潟縣,岐阜縣,滋賀縣,長野縣",地震,日本能登半島地震,日本能登半島近海發生規模4.7地震，石川縣最大震度4，無海嘯威脅。,此次地震未造成人員傷亡或財產損失報告。震央位於能登半島外海，深度約10公里。石川縣志賀町震度4，其他地區震度3至1不等。,國內,2025年3月19日，能登半島近海發生推估規模4.7地震，震央位於能登半島外海，深度約10公里。最大震度4出現在石川縣志賀町，石川縣其他地區震度3至1不等，北陸地區各縣及新潟、岐阜、滋賀、長野等地也測得震度2或1。此次地震未造成人員傷亡或財產損失報告，且不會帶來海嘯威脅。
義大利那布勒斯附近火山區地震 居民半夜避難,https://money.udn.com/money/story/5599/8606143?from=edn_previous_story,"義大利那不勒斯（Naples）以西坎皮佛萊格瑞（Campi Flegrei）火山地區，今天凌晨1點25分發生規模4.4地震，許多居民半夜逃到大街避難。當地部分房屋裂損，目前得知有1人受傷。
義大利總理府上午發表聲明，總理梅洛尼（GiorgiaMeloni）與人民保護部部長保持密切聯繫，關注情勢發展。
震央位在距離南義小城波照里（Pozzuoli）僅幾公尺的海中，深度約2公里。根據目前消息，那不勒斯的巴紐利（Bagnoli）區域受災較嚴重，多處房屋碎裂的瓦礫擊中路邊汽車，或掉落在人行道上；當地知名的聖安娜教堂（Chiesa di Sant'Anna）也受到衝擊，需要評估鐘樓結構的穩定性。
義大利媒體報導，目前得知有1位婦女因坍塌的天花板造成擦傷，已被消防隊救出。地震造成部分房屋的大門堵住，消防隊員也幫助受困的居民撤離。
儘管地震未造成嚴重傷亡，但在那不勒斯的巴紐利區域引發民眾與警察對峙。民眾半夜試圖前往北約（NATO）位在該區的舊基地內避難，但基地大門緊閉，民眾與前來協調的警方發生爭執。最後民眾強行開啟大門進入，局勢未升高為更劇烈的肢體衝突。
安莎（ANSA）通訊社報導，今天凌晨地震與去年5月20日發生的地震，規模相同都是4.4，是近40年來坎皮佛萊格瑞區的最強地震。
波照里市長曼佐尼（Luigi Manzoni）表示，根據維蘇威火山監測站（Vesuvius Observatory）數據，這次地震顯示此處火山活動嚴重加速，這是以前從未有過的記錄，證實火山活動程度劇烈。維蘇威監測站持續監測此處火山的地下活動，在這次主震之後又發生6次餘震。",經濟日報,2025-03-13,,True,義大利,"那不勒斯,坎皮佛萊格瑞,波照里,巴紐利",地震,義大利那不勒斯地震,義大利那不勒斯以西坎皮佛萊格瑞火山區發生4.4級地震，居民半夜逃到大街避難，部分房屋受損。,地震造成1人受傷，部分房屋裂損，當地知名的聖安娜教堂需要評估結構穩定性。地震未造成嚴重傷亡，但引發民眾與警察對峙，民眾強行進入北約舊基地避難。,國外,2025年3月13日凌晨1點25分，義大利那不勒斯以西坎皮佛萊格瑞火山地區發生規模4.4地震，造成1人受傷，部分房屋裂損，當地知名的聖安娜教堂需要評估結構穩定性。地震引發民眾與警察對峙，民眾強行進入北約舊基地避難。震央位在波照里附近海中，深度約2公里，巴紐利區受災較嚴重。
韓國野火釀4死200人撤離 東南部進入緊急狀態,https://money.udn.com/money/story/5599/8626012?from=edn_newestlist_rank,"韓國山清郡的野火造成至少3名消防員和1名公務員喪生，促使當局宣布東南部地區進入緊急狀態。
法新社報導，韓國行政安全部表示，山清郡（Sancheong）昨天下午竄起大火，當局出動304名人員和20架直升機救援。
行政安全部又說，南部15個村莊逾200名居民已被通知撤離。
消防部門官員告訴法新社說：「有3名消防員和1名公務員共4人，已確認喪生。」
韓國山林局表示，國內其他多處地區也發生了野火，單是昨天就接獲16起通報。
行政安全部鑒於「全國各處同時發生山林火災造成巨大損失」，隨後宣布蔚山（Ulsan）以及慶尚北道（North Gyeongsang）、慶尚南道（SouthGyeongsang）進入緊急狀態。
山林局已針對慶尚北道、慶尚南道、釜山（Busan）和大田市（Daejeon）等12處發布了最高等級的「嚴重」大火警告。
山清郡位在慶尚南道，地理位置在首爾（Seoul）東南方約250公里。
根據地方報導，基於安全考量，當地高速公路部分路段已關閉。",經濟日報,2025-03-23,,True,韓國,"山清郡,蔚山,慶尚北道,慶尚南道,釜山,大田市,首爾",野火,韓國山清郡野火,韓國山清郡野火造成4人死亡，200人撤離，當局宣布東南部進入緊急狀態。,韓國山清郡野火造成3名消防員和1名公務員死亡，200多名居民撤離。當局出動304名人員和20架直升機救援。山林局發布最高等級的「嚴重」大火警告，影響範圍包括慶尚北道、慶尚南道、釜山和大田市。,國外,2025年3月22日，韓國山清郡發生野火，造成3名消防員和1名公務員死亡，200多名居民撤離。當局出動304名人員和20架直升機救援。山林局發布最高等級的「嚴重」大火警告，影響範圍包括慶尚北道、慶尚南道、釜山和大田市。
影/美國爆多場野火畫面曝！控制率0% 南卡羅萊納宣布緊急狀態,https://money.udn.com/money/story/5599/8628256?from=udnamp-referralnews_ch1001artbottom,"衛報報導，北卡羅來納州西部波爾克郡（Polk County）近期爆發3處野火，其中2處控制率仍為0%，至今共燒毀超過3300英畝土地（約1335.5公頃），部分地區已經強制撤離。同時，南卡羅來納州也在22日宣布全州進入緊急狀態，因應藍嶺山脈（Blue Ridge）日益擴大的野火威脅。
波爾克郡發言人坎農（Kellie Cannon）證實，波爾克郡規模最大的2處野火：黑灣山火（Black Cove）延燒2076英畝土地，深林山火（Deep Woods）延燒1700英畝土地，控制率均為0%。第3處魚鉤山火（Fish Hook）延燒1713英畝土地，控制率為50%。
根據北卡森林服務處，3處火場均位於阿什維爾（Ashville）東南約30英里處（約48.2公里），去年9月才遭遇颶風海倫侵襲。官員表示，倒塌樹木以及低濕度和乾燥植被助長火勢蔓延。
北卡當局已在22日晚間8時20分針對部分地區進行強制撤離。
另外，報導指出，鄰近的南卡皮肯斯郡（Pickens county）21日爆發桌岩野火（Table Rock），州長麥馬斯特（Henry McMaster）22日宣布進入緊急狀態，以利進行撲火。截至23日，這處火場已延燒300英畝，而且控制率為0%。
南卡林業處在社群表示，當地消防官員22日已經呼籲桌岩山附近的部分居民自主撤離；桌岩州立公園也將關閉，直至另行通知。
https://reurl.cc/eM9RpK",經濟日報,2025-03-24,https://pgw.udn.com.tw/gw/photo.php?u=https://uc.udn.com.tw/photo/2025/03/24/realtime/31710597.jpg&x=0&y=0&sw=0&sh=0&sl=W&fw=1050&exp=3600&exp=3600,True,美國,"北卡羅來納州,波爾克郡,阿什維爾,南卡羅來納州,皮肯斯郡,桌岩州立公園",野火,美國北卡羅來納州野火,北卡羅來納州波爾克郡爆發3處野火，控制率為0%，已燒毀超過3300英畝土地，部分地區強制撤離。南卡羅來納州宣布緊急狀態。,北卡羅來納州波爾克郡的3處野火已燒毀3300英畝土地，部分地區強制撤離。南卡羅來納州宣布緊急狀態，桌岩野火延燒300英畝，控制率為0%。,國外,北卡羅來納州波爾克郡發生3處野火，燒毀3300英畝土地，部分地區強制撤離。南卡羅來納州宣布緊急狀態，桌岩野火延燒300英畝，控制率為0%。北卡的黑灣山火和深林山火控制率為0%，魚鉤山火控制率50%。南卡皮肯斯郡的桌岩野火也導致部分居民自主撤離。
南韓中南部野火肆虐 釀2死2失蹤,https://news.ltn.com.tw/news/world/breakingnews/4988503,"南韓中南部地區野火，當局出動直升機試圖撲滅火勢。（歐新社）
劉晉仁／核稿編輯
〔即時新聞／綜合報導〕南韓中南部地區21日發生野火災情，火勢至今仍未撲滅，當局指出，有2名消防員殉職，另有2人失蹤，南部地區15座村莊的200多名居民，更被要求撤離。
《法新社》報導，南韓行政安全部（內政部）指出，這場野火首先發生在慶尚南道山清郡，有關單位隨即部署了304名救災人員，與20架直升機因應。山清郡位於首爾東南方約250公里處。
一位消防官員今日向《法新社》透露，有2名消防員不幸因惡火喪生，還有2人下落不明；目前尚不清楚失蹤的2人，是否也是消防人員。
南韓林務局指出，中部與南部地區也傳出野火災情，已針對慶尚南北道、釜山、大田等12個地點，發布最高級別的火災警告。
南韓代理總統崔相穆的辦公室指出，崔相穆已指示相關單位「動員一切可用設備與人員，迅速撲滅（火勢）」。
不用抽 不用搶 現在用APP看新聞 保證天天中獎　 點我下載APP　 按我看活動辦法",自由時報,2025-03-22,https://img.ltn.com.tw/Upload/news/600/2025/03/22/php8l3Scd.jpg,True,南韓,"中南部地區,慶尚南道山清郡,慶尚南北道,釜山,大田",野火,南韓中南部野火,南韓中南部地區發生野火，火勢至今未滅，2名消防員殉職，2人失蹤，15座村莊200多名居民撤離。,南韓中南部野火造成2名消防員死亡，2人失蹤，15座村莊的200多名居民被迫撤離。當局出動304名救災人員和20架直升機，針對慶尚南北道、釜山、大田等12個地點發布最高級別火災警告。,國外,南韓中南部地區2025年3月21日發生野火，造成2名消防員死亡，2人失蹤，15座村莊的200多名居民被迫撤離。當局出動304名救災人員和20架直升機，針對慶尚南北道、釜山、大田等12個地點發布最高級別火災警告，火勢至今仍未撲滅。
