標題,連結,內文,來源,時間,圖片,is_disaster,國家,地點,災害,event,content,summary
地牛翻身！台南楠西規模3.9淺層地震 最大震度2級,https://newtalk.tw/news/view/2025-02-09/955999,"地牛翻身！台南市楠西區今天清晨6時50分發生芮氏規模3.9小區域有感地震，震央位於台南市政府東北東方39.2公里(台南市楠西區)，地震深度僅16.7公里。
根據中央氣象署地震報告顯示，各地測得最大震度高雄市甲仙、嘉義縣及台南市均為2級，雲林縣及彰化縣1級。",Newtalk新聞,2025-02-09,https://images.newtalk.tw/resize_action2/800/album/news/956/67a7f38806fa8.jpg,True,台灣,"台南市,楠西區,高雄市,甲仙,嘉義縣,雲林縣,彰化縣",地震,台灣台南地震,台南市楠西區清晨發生芮氏規模3.9地震，震央位於台南市政府東北東方，深度16.7公里。,此次地震最大震度為2級，影響範圍包括高雄市甲仙、嘉義縣及台南市，無人員傷亡或財產損失報告。
希臘桑托里尼島因地震進入緊急狀態 逾1萬人撤離,https://money.udn.com/money/story/5599/8534477,"希臘知名觀光島嶼「桑托里尼」（Santorini）10天內已記錄到超過7000次地震，最強一次為5日晚上的5.2級。據半島電視台報導，已有超過1萬1000人因地震從島上撤離。希臘地震專家稱，不排除鄰近斷層發生6級地震的可能性。
據半島電視台（Al Jazeera）報導，雅典國家天文台研究主任加納斯（Athanassios Ganas）稱：「我們現在正處於地震群發中。」
地震群（seismic swarm）是指在短時間內（從數小時到數月），在局部區域發生一系列小型到中型地震，而且沒有單一的主要震源。此次最強的5.2級屬於中度地震，6.0級或以上則屬於嚴重地震。
地震震央目前集中在桑托里尼和其他周邊島嶼之間不斷擴大的地震群。
桑托里尼位於希臘火山弧線上，此條弧線從希臘南部的伯羅奔尼梭半島（Peloponnese）延伸到賽克拉德茲群島（Cyclades）。
此地區另有兩座火山島：尼亞卡美尼島（NeaKameni）和科倫坡島（Kolumbo）。尼亞卡美尼島位於桑托里尼火山口內。科倫坡島是一座海底火山，位於桑托里尼島東北約8公里處。
桑托里尼島現在的地質即是形成於西元前1600年，人類歷史上最大規模的一次火山爆發。
加納斯（Athanassios Ganas）解釋說：「我認為科倫坡海底火山和火山群目前不會造成任何危險；但仍不能排除第2次岩漿爆發的可能性，因為地震活動會將壓力轉移到鄰近斷層，大約15公里長，因此鄰近斷層有發生6級地震的可能性。」
加納斯指出，儘管桑托里尼島距離兩座火山很近，但他認為火山爆發的可能性不大，並強調，目前的地震與火山活動無關，不會造成特定的火山危害。
希臘位於世界上地震活動頻繁的地區，地震並不罕見。一名希臘羅得斯島（Rhodes）居民蘇西（SuzyPerdikoulis）告訴中央社，希臘人對於地震活動早已習以為常。羅得斯島和桑托里尼島同樣位於愛琴海上，兩島距離約311公里，
地震目前尚未在島上造成人員傷亡或重大損失。據半島報導，已有超過1萬1000人因地震從島上撤離。根據2021年人口普查，深受遊客歡迎的桑托里尼島常住人口並不多，約為1萬5000人。
希臘氣候危機和民防部（Ministry of Climate Crisisand Civil Protection）稱，2011年也有類似的地表下岩漿運動，導致持續14個月的地震活動，但並未引發任何火山問題。
桑托里尼上一次發生的嚴重地震是1956年的7.5級地震，造成至少53人死亡。
希臘當地政府現在已關閉桑托里尼島和阿莫爾戈斯島（Amorgos）的學校至7日，緊急狀態則將持續到3月3日。",經濟日報,2025-02-07,,True,希臘,"桑托里尼,雅典,伯羅奔尼梭半島,賽克拉德茲群島,尼亞卡美尼島,科倫坡島,羅得斯島,阿莫爾戈斯島",地震,希臘桑托里尼地震,桑托里尼島因連續地震進入緊急狀態，逾1萬1000人撤離。地震群發生在島嶼周邊，專家不排除6級地震的可能性。,桑托里尼島在10天內記錄超過7000次地震，最強達5.2級，導致超過1萬1000人撤離。目前未造成人員傷亡或重大財產損失，但學校關閉至7日，緊急狀態持續至3月3日。
嘉義縣大埔鄉地震規模4.4 最大震度4級,https://newtalk.tw/news/view/2025-02-10/956080,根據中央氣象署最新資訊，今天凌晨1時39分發生芮氏規模4.4地震，地震深度14.7公里，震央位在嘉義縣政府東南方35.2公里（位在嘉義縣大埔鄉），最大震度嘉義縣4級。,Newtalk新聞,2025-02-10,https://images.newtalk.tw/resize_action2/800/album/news/957/67a92dd88474d.jpg,True,台灣,"嘉義縣,大埔鄉",地震,台灣嘉義地震,凌晨1時39分，嘉義縣大埔鄉發生芮氏規模4.4地震，震央位於嘉義縣政府東南方35.2公里，深度14.7公里。,此次地震未造成人員傷亡或財產損失報告，但最大震度達到4級，影響範圍主要集中在嘉義縣。
印度地牛翻身 德里清晨大地震嚇醒人,https://money.udn.com/money/story/5599/8552569?from=edn_newestlist_rank,"印度德里國家首都區（NCR）今天清晨5時30分左右發生強烈地震，地震持續約10秒鐘，規模、受影響程度等有待觀察。
德里地區許多民眾今天清晨都因為地震被從睡夢中被驚醒，當時天色仍十方黑暗，但可聽見不少人被驚醒，驚慌討論的聲音，有零星民眾摸黑跑到路上，不過數分鐘後便恢復平靜。",經濟日報,2025-02-17,,True,印度,"德里,德里國家首都區",地震,印度德里地震,印度德里清晨發生強烈地震，持續約10秒，許多民眾被驚醒。,地震規模和受影響程度尚待觀察，目前無具體損失數據，但有民眾被驚醒並短暫逃到路上。
地震連震4天 希臘島嶼民眾心慌走海空兩路暫撤,https://money.udn.com/money/story/5599/8525796,"觀光勝地桑托里尼（Santorini）今天再爆數十起地震，是連續第4天出現連環震，許多心慌的民眾攜家帶眷搭上渡輪，航空公司也增開班機協助民眾暫時離開這座希臘島嶼。
綜合路透社和法新社報導，桑托里尼和阿莫爾戈斯島（Amorgos）這兩個位在愛琴海的火山島嶼，1月31日以來地牛持續翻身，促使當局宣布桑托里尼和鄰近的伊奧斯島（Ios）、阿莫爾戈斯島、阿納菲島（Anafi）的學校停課至2月7日。
專家團隊組成的委員會今天表示，2月1日以來記錄到約200個規模3.0以上的地震。委員會強調，這個現象與「火山活動並無關連」。
抗震規劃與保護組織（Organisation of AntiseismicPlanning and Protection）負責人雷卡斯（EfthymiosLekkas）今天告訴希臘廣播電視公司（ERT），「有極低可能性會發生規模5.5地震」，但排除爆發規模6以上強震的可能性。
桑托里尼今天每隔幾分鐘就來一震，部分規模達4。民眾接獲的建議是遠離室內空間和小型港口。當局為求謹慎也在地面部署了救災因應單位。
島上1.5萬居民有許多人在戶外過夜，另有數百名永久居民選擇搭渡輪或搭機暫撤。
1名72歲民眾說：「地震持續不斷，很劇烈，我們都感覺到了。」他說：「我們咬牙捱了3天，可是今天情況最糟，所以我們決定走為上策，無論幾天我們都會撐下去。」
愛琴海航空（Aegean Airlines）表示，應希臘民防部的要求，今明兩天會增開3架往返桑托里尼的航班，以方便居民與遊客旅行。
在島上住了17年的導遊薩卡瓦拉斯（KostasSakavaras）告訴法新社說，他從未經歷過這種等級的地震活動，「昨天每3、4個小時就搖一次。這跟過去幾次的感受完全不同」。
他說他昨天和妻子帶著2個孩子搭上一艘客滿的渡輪離開桑托里尼。他說：「我們計劃（在希臘本土）待到週末。我認為明天規模會上升，但願會平靜下來。」",經濟日報,2025-02-04,,True,希臘,"桑托里尼,阿莫爾戈斯島,伊奧斯島,阿納菲島",地震,希臘桑托里尼地震,桑托里尼連續4天發生地震，民眾心慌，搭乘渡輪和增開的航班暫時撤離。,桑托里尼島自1月31日起連續4天發生約200次規模3.0以上的地震，導致1.5萬居民中許多人選擇在戶外過夜或暫時撤離。學校停課至2月7日，航空公司增開3架航班協助居民和遊客離開。專家表示，雖有低概率發生規模5.5地震，但不會發生規模6以上的強震。
多明尼加東北部規模5.9地震 暫無災損通報,https://money.udn.com/money/story/5599/8571438?from=edn_newest_index,"多明尼加共和國東北部地區今晨發生規模5.9地震，目前暫無災損通報，也未發布海嘯警報。
美聯社報導，根據美國地質調查所（U.S. GeologicalSurvey），這起地震震央位於多明尼加度假勝地朋達卡納（Punta Cana）北北東方約100公里處，震源深度46公里。
多明尼加共和國的部分地區和鄰近的波多黎各都有震感。",經濟日報,2025-02-25,,True,多明尼加共和國,"朋達卡納,波多黎各",地震,多明尼加地震,多明尼加東北部發生規模5.9地震，震央位於朋達卡納北北東方約100公里處，震源深度46公里。,目前暫無災損通報，也未發布海嘯警報。多明尼加共和國部分地區和鄰近的波多黎各都有震感。
阿根廷森林大火跨境延燒 智利多地野火惡化,https://money.udn.com/money/story/5599/8562703,"阿根廷巴塔哥尼亞森林大火蔓延至智利，多地野火惡化，已燒毀逾5萬2000公頃土地；智利政府發布紅色警戒，動員多架直升機空中滅火。
智利全國林業協會（CONAF）報告顯示，阿根廷納韋爾瓦皮（Nahuel Huapi）國家公園的大火已經穿越利昂（El León）關口，目前派遣3架直升機築起防火牆進行滅火。
然而智利多個地區，包括阿勞卡尼亞（Araucanía）、紐夫萊（Ñuble）、比歐比歐（Biobío）、湖大區（Los Lagos）、河大區（LosRíos）和馬烏萊（Maule）都面臨野火燎原的狀況，其中阿勞卡尼亞區是智利森林火災最嚴重的受災區，燒毀逾1萬7000公頃，目前有16處活躍火源，58處獲得控制，但尚無完全撲滅的火點；大火正威脅人口密集區域及農村，部分居民已被撤離。
據智利全國林業協會調查，截至20日，共有5萬2116.6公頃土地受到影響。
智利農業部長瓦倫祖拉（Esteban Valenzuela）表示，森林大火對當地生物多樣性造成嚴重影響，尤其是紐夫萊地區，是瀕臨絕種動物「馬駝鹿」的棲息地，火災已對原始森林、生物圈構成威脅。
智利目前動員全國資源，部署數架直升機與專業人員進行滅火行動，持續監測火情發展。全國災害預防與應對服務局（SENAPRED）呼籲民眾遠離高風險區域，並遵守緊急應對指示，以減少火災擴散風險。",經濟日報,2025-02-21,,True,智利,"阿勞卡尼亞,紐夫萊,比歐比歐,湖大區,河大區,馬烏萊,納韋爾瓦皮國家公園,利昂關口",野火,智利阿勞卡尼亞野火,阿根廷巴塔哥尼亞森林大火蔓延至智利，智利多地野火惡化，政府動員直升機滅火。,智利阿勞卡尼亞區受災最嚴重，燒毀逾1萬7000公頃，16處活躍火源，58處火點受控。共影響5萬2116.6公頃土地，部分居民撤離，生物多樣性受損，政府部署資源滅火並監測火情。
日本山林火災延燒5天 燒毀面積約63座東京巨蛋,https://money.udn.com/money/story/5599/8566261,"日本岩手縣大船渡市日前發生山林火災，到今天已進入第5天，相關單位仍未能完全撲滅火勢，初估燒毀面積已約318公頃，單純計算約相當於63座東京巨蛋（占地面積約5公頃）。
日本放送協會（NHK）報導，大船渡市三陸町一處山林2月19日發生火災後，持續延燒到其他地點。
消防等單位從今天上午日出時分重啟直升機灌救行動，包括自衛隊、岩手縣政府、宮城縣政府及山形縣政府等單位的直升機，都從上空灑水試圖滅火。
岩手縣政府表示，截至2月22日晚間止，這場山林火災初估已燒毀約318公頃林地，暫時不清楚何時能完全撲滅火勢。
到目前為止未傳出有人員傷亡或建築物受損等情況，大船渡市政府持續針對周邊的62個家戶共157人發布避難指示，呼籲嚴防可能災情。",經濟日報,2025-02-23,,True,日本,"岩手縣,大船渡市,三陸町",野火,日本岩手縣山林火災,日本岩手縣大船渡市山林火災持續5天，燒毀面積約318公頃，相當於63座東京巨蛋。,日本岩手縣大船渡市山林火災持續5天，燒毀面積約318公頃，無人員傷亡或建築物受損。62個家戶共157人收到避難指示。
