標題,連結,內文,來源,時間,圖片,is_disaster
菲律賓地震：倖存者露宿田野，死亡人數持續上升,https://www.bbc.com/zhongwen/articles/cq5j13vp2w0o/trad,"圖像來源，
GETTY IMAGES
菲律賓中部發生芮氏6.9級地震後的第二天，阿古爾‧艾絲塔莉卡斯 (Arguel Estalicas)說她每次站起來仍感到頭暈目眩。 這種天旋地轉的感覺，加上一連串的餘震，使這位35歲的觀光官員和許多倖存者不敢回家，只能暫時住在帳篷裡。
地震於9月30日夜間震撼了菲律賓人口稠密的宿霧島北岸，驚醒了無數熟睡中的居民。 地震造成至少68人死亡、逾500人受傷，房屋、建築物和教堂倒塌，道路也出現裂縫。 艾絲塔莉卡斯女士向BBC表示：「我至今仍無法理解我們經歷了什麼。過去兩天的經歷讓我感到難以承受。」
她住在震央附近的梅地利鎮。災難應變官員指出，這場地震使宿霧及周邊省份近8萬人流離失所。宿霧是菲律賓中部的重要貿易與交通樞紐。 她說地震發生時，她尖叫著從床上跳起，與家人一起跑到戶外。
他們在露天睡覺，但當細雨落下時，艾絲塔莉卡斯和家人只好用塑膠袋包裹自己，因為他們沒有雨衣。 社交媒體上的照片顯示，他們蜷縮在塑膠椅上，身上裹著因呼吸而起霧的塑膠袋。
圖像來源，
ARGUEL ESTALICAS
距離震央約10公里（6.2英里）外的聖雷米吉奧（San Remigio）市鎮，羅倫澤‧帕雷哈 （Lourenze Pareja）當晚也在戶外度過地震之夜。 「在夜空下，我們自由地坐著——滿懷信念——靠著微弱的燈光，緊握僅有的資源。」帕雷哈在Facebook上寫道：「請大家為我們祈禱。」
End of 熱讀
當地面開始震動時，帕雷哈說他抓起手機衝到街上，直播現場混亂——鄰居穿著睡衣帶著孩子和寵物逃出家門。
「主啊……」這位25歲的社區記者在直播中呼喚上帝，似乎無法再多說什麼。
他表示自己前往鄰近的博戈鎮（Bogo）查看情況，看到太陽能燈在滿是巨石的街道上投下微弱光芒。 「曾經充滿活力的城市，如今變成了鬼城。」他說。
菲律賓易受天災影響，因其位於地質不穩定的「環太平洋火環」上——此區因頻繁發生地震與火山爆發而得名。
本週二宿霧發生的地震是近年來最強烈、最致命的之一。2013年，鄰近的薄荷島 （Bohol）島曾發生芮氏7.2級地震，造成逾200人死亡，並摧毀了多座歷史悠久的教堂。
週四，救援人員在瓦礫中搜尋，當局則努力提供食物、恢復電力與通訊線路，並清理道路上的碎石。 菲律賓軍方已派遣部隊協助救災期間的秩序維持。
然而，對許多人而言，日常生活用品仍是迫切的問題。 攝影師杜茲‧德馬佩 (Doods Demape) 於週四決定從麥德林（Medellin）駕車四小時前往省會採購物資，因為當地超市尚未營業。
德馬佩先生表示，他很難找到沒有大排長龍的加油站。 他告訴BBC：「現在大多數道路已可通行，物資開始從城市運進來。但像水和食物這類立即需要的物資，尤其是給孩子的，仍然無法取得。」
在震央薄荷島市，當地媒體報導指出，臨時醫院外的街道上排滿了屍袋，傷者正在接受治療。
圖像來源，
GETTY IMAGES
這週的地震發生在猛烈颱風季節的中段。兩場接連而至的風暴在一週前淹沒了全國大片地區。
這些風暴以及先前的季風降雨所引發的廣泛洪災激起了公眾的憤怒，並引發了街頭抗議。
宿霧特別容易受到颱風侵襲。它位於太平洋上形成的風暴的一般路徑上。
該島北部地區是週二地震的震央，曾在2013年遭受超級颱風「海燕」的重創。那場風暴在整個中部地區造成超過6,000人死亡。
週二地震損毀的眾多建築物中，包括一處為颱風「海燕」倖存者設立的安置點。
儘管眼前困境重重，宿霧當地居民如艾絲塔莉卡斯女士和帕雷哈先生仍然抱持希望，相信他們能像在颱風「海燕」及之前災難中一樣挺過這次地震。
他們表示，倖存者彼此互助，正如菲律賓人所稱的「社區互助精神」（bayanihan）。
帕雷哈說：「我唯一的祈禱是援助不會延遲——而且鄰近的市鎮也能被納入並涵蓋在這些救援行動中。」",BBC News 中文,2025-10-03,https://ichef.bbci.co.uk/ace/ws/640/cpsprodpb/77d9/live/f1cfca20-9f67-11f0-99d3-79886bca9dc5.jpg.webp,True
