標題,連結,內文,來源,時間,圖片,is_disaster
菲律賓強震死亡人數增至31人 宿霧市今停課1天 災區大雨又斷電,https://money.udn.com/money/story/5599/9040126?from=edn_newest_index,"菲律賓中部宿霧省外海9月30日晚間發生規模6.9的地震，死亡人數已攀升到至少31人，另有超過140人受傷。官員警告，隨著救援人員進入倒塌建築，傷亡人數可能進一步上升。
此次地震由當地斷層的活動引發，震央位於人口約9萬的宿霧省沿海城市博戈（Bogo）東北方約19公里處，震源深度僅5公里。減災官員伊戈特（Rex Ygot）接受電訪時表示，該市已有至少14名居民罹難。
在博戈周邊，麥德林（Medellin）鎮減災辦公室負責人維拉莫爾（Gemma Villamor）指出，至少12名鎮民喪生，多屬小家庭，死於房屋天花板和牆壁倒塌，其中部分人在睡夢中遇難。聖雷米吉奧（San Remigio）副鎮長雷尼斯（Alfie Reynes）則通報5人死亡，包括3名海岸警衛、一名消防員與一名兒童。
菲律賓火山暨地震研究所（Phivolcs）警告，強震後恐將出現餘震，受損建物可能進一步倒塌。GMA新聞則在地震後不久報導，宿霧市長阿奇瓦爾（Nestor Archival）宣布，作為預防措施，市內所有學校10月1日停課，以便全面檢查政府建築，確保市民安全。
路透報導，宿霧省是菲律賓最受歡迎的旅遊勝地之一，菲國第二繁忙的麥克坦－宿霧國際機場仍在運作，但北部災情最為嚴重。聖雷米吉奧已宣布進入災難狀態，以利救援與應變。
雷尼斯呼籲外界提供食物、飲水及重型設備，以協助撤離與搜救。他表示，當地正下大雨且電力中斷，尤其是北部地區，因地震破壞供水管線，水源非常短缺。
連結：https://x.com/inquirerdotnet/status/1973087494976446837",經濟日報,2025-10-01,https://uts.aralego.com/a/ba020d84-4328-4fdb-9f37-fb0fa3a84fa7.png,True
尼泊爾連日豪雨釀洪災　累計47人喪生,https://money.udn.com/money/story/5599/9051764,"尼泊爾官員今天表示，自3日以來，該國連日豪雨，引發土石流與洪災，沖毀橋樑並阻斷交通，迄今造成至少47人喪生。
路透社報導，尼泊爾武裝警察部隊（Armed PoliceForce）發言人達烏博吉（Kalidas Dhauboji）指出，該國東部伊拉姆（Ilam）有35人死於土石流，有9人遭洪水沖走下落不明，有3人在其他地區被雷擊中喪生。
尼泊爾國家減災管理局（NDRRMA）發言人瑪哈特（Shanti Mahat）表示，當局正展開對失蹤者的救援行動。
尼泊爾當局指出，多條高速公路遭土石流阻塞，並被洪水沖毀，導致數百名乘客受困。",經濟日報,2025-10-05,https://uts.aralego.com/a/c7c3b270-b89b-4938-8400-446b88a22eca.png,True
印度大吉嶺土石流釀24死　救難人員持續搜救,https://money.udn.com/money/story/5599/9053285?from=edn_newestlist_rank,"印度官員表示，東北部著名產茶區大吉嶺（Darjeeling）昨天因豪雨引發土石流，造成至少24人喪生，救難人員今天持續在當地尋找失聯民眾。
美聯社報導，西孟加拉邦（West Bengal）官員古哈（Udayan Guha）表示，印度陸軍與災難應變部隊已派員展開搜救。但多名官員表示，豪雨及道路受損使得救難隊伍難以抵達幾個受災村落。
電視新聞畫面顯示，救難人員動用挖土機清除土石。
大吉嶺週末的強降雨引發土石流，除摧毀房舍及基礎設施，也讓數百名觀光客受困當地。
西孟加拉邦首長班納吉（Mamata Banerjee）在社群平台X發文表示，暴雨還導致2座鐵橋坍塌。
印度氣象單位預測，強降雨將持續到明天。",經濟日報,2025-10-06,https://uts.aralego.com/a/ff206bce-e668-49cb-91ce-a0a9f16c113d.png,True
尼泊爾連日豪雨釀洪災 累計47人喪生,https://news.ltn.com.tw/news/world/breakingnews/5201534,"尼泊爾自3日以來連日豪雨，引發土石流與洪災，已造成至少47人喪生。（法新社）
尼泊爾官員今天表示，自3日以來，該國連日豪雨，引發土石流與洪災，冲毀橋樑並阻斷交通，迄今造成至少47人喪生。
路透社報導，尼泊爾武裝警察部隊（Armed Police Force）發言人達烏博吉（Kalidas Dhauboji）指出，該國東部伊拉姆（Ilam）有35人死於土石流，有9人遭洪水冲走下落不明，有3人在其他地區被雷擊中喪生。
請繼續往下閱讀...
尼泊爾國家減災管理局（NDRRMA）發言人瑪哈特（Shanti Mahat）表示，當局正展開對失蹤者的救援行動。
尼泊爾當局指出，多條高速公路遭土石流阻塞，並被洪水冲毀，導致數百名乘客受困。
尼泊爾自3日以來連日豪雨，引發土石流與洪災。（法新社）
熱門賽事、球星動態不漏接
不用抽 不用搶 現在用APP看新聞 保證天天中獎　 點我下載APP　 按我看活動辦法",自由時報,2025-10-05,https://img.ltn.com.tw/Upload/news/600/2025/10/05/phpVhFgSS.jpg,True
印度大吉嶺土石流釀24死 救難人員持續搜救,https://news.ltn.com.tw/news/world/breakingnews/5202436,"印度著名產茶區大吉嶺因豪雨引發土石流，造成至少24人喪生，豪雨也造成道路及橋梁受損，增加救災難度。（路透）
印度官員表示，東北部著名產茶區大吉嶺（Darjeeling）昨天因豪雨引發土石流，造成至少24人喪生，救難人員今天持續在當地尋找失聯民眾。
美聯社報導，西孟加拉邦（West Bengal）官員古哈（Udayan Guha）表示，印度陸軍與災難應變部隊已派員展開搜救。但多名官員表示，豪雨及道路受損使得救難隊伍難以抵達幾個受災村落。
請繼續往下閱讀...
電視新聞畫面顯示，救難人員動用挖土機清除土石。
大吉嶺週末的強降雨引發土石流，除摧毀房舍及基礎設施，也讓數百名觀光客受困當地。
西孟加拉邦首長班納吉（Mamata Banerjee）在社群平台X發文表示，暴雨還導致2座鐵橋坍塌。
印度氣象單位預測，強降雨將持續到明天。
熱門賽事、球星動態不漏接
不用抽 不用搶 現在用APP看新聞 保證天天中獎　 點我下載APP　 按我看活動辦法",自由時報,2025-10-06,https://img.ltn.com.tw/Upload/news/600/2025/10/06/phpuEW6dZ.jpg,True
西班牙暴雨成災！紅色警戒齊發 豪雨「吞噬街道」畫面曝,https://news.ltn.com.tw/news/world/breakingnews/5196220,"西班牙多地淹水、暴雨成災。（歐新社）
西班牙目前正遭受猛烈的暴風雨侵襲，暴雨導致多地嚴重淹水，而降雨在未來幾天仍將持續。西班牙當局已對多個地區發布紅色「極度危險」警報。
英媒《太陽報》今（30日）報導，西班牙的渡假勝地伊微沙島（Ibiza），目前仍處於橙色「重大危險」的警報狀態；馬略卡島（Mallorca）以及東岸的部分地區，則還是黃色警報。
請繼續往下閱讀...
據報導，西班牙東部的加泰隆尼亞（Catalonia）以及沿海城市，從昨（29日）起至深夜，持續遭受狂風暴雨侵襲，降雨量驚人。昨日塔拉戈納（Tarragona）、卡斯特利翁（Castellon）與瓦倫西亞（Valencia）等地，也都發出了紅色警報，這是西班牙氣象警戒系統中，最嚴重的級別，今日當地學校與景區依然全面關閉。
瓦倫西亞不只偵測到破紀錄的降雨量，同時還伴隨著風速超過每小時96公里的強風，從網路上流傳的畫面顯示，街道的階梯如瀑布般湧流而下、汽車被洪水沖走、巨大的漩渦吞噬整個城市，場面十分驚人。
巴利阿里群島（Baleares）的緊急服務部門，接獲多達61起災情通報，其中大多數來自伊微沙島，導致多條道路被封閉。位於聖安東尼奧（San Antonio）的某所學校，還緊急疏散學生，更有住戶通報表示，地下室與車庫完全被淹沒，通往主要機場的部分道路也被迫關閉。
由於去（2024）年瓦倫西亞曾發生嚴重洪災，造成約230人死亡，所以當局此次格外緊張，強烈呼籲民眾嚴格遵循安全指示，居民的手機也收到官方通知，解釋避免外出與避開封鎖道路的重要性。
熱門賽事、球星動態不漏接
不用抽 不用搶 現在用APP看新聞 保證天天中獎　 點我下載APP　 按我看活動辦法",自由時報,2025-09-30,https://img.ltn.com.tw/Upload/news/600/2025/09/30/phpci7tim.jpg,True
烏克蘭敖德薩暴雨成災　至少9死救援晝夜不停,https://money.udn.com/money/story/5599/9043363,"烏克蘭國家緊急情況服務局今天說，南部城市敖德薩（Odesa）遭遇嚴重暴風雨，造成至少9人喪生，包括1名兒童。
法新社報導，敖德薩市長特魯哈諾夫（HennadiyTrukhanov）透過通訊軟體Telegram表示：「僅7小時內，敖德薩降雨量幾乎達到平常2個月的總和，任何雨水下水道系統都無法承受如此負荷。」
烏克蘭國家緊急情況服務局（State EmergencyService of Ukraine）貼文表示，目前已知有9人罹難，包括1名兒童。
數百名救難人員連夜撤離受困民眾、移除被困車輛並幫忙抽乾建築物積水。
官方統計，截至目前已成功救出362人。特魯哈諾夫承認現場情勢極度嚴峻，但強調「仍在掌握之中」。",經濟日報,2025-10-01,,True
烏克蘭南部暴雨成災 敖德薩9死、上百人受困,https://news.ltn.com.tw/news/world/breakingnews/5197417,"烏克蘭敖德薩州暴雨成災，傳出9人死亡，上百人受困待援。（法新社）
烏克蘭南部敖德薩州（Odesa）近日遭受暴雨侵襲，災情嚴重，烏克蘭總統澤倫斯基（Volodymyr Zelenskyy）與緊急服務部門指出，暴雨所引發的洪水已造成9人身亡，另外還有上千戶家庭斷電，數百人受困待救援。
《路透》報導，敖德薩地區緊急服務部門發言人阿維里娜（Maryna Averina）對烏克蘭電視台表示，洪水來襲時，有一戶住在公寓低樓層的5口之家無法及時逃脫，另外有3名婦女在道路上被洪水沖走，不幸身亡。
澤倫斯基在X平台發文說：「敖德薩這些日子的情況很糟糕，9人因天災死亡，其中包括1名孩童。」他補充說，有1名死者下落不明，目前仍在查證。
敖德薩市長特魯哈諾夫（Hennadiy Trukhanov）在社交通訊平台Telegram發文說明洪災成因：「在僅僅7小時內，幾乎等同2個月的雨量都灌到了敖德薩。沒有一種排水系統可以承受這種負荷。」
敖德薩州長基佩爾（Oleh Kiper）指出，逾500名救難人員已投入救災，當前境內32座村莊仍有斷電情況，估計4萬2000人受影響。
熱門賽事、球星動態不漏接
不用抽 不用搶 現在用APP看新聞 保證天天中獎　 點我下載APP　 按我看活動辦法",自由時報,2025-10-01,https://img.ltn.com.tw/Upload/news/600/2025/10/01/phpBmHj3a.jpg,True
印度北部暴雨山崩沖落巴士 至少15死、多人失蹤,https://news.ltn.com.tw/amp/news/world/breakingnews/5204306,"當地時間7日晚間印度北部1輛巴士在山區行駛時遇到山崩，泥石流瞬間沖落巴士，造成至少15死、多人失蹤。（美聯社）
〔即時新聞／綜合報導〕印度北部連日暴雨，造成山區土石鬆軟，當地時間7日晚間1輛巴士在山區行駛時遇到山崩，泥石流瞬間沖落巴士，造成至少15死、多人失蹤。
據《美聯社》報導，印度北部喜馬偕爾邦在週二晚間發生大規模山體滑坡，泥石流襲擊1輛公共汽車，當時車上至少有20至25名乘客，造成包括9名男子、4名女子和2名兒童在內至少15人死亡。
有3名兒童獲救送醫，目前相關單位正在持續尋找其他失蹤的乘客；自週一（6日）以來，該地區一直持續下雨，導致脆弱的山坡變得不穩定。報導指出，今年南亞地區的極端降雨導致多地發生洪水和山崩，這些地區包括印度、巴基斯坦、孟加拉、不丹、斯里蘭卡、阿富汗、馬爾地夫和尼泊爾。
免費訂閱 《自由體育》電子報 熱門賽事、球星動態不漏接
不用抽 不用搶 現在用APP看新聞 保證天天中獎　 點我下載APP　 按我看活動辦法",自由時報,2025-10-08,,True
快訊》屏東午後雨彈狂襲！低窪防淹水至深夜| 生活,https://newtalk.tw/news/view/2025-10-01/996722,"中央氣象署於今(01)日10月1日16時10分發布降雨特報， 午後對流雲系發展旺盛，易有短延時強降雨，今(1)日屏東地區有局部大雨發生的機率，請注意雷擊及強陣風，低窪地區請慎防積水。 預估影響持續至10月1日23時00分
◆大雨警戒區域1縣市受影響
本次大雨警戒範圍涵蓋以下縣市，請居住於此的民眾提高警覺：
屏東縣
全站首選：比樂天貴3倍！戰備水一瓶120元 國防部挨轟卻稱參考日本進口價
【查看中央氣象署即時降雨特報】
※Newtalk提醒您：降雨特報注意事項
健康風險：戶外濕滑易跌倒，行動請注意安全
建議穿著：降雨天氣建議選擇輕薄防水外套搭配透氣運動鞋，以保持乾爽與安全
為什麼雨衣大多都是黃色？黃色的高能見度，在雨霧中更易識別，提升安全哦！ 圖：Newtalk製表",Newtalk新聞,2025-10-01,https://images.newtalk.tw/resize_action2/800/album/news/997/68dce7f29a7cb.jpg,True
越南北部洪災 8死5失蹤多村淹沒3河水位創近40年新高,https://money.udn.com/money/story/5599/9058075?from=edn_search_tag_result,"麥德姆颱風帶來的豪雨造成越南北部出現破紀錄洪水，數個村莊的街道今天遭淹沒。越南環境部表示，多山的越北地區6日起爆發突發性洪水和土石流，至今已造成8人死亡、5人失蹤。
法新社報導，在越南首都河內以北約80公里的太原市一帶，洪水高及車頂甚至屋頂，數以萬計民眾受困家中或被迫逃離水患。
越南氣象局表示，截至今天上午，貫穿太原市的梂江（Cau River）水位已較去年9月摩羯颱風來襲時創下的歷史紀錄28.81公尺高出1公尺多。
越南國營電視台報導，從昨晚到今天，越北的平江（Bang River）、滄江（Thuong River）和中江（Trung River，譯音）最高水位已達到接近40年高點，超過1986年以來未曾見過的水準。其中中江位在與中國接壤的諒山省，其最高水位預估將比原先紀錄高出近2公尺。
從昨天深夜到今天上午，太原、高平和諒山3省民眾的親友在社群媒體發文求援，指當地有停電及物資短缺情況。
有人寫道：「我們（在太原省的住家）1樓已完全淹沒。我的父母和5個小孩受困，沒有足夠的食物和水。昨晚開始就失去聯繫，他們急需協助。」類似貼文有數百則。
麥德姆（Matmo）颱風6日接近越南時強度雖已減弱，仍在越北釀成重大災情。1週前越南中部才遭到博羅依（Bualoi）颱風襲擊引發大規模洪災，造成至少56人死亡，經濟損失估計超過7億1000萬美元（約新台幣217億元）。
越南軍方表示，他們已在諒山省利用2架直升機在淹水地區空投了4公噸的水、泡麵、餅乾、牛奶和救生衣，以援助災民。",經濟日報,2025-10-08,https://uts.aralego.com/a/b798c0ea-3892-4fd9-8f09-581c393a2e3e.png,True
專家李鴻源示警：堰塞湖危機未解除 最壞情況「管湧導致壩體瞬間崩塌」,https://newtalk.tw/news/view/2025-09-27/995962,"馬太鞍溪堰塞湖溢流，大水無情地衝擊了花蓮光復，釀出慘重災損。綜合多家媒體報導，前內政部長、水利專家李鴻源週五（26日）針對馬太鞍溪堰塞湖災情提出分析。他指出，當前，湖內仍蓄積著逾千萬噸水，最壞情況恐發生「管湧現象」，導致壩體瞬間崩塌，洪峰抵達市區僅需 40多分鐘，疏散時間極其有限。
李鴻源強調，現階段應停止政治爭論，優先協助災民恢復生活，並加速處理堰塞湖危機。
現正最夯：比樂天貴3倍！戰備水一瓶120元 國防部挨轟卻稱參考日本進口價
李鴻源在節目《57 爆新聞》中表示，糾結於「溢流」或「潰堤」等名詞毫無意義，重點應放在災民安置與堰塞湖處理。他分析，堰塞湖內不僅有 2,000多萬噸水，還含有飽和土石，若遇管湧現象，水流帶走土石，將使壩體迅速破裂，導致大水瞬間傾瀉，造成二次災害。李鴻源提到，理想情況是藉颱風洪水自然沖散湖體，但最壞情況即為管湧，必須嚴防。
《CTWANT》進一步報導，李鴻源指出，專業團隊模擬堤防被衝破與淹水範圍，發現影響規模遠大於預估，因此將新的資料交給內政部，才會有「必須疏散 8,000人」的結論；但也坦言，花蓮縣政府無力獨自完成 8,000人大規模疏散，即使中央派國軍支援，也難以在一天半內達成，因此「垂直避難」成為保命手段。
李鴻源解釋，如同日本 311 地震，當一樓遭淹沒時，往高處逃生是不得已、卻是必要之選。此外，馬太鞍溪河床淤積嚴重，堤防高度不足，未來 10 至 20 年淹水風險高，需中央長期因應。
現正最夯：黃國昌狗仔偷拍名單曝光！媒體爆4院長、3大秘書長、警察首長全遭跟監
關於責任歸屬，李鴻源認為，可透過電腦模擬與公文紀錄釐清，若公務員涉不作為，災民可申請國賠。但他重申，現階段應聚焦救災與復原，尤其是大量垃圾與淤泥清理，並呼籲政治人物停止口角，避免將災難政治化。他強調，在美國，此類災害會由副總統調動全國資源，台灣也應以人道為優先，整合中央與地方力量共同應對。
李鴻源最後提醒，堰塞湖問題本質是專業技術課題，但後續應變關乎人命，各界應齊心協力，避免悲劇重演。
當前花蓮堰塞湖內仍蓄積逾千萬噸水，最壞情況可能發生「管湧現象」。   圖：花蓮縣政府／提供",Newtalk新聞,2025-09-27,https://images.newtalk.tw/resize_action2/800/album/news/996/68d26ed46d36c.jpg,True
颱風博羅依狂襲越南釀19死88傷 逾10萬戶民宅、萬頃農地被淹,https://news.ltn.com.tw/news/world/breakingnews/5195510,"越南政府30日證實，颱風博羅依造成的死傷已攀升至19死、88傷，另有21人失蹤。（法新社）
越南政府30日表示，颱風博羅依（Bualoi）造成的死傷已攀升至19死、88傷，另有21人失蹤。博羅依是今年侵襲越南最具破壞性的颱風，驚人雨量導致首都河內（Hanoi）及北部多個省分發生嚴重洪災。
《路透》報導，颱風博羅依29日登陸越南中北部，帶來巨浪、強風和暴雨，目前已減弱為熱帶性低氣壓。上週，博羅依也曾在菲律賓造成至少10人死亡。
請繼續往下閱讀...
越南政府指出，颱風造成88人受傷，超過10萬戶民宅受損，其中大部分位於義安省（Nghe An）與河靜省（Ha Tinh），且有逾1萬公頃水稻和農作物被淹。
越南國家氣象局表示，過去24小時內，越南部分地區的降雨量已突破300毫米，並警告有山崩和洪水風險。在首都河內，持續不斷的暴雨導致街道嚴重積水，市中心多處交通陷入癱瘓。
據越南官媒報導，截至30日，越南中北部的數個村莊仍遭洪水淹沒，不僅對外交通中斷，電力也停止供應。越南國家電視台（VTV）新聞畫面顯示，洪患導致義安省多個村莊的房屋直接被大水淹沒。
越南海岸線綿長，經常受到颱風侵襲，且境內排水設施匱乏，隨颱風而來的暴雨往往引發嚴重洪災。
颱風博羅依引發嚴重洪災，導致義安省多個村莊直接被大水淹沒。（法新社）
颱風博羅依引發嚴重洪災，導致義安省多個村莊直接被大水淹沒。（法新社）
熱門賽事、球星動態不漏接
不用抽 不用搶 現在用APP看新聞 保證天天中獎　 點我下載APP　 按我看活動辦法",自由時報,2025-09-30,https://img.ltn.com.tw/Upload/news/600/2025/09/30/phpOX6Mb4.jpg,True
颱風博羅依即將登陸越南 當局疏散民眾嚴陣以待,https://news.ltn.com.tw/news/world/breakingnews/5194128,"颱風「博羅依」威力持續增強且即將登陸越南，河內當局今天關閉受颱風威脅區域的機場，河內也開始出現降雨。（美聯社）
颱風「博羅依」威力持續增強且即將登陸越南，河內當局今天關閉受颱風威脅區域的機場，也疏散數以千計民眾。博羅依幾天前在菲律賓造成至少10人死亡，並引發嚴重洪災。
越南「青年報」（Thanh Nien）報導，截至格林威治標準時間10時（台灣時間傍晚6時），博羅依（Bualoi）的風速高達每小時133公里，預計當地時間明天凌晨登陸越南中部。
請繼續往下閱讀...
路透社報導，越南國家氣象預報機構指出，博羅依能同時引發多種天然災害，包括強風、暴雨、暴洪、土石流以及沿海地區淹水。
越南政府表示，國內中部河靜省（Ha Tinh）的相關部門已經開始疏散超過1萬5000位居民，軍隊也做好防災準備。
博羅依預計會在越南義安省（Nghe An）首府榮市（Vinh）登陸，當地民眾正趕緊加強固定房子並繫好船隻。
熱門賽事、球星動態不漏接
不用抽 不用搶 現在用APP看新聞 保證天天中獎　 點我下載APP　 按我看活動辦法",自由時報,2025-09-28,https://img.ltn.com.tw/Upload/news/600/2025/09/28/phpcvd4n7.jpg,True
日本福島近海地震推估規模4.9 無海嘯威脅,https://money.udn.com/money/story/5599/9053841?from=edn_search_tag_result,"日本福島縣近海今天上午9時30分（台北時間8時30分）左右發生推估規模4.9地震，最大震度4出現在福島縣雙葉町與浪江町。日本氣象廳表示，這起地震不會帶來海嘯威脅。
日本TBS電視台報導，日本氣象廳觀測，震央位於福島縣近海、深度約50公里，推估規模4.9。
日本放送協會（NHK）報導，宮城縣南部與福島縣中通地區，測得震度3。",經濟日報,2025-10-07,https://uts.aralego.com/a/4e7c031a-3320-45b5-a29c-5f9d08bf8e21.png,True
