標題,連結,內文,來源,時間,圖片
颶風奧斯卡登陸巴哈馬 朝古巴逼近,https://news.google.com/read/CBMiWkFVX3lxTE5uYVJrOHZfdWJZaXJNc1ZkR0F3NFpGSzVsLURRVlREcmtpdEVmc3hoMEJ5TmE3clRrUTRzTEYwNnRwQkF0ckxKRzBvQzg0XzVDN1k0X2xZU3RtUdIBX0FVX3lxTFByQUFqbG80b3YyZGFQRU9lSWJGc0hRSVVwNFczNFQyRVN2MVk0ZWhrZTlIZVQ5c1ZfZGdISEY5QWlWQ0hBYUpFYk1uTlNkVDBJUkx6ZVMzb3o1QTkzcGpF?hl=zh-TW&gl=TW&ceid=TW%3Azh-Hant,"美國國家颶風中心表示，颶風奧斯卡（Oscar）已登陸巴哈馬大伊納瓜島（Great Inagua Island），預計今天下午將抵達古巴關達那摩省（Guantanamo）或奧爾根省（Holguin）。
路透社報導，總部位於邁阿密（Miami）的國家颶風中心（National Hurricane Center）指出，颶風奧斯卡目前位於關達那摩東北東方向約241.4公里處，最大持續風速為每小時130公里。
國家颶風中心預計，颶風奧斯卡會在登陸古巴東北海岸後減弱，但在明天晚間移動到古巴北方，以及22日穿越巴哈馬中部時，可能仍會維持熱帶風暴的強度。
颶風奧斯卡逼近之際，古巴剛經歷多年來最嚴重的停電事故，正在努力恢復供電中。
國家颶風中心另表示，巴哈馬已將英國海外領土土克凱可群島（Turks and Caicos Islands）的颶風警告改為熱帶風暴警告。",經濟日報,2024-10-20,https://news.google.com/api/attachments/CC8iK0NnNWFkek5VY0VGcFowTjFZVE0zVFJESkFSajdBU2dCTWdhUmtwS0xQUWM=-w200-h112-p-df
暴雨又襲法國 水淹半個車身高里昂也受波及,https://news.google.com/read/CBMiuAJBVV95cUxQc09vem9RTlk1VzJBREdhaWhhSTFwZ2Z3NjhFTVF6VEt6UWg2WlFnNW1vaDB6ZlY1S2ZveE4tTUVIcjFGXy1VRkloQlRicmdBNEEtaUdRVUNoOFBGYW95OEVHLVBMX3pfbE5GNlFCSURfenM0S09mbmlUejF4SGV4ZlNUeWRrWXlodnJrX2NoeVlqRVVtZzM2RDlTNmhLM0YtbTJHc1U3aXhUYzkzWGFiZUc1UXhRMmEteDlZZTh2aWsxQ19FV0g0Y3RYVUYyYW95MVQwUU5ZR0dDeFFaRzdwUm1pTllKWFBRTnZTVjl0S0ZJaVR1REppTVZzLWlNQXVoamdmczF0OEpDU0pJOFppMm4xVnFSR1NCQjZrOVhRZjQyVTF3Q3BtdGNPQWNYQl93OC01STlXbk0?hl=zh-TW&gl=TW&ceid=TW%3Azh-Hant,"平常做好演練，遇到災難時，才有餘力因應，因為現在氣候實在太難預測，今天國際關鍵字「暴雨紅色警報」，就來看到法國暴雨來襲，有6個省份，因為「異常降雨」，進入洪水紅色警報，法國氣象局表示，其中一個地區48小時內，降雨量高達630毫米，更有省分24小時降雨量，就達500毫米。法國官員表示，這樣的暴雨是前所未見。
湍急洪水，水勢驚人，汽車甚至被整台捲走，毫無招架能力。
法國暴雨，有6個省份因「異常降雨」進入洪水紅色警報，法國氣象局表示，其中一個地區，48小時內降雨量高達630毫米。嚇得民眾直呼，從來沒看過這種事。
民眾孟塔娜：「這真的非常驚人，我從沒看過這樣的情況，住在大樓裡 老一輩的人也說，他們也沒看過這種事。」
2601洪水淹過半個車身，里昂郊外商業中心的汽車許多被洪水淹沒。法國氣象局指出，隆河地區已進入洪水紅色警戒狀態。阿代什省（Ardeche）也遭遇嚴重洪水，24小時降雨量500毫米，法國官員說，當地的暴雨是前所未見的。民眾也深感震驚。
民眾杜克魯斯：「地下室是鄰居開的披薩店，整個被洪水淹到頂了，這邊也有水淹進來，看 洪水還在不斷湧入。」
消防救難車輛 緊急出動，因為街道變成小河，許多車輛受困。
更多 大愛新聞 報導：
從伊比利半島到法國 柯克風暴釀重災
庇里牛斯山下理髮廳 九旬師傅不言退",Yahoo奇摩新聞,2024-10-19,https://news.google.com/api/attachments/CC8iK0NnNWtMVFp2YzA1clkzUmtSM2xyVFJDb0FSaXNBaWdCTWdZQmdZRUY4UUE=-w200-h112-p-df
颶風侵襲也要投票！ 喬治亞州提前投票創紀錄 佛州郵寄選票挺賀vs. 挺川 54：46,https://news.google.com/read/CBMiWkFVX3lxTE1iYkJQbWROcWswMTBDTmJPYVg0NTBNZ2RqcmJ2Nm9ma1J6alRoUUFXVkFWMDh1WHFMeFh5WmtWRGJQdjJSVWtBcUJkV1RIVFNhcTBRb3M4TEV0Zw?hl=zh-TW&gl=TW&ceid=TW%3Azh-Hant,"隨著 2024 美國大選的日期逐漸逼近，全美各地的民眾紛紛在各州指定的時間內，透過提前投票、郵寄選票等方式，向自己支持的候選人投下神聖的一票。近期有美媒報導稱，即使受到颶風海倫的侵襲，仍然沒有澆滅喬治亞州以及佛羅里達州選民的熱情，兩州分別已經有 32 萬、 40 萬選民完成了投票程序，喬治亞州的提前投票人數更是創下了歷史新高。
根據美國《有線電視新聞網》( CNN ) 報導，喬治亞州國務卿辦公室的工作人員加布．斯特林 ( Gabe Sterling ) 在 X 上發布推文稱，截至當地時間 15 日為止，總計有超過 328,000 位喬治亞州的選民已經完成提前投票的程序。斯特琳也在推文中表示，在 2020 年美國總統大選期間，該州總計只有 136,000 人透過提前投票的方式進行選舉，僅不到今年 ( 2024 年) 的一半。
另一方面，許多住在喬治亞州的民眾，也對此次選舉投票的過程感到滿意。一位名為科林．加拿大(Corine Canada ) 的選民接受《 CNN 》訪問時表示，他在 2020 年美國總統大選期間，僅能透過交通工具前往較大的城鎮進行投票，且投票所工作人員十分稀少，因為效率低下導致整個投票所外都排著長長的人龍，許多無法忍耐排隊的民眾，最終都選擇放棄投票，回到自己的工作崗位上。
一位喬治亞州的選舉官員受訪時指出，該州截至目前為止，已經收到超過 25 萬名選民的約席投票申請，預計該數據下周將增加至 30 萬人。該報導稱，部分州選擇透過法律，收緊對於缺席投票的規則，並限制這些選民利用投票箱的可能性，這也導致許多選民認為，比起郵寄選票，普通民眾更可能透過親自投票的方式，展現自己的民意。
X 推主「 Alex Chen 」也分享了美國 Medias Touch Network 發表的統計資料，稱截至 14 日為止，同樣與喬治亞州受到颶風侵襲，也被稱為「川普後院」的佛羅里達州，一共收到了 227,222 張支持民主黨候選人賀錦麗的郵寄選票，支持共和黨候選人川普的郵寄選票則有 192,336 張，雙方的比例接近 54：46 。
「 Alex Chen 」表示，距離大選宣告結束還有近兩週的時間，此時透過佛羅里達一州公布的數據進行分析，「可能還太早了」。「 Alex Chen 」也強調，大多數的共和黨支持者都喜歡在投票日當天，以現場排隊的方式進行投票，認為選舉結果仍可能出現變數。",Newtalk新聞,2024-10-16,https://news.google.com/api/attachments/CC8iL0NnNTBjVFY2VkdsblNYcHRVV2xxVFJDWkFSaXNBaWdCTWdrVklwNzFHQ3FpcFFJ=-w200-h112-p-df
古巴禍不單行 全國大停電後颶風接著來,https://news.google.com/read/CBMiWkFVX3lxTE0xMVRhRVZyYjd3alhxNUhpeEpuazhLa25lUmJFbExRT0FTbVhXYzRLdnlDSlVWQjc4T25oSWRnLW55Qm9vamhqOEdQaW1keU9rdHZHVlVWcWdfUdIBX0FVX3lxTE1POG9qTkgybVpkTGdyRWFsYkt5b3g5TGEzSUpOQ2pLNGw0dnpUNEktYU9xcnczVDlVVk41TXNENnlxTXl4blQ5RUF6M1hxSW5hVm9JWTNwSVMzOFJZYTlj?hl=zh-TW&gl=TW&ceid=TW%3Azh-Hant,"島國古巴全國大停電後，當局今天正忙著復電，與此同時，颶風奧斯卡（Oscar）正朝著古巴步步逼近，附近的美洲國家巴哈馬、英國海外領土土克凱可群島也發布颶風警報。
路透社報導，美國國家颶風中心（NHC）昨天表示，古巴已對奧爾根省（Holguin）及關達那摩省（Guantanamo）發布颶風警報，預計今晚奧斯卡就會在古巴登陸。
奧斯卡是在土克凱可群島（Turks and CaicosIslands）東方形成。根據NHC，土克凱可群島與巴哈馬也發布颶風警報。
法新社引述NHC公告指出，奧斯卡挾帶時速140公里的強風，預計今天會在古巴東部登陸，為當地帶來大雨。
古巴總統狄亞士─卡奈（Miguel Diaz-Canel）在社群媒體貼文表示，由於颶風奧斯卡即將來襲，東部當局正努力保護人民與經濟資源。
古巴最近剛發生國家電網在24小時內2度停擺的事故，導致數以百萬計的國民無電可用，政府昨晚表示全島近1/5民眾已復電。
這次空前全國大停電是古巴遭遇的最新一次打擊，人口1000萬的古巴本來就面臨糧食、醫藥和燃料嚴重短缺的問題。
美國18日否認涉入古巴停電事故。",經濟日報,2024-10-20,https://news.google.com/api/attachments/CC8iK0NnNWFkek5VY0VGcFowTjFZVE0zVFJESkFSajdBU2dCTWdhUmtwS0xQUWM=-w200-h112-p-df
影／土耳其5.9地震引發恐慌！民眾驚逃,https://news.google.com/read/CBMi9AFBVV95cUxQV0pyY2FQLWh5WnBaUWR1T1ZKXzVORHZ5WGpjZmRzN0xGNWVYeEZQMFBuTWxwRm1vcWtfUWc1UGxVT0tpZTRFMV83Y21oTExYR21zT0FGWkhPQzRnbFR4V0dGS1ZVS3hnUFVOZHRvZ2hvaDJOZ1I1UzEzYkNOdDJYazhRVUpFbUd1aGdTRU15dGdRdFBDTTFLdVJlNHVIR1pmeWJoUHg3WUpabndNMHZWYmlvbkdfSUpuVkpBbFJMUThzSEZ1X2lScUtPWjNzbXdnV0k1YjhXbVNnai1KYS1MMkw2WXhaYVJvV3VyWHZyQWNfbmNz?hl=zh-TW&gl=TW&ceid=TW%3Azh-Hant,"[NOWnews今日新聞] 土耳其中部的馬拉蒂亞省（Malatya），當地時間週三發生規模5.9地震，深度僅10公里，大批民眾驚惶逃至室外，已知有超過40人在醫院接受觀察，但所幸沒有重大傷亡或經濟損失的報告傳出。
綜合《美聯社》等外媒報導，土耳其災害和緊急事務管理局（AFAD）表示，地震發生在當地時間16日上午10點46分，鄰近地區甚至遠至敘利亞北部都有震感，許多民眾逃至大街上，地震結束後好一段時間後，仍不敢返回室內。
馬拉蒂亞省和鄰近的埃拉澤（Elazig），當地學校緊急關閉，土國內政部長耶利卡亞（Ali Yerlikaya）表示，近190人受到地震影響，其中43人正在醫院接受觀察。
埃拉澤市長塞里福古拉里（Sahin Serifogullari）則指出，當天有十幾人在驚慌之下跳出窗戶，所幸都只受到輕傷。《BBC》的一段畫面顯示，地震時一群人差點被高空掉落的碎片砸中。
值得注意的是，馬拉蒂亞是2023年土耳其-敘利亞大地震時，受災嚴重的11個省份之一。馬拉蒂亞省長亞武茲（Seddar Yavuz）透露，去年的大地震發生後，當地許多面臨倒塌風險的建築物，基本上都已經拆除或進行人口疏散。
更多 NOWnews 今日新聞 報導
在野議員被判當選無效！土耳其國會大鬥毆 數十人打成一團濺血
林郁婷被比X手勢羞辱！土耳其部長還轉發幫腔 土粉留言輸不起
林郁婷遭土耳其對手比X手勢！她IG被洗版後「禁評」 轉私帳",Yahoo奇摩新聞,2024-10-17,https://news.google.com/api/attachments/CC8iK0NnNVZkMGhZWTJ0eGJEWlpUVzFXVFJDNUFSaVJBaWdCTWdhWk00WlBJUWM=-w200-h112-p-df
土敘強震受重創 土耳其東部再傳5.9地震暫無傷亡,https://news.google.com/read/CBMiWkFVX3lxTE5kcmpLOXg3MHFyX1lSNERJa1NIYWlUSmx1NGZQXzlHSWV4MnBEY1NKaGtHc1F1MU1SUDJseGQ0aDdBb29XdW9mWGo1VS1YeENuSVlqdlBnS1lJd9IBX0FVX3lxTE9PYTdJRU1mTjdsX1lGc0hQWFRHMkpuck1QT3BCdlZUakFNYldadWJCQl9JaTRqWEJSdjJYbGFrZl9CLThsVUt1UmZpWmNDVFk3WUpJcnRacnpJcHpTLWhN?hl=zh-TW&gl=TW&ceid=TW%3Azh-Hant,"土耳其東部今天發生規模5.9地震，官員表示，許多地區都受到影響，暫無人員受傷通報。
法新社報導，馬拉特雅省（Malatya）卡內市（Kale）當地時間上午10時46分發生規模5.9地震。土耳其和敘利亞邊境去年2月6日發生規模7.8強震，在土耳其和敘利亞分別造成超過5萬3500人、將近6000人死亡。馬拉特雅省當時也遭到重創。
土耳其災害與應變管理署（AFAD）在X平台發文表示：「規模5.9地震過後，截至目前沒有喪失生命和財產毀損。」
但是不久之後，內政部長耶里卡亞（Ali Yerlikaya）表示，位在3個不同區域的3棟建築「部分倒塌」，緊急服務機構已接獲數十通求助電話。
路透社報導，敘利亞國營通訊社指出，東北部代爾祖爾省（Deir al-Zor）的哈沙卡（Hasakah）和西北部阿勒坡省（Aleppo）也感受到搖晃。
歐洲地中海地震中心（European-MediterraneanSeismological Centre）測報這起地震規模為6.1，震源深度為9公里。",經濟日報,2024-10-16,https://news.google.com/api/attachments/CC8iK0NnNWFkek5VY0VGcFowTjFZVE0zVFJESkFSajdBU2dCTWdhUmtwS0xQUWM=-w200-h112-p-df
