標題,連結,內文,來源,時間,圖片
暴雨又襲法國 水淹半個車身高里昂也受波及,https://news.google.com/read/CBMiuAJBVV95cUxQc09vem9RTlk1VzJBREdhaWhhSTFwZ2Z3NjhFTVF6VEt6UWg2WlFnNW1vaDB6ZlY1S2ZveE4tTUVIcjFGXy1VRkloQlRicmdBNEEtaUdRVUNoOFBGYW95OEVHLVBMX3pfbE5GNlFCSURfenM0S09mbmlUejF4SGV4ZlNUeWRrWXlodnJrX2NoeVlqRVVtZzM2RDlTNmhLM0YtbTJHc1U3aXhUYzkzWGFiZUc1UXhRMmEteDlZZTh2aWsxQ19FV0g0Y3RYVUYyYW95MVQwUU5ZR0dDeFFaRzdwUm1pTllKWFBRTnZTVjl0S0ZJaVR1REppTVZzLWlNQXVoamdmczF0OEpDU0pJOFppMm4xVnFSR1NCQjZrOVhRZjQyVTF3Q3BtdGNPQWNYQl93OC01STlXbk0?hl=zh-TW&gl=TW&ceid=TW%3Azh-Hant,"平常做好演練，遇到災難時，才有餘力因應，因為現在氣候實在太難預測，今天國際關鍵字「暴雨紅色警報」，就來看到法國暴雨來襲，有6個省份，因為「異常降雨」，進入洪水紅色警報，法國氣象局表示，其中一個地區48小時內，降雨量高達630毫米，更有省分24小時降雨量，就達500毫米。法國官員表示，這樣的暴雨是前所未見。
湍急洪水，水勢驚人，汽車甚至被整台捲走，毫無招架能力。
法國暴雨，有6個省份因「異常降雨」進入洪水紅色警報，法國氣象局表示，其中一個地區，48小時內降雨量高達630毫米。嚇得民眾直呼，從來沒看過這種事。
民眾孟塔娜：「這真的非常驚人，我從沒看過這樣的情況，住在大樓裡 老一輩的人也說，他們也沒看過這種事。」
2601洪水淹過半個車身，里昂郊外商業中心的汽車許多被洪水淹沒。法國氣象局指出，隆河地區已進入洪水紅色警戒狀態。阿代什省（Ardeche）也遭遇嚴重洪水，24小時降雨量500毫米，法國官員說，當地的暴雨是前所未見的。民眾也深感震驚。
民眾杜克魯斯：「地下室是鄰居開的披薩店，整個被洪水淹到頂了，這邊也有水淹進來，看 洪水還在不斷湧入。」
消防救難車輛 緊急出動，因為街道變成小河，許多車輛受困。
更多 大愛新聞 報導：
從伊比利半島到法國 柯克風暴釀重災
庇里牛斯山下理髮廳 九旬師傅不言退",Yahoo奇摩新聞,2024-10-18,https://news.google.com/api/attachments/CC8iI0NnNWtMVFp2YzA1clkzUmtSM2xyVFJDb0FSaXNBaWdCTWdB=-w200-h112-p-df
(影) 遼寧、河北、天津、江蘇海水倒灌！沿海地區連日暴雨引發嚴重災情| 中國,https://news.google.com/read/CBMiWkFVX3lxTE1FczFiU09IaUJiajlVaThTYnhJNVNaWUpFeENwR1N1Q2tCOHVlVnQ1VjI0bk4wWk5JM1NTQTVnaTdfN2R6V0lVMTFOcU94S1QtRWt2c21WSUJzUQ?hl=zh-TW&gl=TW&ceid=TW%3Azh-Hant,"據《中國氣象報》報導，近日中國北方多個沿海地區，包含遼寧、河北、天津和江蘇，出現大規模海水倒灌現象。這一異常情況主要是由於持續性的強降雨和颶風影響，導致海水倒灌至內陸，並造成沿海城市洪水氾濫，對當地的基礎設施與居民生活帶來嚴重衝擊。
據《遼寧日報》指出，遼寧沿海地區是此次海水倒灌災情較為嚴重的省份之一，特別是在大連市與葫蘆島市，海水倒灌進入市區，造成部分道路被淹沒，許多低窪地區居民被迫撤離。當地政府已緊急啟動防洪應急措施，並對困民眾進行撤離與安置。
河北方面，據《河北新聞網》報導，秦皇島市同樣面臨海水倒灌的威脅。大雨和強風導致海平面上升，海水倒灌進入沿海城鎮，當地漁業和農業生產受到嚴重影響。多處農田被淹沒，當地政府正積極組織救援行動。
天津市也未能倖免，據《津雲》新聞報導，天津沿海地區由於降雨量創下新高，導致海水倒灌進入部分市區，尤其是在濱海新區，水位快速上升，使得部分道路無法通行，居民區停電。市政府已經佈署了大型抽水設備，努力降低水位，並持續關注未來幾天的天氣變化。
在江蘇，據《江蘇日報》報導，海水倒灌主要影響了鹽城、南通等沿海城市。當地河流水位暴漲，海水倒灌進入當地一些鄉村，部分村莊的房屋被淹沒。江蘇省應急管理部門已迅速組織救援，並疏散了受影響地區的居民。
根據《中國氣象台》的預測，未來幾天沿海地區的降雨還將持續，各地防汛抗洪形勢依然嚴峻。各省市政府已經發布了洪水紅色預警，提醒民眾提高警覺，避免前往危險地區。
近日中國北方多個沿海地區，包含遼寧、河北、天津和江蘇，出現大規模海水倒灌現象。   圖片來源 : X帳號@NTDChinese",Newtalk新聞,2024-10-20,https://news.google.com/api/attachments/CC8iK0NnNXZjblp2VUVWeGRFaE5WV1EzVFJDeEFSaWRBaWdCTWdZQkFKN25EQW8=-w200-h112-p-df
菲律賓正值雨季 鉤端螺旋體病例激增,https://news.google.com/read/CBMiWkFVX3lxTE1YcEZ3aWU1NnZfWU1KYTh0RXVYb2dvUDlKT0hnbUlYVmt5aGt4VkxlOWtFMk01ZnJ3SFZkdmRHb180VElXRWFDV1ZKdkdldGVGSHk2QWI3cTBuZ9IBX0FVX3lxTFBPMl9MeW9UUVdkY2lmRDhXb2FudGJ0WVJ2YXJ3TV9EcGVsOE8yalF4SllFZS0wQnRteXFJZ3ZMQXRQUVNqekRzUUlNQVJPVllqR2JNNXFsS2hqbWxZRE1F?hl=zh-TW&gl=TW&ceid=TW%3Azh-Hant,"菲律賓衛生部數據顯示，鉤端螺旋體病病例累計直逼6000例，死亡率8.72%，雨季期間病例更是急速增加，赴菲旅遊應注意防範，避免涉水。
根據菲律賓衛生部（DOH）今天公布的數據，今年截至10月5日，菲律賓各大醫院通報了5835例鉤端螺旋體病病例，較去年同期的5050例增加16%，累計509例死亡，死亡率8.72%。
9月8日至21日的兩週期間，全菲律賓新增774例鉤端螺旋體病（Leptospirosis）病例，較8月25日至9月7日兩週期間的381例，高出兩倍有餘。
菲律賓衛生部長荷博沙（Teodoro Herbosa）表示，未來數週預期還會下更多雨，民眾應避免涉水，若是不得已必須涉水，應穿雨鞋，並儘快清洗浸到積水的皮膚，降低感染機率。
荷博沙也建議，涉水後即使沒有任何感染徵兆，最好還是到附近診所或醫院檢查。
鉤端螺旋體病細菌主要透過動物尿液污染水源及土壤，特別是鼠尿，進而傳染人類，潛伏期通常為10天左右。常見症狀包括高燒、肌肉酸痛、黃疸、小便困難、頭疼及咳血等，若擴散至肝、腦及腎等器官，可以致命。
6月至11月一般是菲律賓的雨季，許多地區因排水系統不佳，每逢大雨就淹水，深甚至及胸，垃圾及汙染物漂浮，如果皮膚有傷口涉水，有可能感染鉤端螺旋體病，這段期間赴菲旅遊的民眾應注意防範。",經濟日報,2024-10-17,https://news.google.com/api/attachments/CC8iK0NnNWFkek5VY0VGcFowTjFZVE0zVFJESkFSajdBU2dCTWdhUmtwS0xQUWM=-w200-h112-p-df
洪災摧毀孟加拉110萬公噸稻米 政府擬增加進口,https://news.google.com/read/CBMikAFBVV95cUxQa0IyQUhlMHl6bXMzU2c1QU0xY1haR25fXzBoaVpKNTl3TXlxT2o2Zm11dHFjWjEzcjV3Mk9uRmtWOXBGNU1nWkRZQmRCVU0wOXVsNlFZTmJiQjVEQjVFNzhGVXA4MXRvbS1SQ2haZ0NwWndMek1XOWtSWXB5Mm9oYUxJal9PaVJ4VXNWem9Nd1_SAV9BVV95cUxQNXdiOTRTd3UxZE81U3lQWHJKdVZzWVNLdmJqVkJpOHRaSFg2WVBVRjVoUjVKQ0xKeDBtSUhLZjJ2aVRoek5lWHZLeV9aVVR6NWw5NVpLajNMMU5WSmM1OA?hl=zh-TW&gl=TW&ceid=TW%3Azh-Hant,"根據孟加拉農業部的資料，據估計，洪災已摧毀當地約110萬公噸的稻米，促使該國在食品價格飆升的情況下，增加稻米這種主食的進口。
路透社報導，由強烈季風降雨和上游逕流帶來的洪水分別在8月及10月兩次衝擊孟加拉，造成至少75人死亡、數百萬人受影響，尤其是農作物受損最嚴重的東部和北部地區。
孟加拉農業部表示，今年的洪災造成稻米產量大幅下降。一名糧食部門官員表示，政府正在加速進口50萬噸稻米，預計很快會允許私人企業進口。
在致命抗議迫使孟加拉前總理哈希納（SheikhHasina）逃亡印度後，孟加拉臨時政府於今年8月上台，這個臨時政府一直努力穩定近幾個月來飆升已近20%的糧食價格。
孟加拉的進口量增加可能會提升鄰國印度的出貨量。印度是全球最大的稻米出口國，並在上個月將預熟米的出口稅降至10%。
孟加拉是全球第3大稻米生產國，通常每年會生產近4000萬噸稻米，以供應1億7000萬人口的需求。然而，自然災害經常影響生產，導致孟加拉增加對進口的依賴。",經濟日報,2024-10-19,https://news.google.com/api/attachments/CC8iK0NnNWFkek5VY0VGcFowTjFZVE0zVFJESkFSajdBU2dCTWdhUmtwS0xQUWM=-w200-h112-p-df
明恐有熱帶低壓生成！路徑變化大氣象署坦言：秋颱難預測| 生活,https://news.google.com/read/CBMiWkFVX3lxTE1TeGFyWkZ6T245YmRGNVhRUlRvM0V1SDhOa1NUR2YxQTlvaWYzZnN5cjh2YktMbHBNSUVNZ1pKRHh3QWpSb2ZxLVlJNWhjNTZYWnAxUUFWWVZldw?hl=zh-TW&gl=TW&ceid=TW%3Azh-Hant,"10月仍可能有颱風生成，現於關島附近的94W，最快今(20)日或是明日，就會發展成熱帶性低氣壓。對此，中央氣象署表示，颱風的規模與路徑仍需觀察，預報員葉致均表示，因秋天颱風除受太平洋高壓導引之外，還有北方高壓或鋒面系統影響，路徑分歧難預測。
氣象署預報員葉致鈞指出，目前菲律賓東方是個大低壓帶，有一個低壓系統正在發展當中。以目前預報資料來看，最快在今、明天有進一步形成熱帶性低氣壓，甚至成颱風的機會。
路徑部分，葉致鈞指出，短期先偏西移動，往呂宋島東方海面、往南海前進，也有部分的模式有顯示，移動到呂宋島東方海面時，可能往東北方向、逐漸往有往北的方向去做移動的路徑。
葉致鈞強調，秋天颱風難預測，主要就是受到太平洋副熱帶高壓的導引而有路徑的變化，但是到了秋天，除了北方高壓會有南下的狀況，加上還有鋒面系統。秋颱除了在太平洋高壓的導引之外，還有北方高壓或鋒面系統，也都會影響到颱風的路徑，因此目前菲律賓東方海面的熱帶系統，路徑分歧仍然相當大。
 ",Newtalk新聞,2024-10-19,https://news.google.com/api/attachments/CC8iJ0NnNU1TSGt0VTFaNldXZHRUazVxVFJEQ0FSaURBaWdCTWdNNUlBRQ=-w200-h112-p-df
香港猴群集體暴斃！人畜共通「類鼻疽」惹禍 台96人感染創新高,https://news.google.com/read/CBMi-wJBVV95cUxQV21Rdmx6MHdKNkxjMUlIZjEwanRpUVg3OEJ5QTB0SHl5dHNtc1pqTXd3TDVIRFluM0dMWTZZYWdjb2k5Y1o5eDY2MUJKQkR6Mms2YlJNY0stT0k4ZXJnY05kTWNkR1JaZ3p0YXFtUEttTGE4aS1hdURRVzlaak9WUFQ1VGxYSVhjczF5U0F0dU8xck1XQlN2cDRaanNKS2ZQa2RCa2FnRUZmUktpQjQ1aU9xMGVIZkxQa05Jbk1abllxMjl2aUhZeU9LQjJVNUdaQ0QtbldjZjhVRnExS2U1NUJ4QnhRd3JSLWo2MEthZmd3Vl9VcnlReGpwczRtSkl3NVctX3ZTUk0tNGNpQl9LMmxHekRjdUs4TnduLTl2dnRIcWF4VTJINldvSUl6N0xEdW53S09yT3ZtWnJ3VDRYMUh5Z2RUZER6RnU0N0lEZmN5akEzQkNrWjExdXJxbHF4SVZ0RzRBMUdpMmtNRnhfUFd5RlpEbkFORXJN?hl=zh-TW&gl=TW&ceid=TW%3Azh-Hant,"【國際中心／綜合報導】香港動物園近來驚傳大批猴子暴斃，截至20日共有11隻死亡，當中9隻確認死於人畜共通的類鼻疽，國內今年也有歷來最多的96人感染。
綜合港媒報導，香港中環附近的動植物公園13日當天曾傳出8隻猴子集體暴斃，加上20日的松鼠猴，累計共11隻猴子死亡。追查元兇發現其中9隻死於由類鼻疽桿菌引起的敗血病，園方也因此關閉哺乳類動物園區。
港府研判猴子死亡可能是因為園內翻修時，員工鞋底沾到有細菌的泥土，導致猴子感染，之後在猴群間擴散，潛伏期約為1星期。
我疾管署指出，颱風後1個月是類鼻疽好發期，山陀兒颱風雖然已經遠離，不過上週國內新增本土類鼻疽病例，住院治療中，今年累計共96例，是2001年開始紀錄以來最高。
醫師表示，類鼻疽一般不會人傳人或經動物傳人，不過可能因傷口接觸受汙染的土壤、汙水汙泥等，或吸入有病菌的塵土水汽而感染，提醒民眾避免直接暴露在汙水汙泥中。糖尿病、肝、腎、肺疾病患者，癌症或免疫功能缺損的民眾，較可能出現重症，風災期間盡量待在室內、避免開窗，或室內外都配戴口罩。
【看原文連結】
更多壹蘋新聞網報導
周杰倫演唱會逾4萬人散場有隱憂！ 議員爆大巨蛋沒模擬過「滿場疏散」
好戲來了！大谷翔平和「法官」全壘打都破50 世界大賽史上最重量級對決
霜降節氣到 3星座好人緣帶財",Yahoo奇摩新聞,2024-10-22,https://news.google.com/api/attachments/CC8iK0NnNW5aVlIwV0d4MUxVSXlXWGhaVFJDM0FSaVRBaWdCTWdZSlpZeEhwZ2M=-w200-h112-p-df
日本茨城縣推估規模4.3地震 無海嘯威脅,https://news.google.com/read/CBMiWkFVX3lxTE92TDljUTV1SS1uYy1NT3loRGJJR0xMejlHeVJ1dmRtT21IY1NkR0c5cldvdXlBMGtmNWNmQzZWWFoyT2sxdUNtTXNaS2YtT1d2OWNyeGVnRlJnd9IBX0FVX3lxTE01VFFfR3pweXJKWEZZc2VXcjQ5a1BTV3JyUUVKYmR5SHFVSnBWRENaMzQ5ejdHSDEya3dCOGRfNW9NbUMwRnJwOFo3VXUwNDRvRE5HLWgzRG5xdnRpUmx3?hl=zh-TW&gl=TW&ceid=TW%3Azh-Hant,"日本茨城縣南部在當地時間今天下午5時53分左右發生推估規模4.3地震，關東地方北部及埼玉縣被觀測到最大震度3級。這起地震不會帶來海嘯威脅。
日本放送協會（NHK）報導，日本氣象廳觀測，這起地震震源位於茨城縣南部、深度約50公里，推估規模4.3。被觀測到最大震度3級的地區包括茨城縣笠間市、栃木縣宇都宮市等地、群馬縣板倉町，及埼玉縣久喜市等地。
至於關東地方及福島縣的部分地區，也被觀測到震度2級或1級。",經濟日報,2024-10-15,https://news.google.com/api/attachments/CC8iK0NnNWFkek5VY0VGcFowTjFZVE0zVFJESkFSajdBU2dCTWdhUmtwS0xQUWM=-w200-h112-p-df
缺水危機 富國 GDP 恐萎縮8%、窮國 GDP 萎縮15%,https://news.google.com/read/CBMiWkFVX3lxTFBsVTQxcjZnRVg2S2x1THZYbFhhVXlYa2tQSnVwU1VYRVFCMlEzcmhKWU1BVnpVVUJ5MWRJd2ZWcS1INDZpdnhhaHQ3UmlhNW1YYjVuTXVGRlk2Z9IBX0FVX3lxTE9DNUZNZnRCa3J2ZFFWa3Q0ZldCUE9jNzJ6NXNKeWtEWnB2aUQ5dzg5d3ZiQlVFUS1rX3M0MEx1NFc2QjYwdGVLV3I3UkQyNDRQTHE5UXN1Wm1LV3A5M3lF?hl=zh-TW&gl=TW&ceid=TW%3Azh-Hant,"全球水經濟委員會（GCEW）周三發表一份報告指出，如果不解決水資源短缺危機，到了2050年，富裕國家的國內生產毛額（GDP）可能平均萎縮8%，較貧窮國家的GDP則可能萎縮高達15%。根據該分析，提供補貼可能鼓勵過度用水，是導致危機的最重要因素之一。

該報告發現，全球近30億人口以及超過一半的糧食生產位於缺水問題日益嚴重的區域。歐洲南部、中國東北部和印度西北部等人口密度高的地區尤為脆弱。

除了森林砍伐和氣候變遷等常見因素外，這份報告的作者還將水資源危機日益惡化歸咎於一個較少為人知的問題：會導致用水過度的政府補貼。

報告說，「由於不合理的獎勵和不適當的政策，水經常管理不善。例如，對棉花和甘蔗的補貼，使全球最乾旱區域之一如南亞和中東也都栽種這些高耗水作物。全球每年在有害環境的農業補貼上至少花掉了5,500億美元，而扭曲性的補貼可能讓地下水每年損失掉13.2立方公里。相較下，美國農業每年用水也才1立方公里。」

研究人員指出，導致過度用水和環境惡化的大量補貼應該被轉向到鼓吹節約用水、保護和恢復淡水生態系統，並確保弱勢社區能取用潔淨的水。他們呼籲重新考量水資源的定價，以協助緩解即將降臨的風險。

GCEW共同主席、現任新加坡總統尚達曼（Tharman Shanmugaratnam）表示，雖然這個世界「尚未準備好討論一個全球水價，每個國家應該朝著把水資源短缺考慮進去的務實定價邁進。 」",經濟日報,2024-10-16,https://news.google.com/api/attachments/CC8iK0NnNTVTVWMxYm10cFRtVmtiRUpUVFJDM0FSaVRBaWdCTWdZbEE1YXRHUWs=-w200-h112-p-df
巴西、越南旱災衝擊！ 咖啡產量大減「恐釀漲價」,https://news.google.com/read/CBMirwJBVV95cUxPdmo1dmk2VDIyckpKS0lkbjVzYmthSUNkUTNQdGI5dWduVHRicVlBMVB6UmktVXFyMm9sLTI4TEg0NmlxbXY2OXBQS1J6US1ZQmNhZWRkV3A5U3VKblVCSWlneWF6YWhjS2ZBM3I4QUExa2R1Y2lRdkgzV3g0amxYRHlhX1RZcVVQbGd6VEtnb2hYSk8zTGJldGthUERhaVdUREZxTlU4NnVQbGY0anRFY3RaeVJheGxqQ1daMzI4bzNhcEN5elJCSjY3cU9KZkJQXy02VXY0WURTQU9uQ2Rxa2pGeURnLVN4ZXVLY3FoRGs3WVN6My1oOXg0RzJlYTFGdk1FWXZCSXV5eGxsaW1LS2lWOTVKVXZMT3JpRHJQNXlxSjR4TmlBV1JHYnkzZjA?hl=zh-TW&gl=TW&ceid=TW%3Azh-Hant,"天氣變幻莫測，農作物又只能仰賴天候吃飯，而世界最大的咖啡生產國巴西以及越南也遭遇嚴重的乾旱，造成咖啡豆產地收成下滑，進而影響到價格。
咖啡園老闆高福勝：「像這種枝條就要把它疏掉，你如果沒有疏的話，它到時候整個全部都是滿滿的，所以它空氣就進不去，陽光也射不進去然後病蟲害就多。」
連續幾日的大雨，除了可能引發病蟲害之外，對於成熟的咖啡果實，卻是負面威脅，因為果實會被打落到地面，而掉到地上的果實滯留太久就會開始發酵。
咖啡園老闆高福勝：「雨當然是也有關係，然後旱災的部分就是有時候，它可能會有幾十日沒有下雨，所以水分不足的情況之下，它的豆子生長情況會有改變，所以說它的空包的部分就會比較多，一般來講我們在抓咖啡的產量，就是一顆樹，大概是一磅，一磅指的是烘焙後的一磅平均啦，比方說我這邊有300顆，那應該年產應該有300磅對不對，其實沒有那麼多可能只有三分之一。」
天氣變幻莫測，農作物又只能仰賴，天候吃飯，實在不容易，尤其世界最大的咖啡生產國巴西，遭遇70多年來，最嚴重的乾旱，氣溫飆升到平均值之上，造成咖啡豆產地，收成下滑，天氣的影響，就連第二大咖啡生產國越南，也陷入同樣難題。」
咖啡廳員工抹茶：「因為我們家自己的豆子，是衣索比亞跟巴西的產區，然後比較影響到的是巴西那邊的豆子，因為他們旱災嘛，所以會影響到他們的產量，然後最直接影響是因為通膨，是每年都會持續逐漸的增長，然後所以就會影響到期貨，然後期貨就會影響到我們的廠商，所以我們跟他們叫貨的量會有漲價的部分。」
產量大減不得不反映在價格上，從國際咖啡組織，公布的市場報告來看，平均每磅漲到2.38美元相當於台幣77元，相比2023年同期上漲近55%。
咖啡廳員工抹茶：「我們自己老闆的方法是，因為客人我們主要還是吃比較熟客，就是跟他們建立良好關係，所以我們其實也很不想要，太這麼直接的去做調漲這件事情，所以我們的方法是可能像做人力上的調配，就一間店就是一個人顧，我們現在有三間店嘛，然後在之前還有中杯，然後現在就改成只有大杯。」
只賣大杯維持客單價，是業者的變通之道，而連鎖咖啡路易莎因為產量大，也因為咖啡期貨波動劇烈，因此在採購時也會進行期貨避險，但氣候變遷問題難解，恐怕未來咖啡的產量只會持續受到波及。
前氣象聯隊長/博士林得恩：「巴西跟越南的乾旱主要有兩個原因，第一個原因當然還是全球暖化，我們知道去年是創下，有氣象資料以來是最炎熱的一年，不過今年看起來非常的不樂觀，有機會再刷新去年的紀錄，以目前我們統計到9月份全球的氣溫，其實它已經連續14個月，打破了升溫1.5度C的這個危險的門檻。」
另外回溯到2023年，也受聖嬰現象影響，使得北大西洋附近的海溫升高，進而破壞了水循環的機制，也減少了降雨的機率，不過咖啡畢竟不是民生必需，但天氣的影響恐怕是許多農作物都難逃。
前氣象聯隊長/博士林得恩：「以巴西這次來講其實它有40%，幾乎都是它的國土都在這個亞馬遜河，那亞馬遜河也因為高溫也因為乾旱，也因為下雨減少等等，其實它已經有部分地方開始有了森林大火。」
尤其IPCC估計，自1961年以來氣候變遷，已經使得全球農業生產率降低了21%，現在正發生氣候變遷，影響層面也不是只有漲價這麼簡單。
更多 TVBS 報導
最高溫48度！摩洛哥熱浪1天死21人 專家：氣候變遷加聖嬰
產業邁向淨零轉型！友達喊話上下游並進 台積電盼從源頭減少原料
全球塑膠汙染 加州：埃克森美孚害的！「紐約氣候週」聚焦
70年一遇乾旱！咖啡豆2大產國受天災侵襲 明年價格恐爆漲",Yahoo奇摩新聞,2024-10-22,https://news.google.com/api/attachments/CC8iMkNnNUNhVUZhWm5wMWJYTmZWMWRFVFJDb0FSaXNBaWdCTWdzQkFJeUlGQ2RqVWhud3lB=-w200-h112-p-df
