標題,連結,內文,來源,時間,圖片
颶風奧斯卡襲古巴釀6死 哈瓦那多數地區恢復供電,https://news.google.com/read/CBMidEFVX3lxTE4tN0FUbjJ6eUhzbUZrZnFPQmZxNlRYRmdPbGF6d1I1b09zR2hweHdVejVNd3FtS2hhbDJwdTh6M0F3cnd5cGZWTWJzcmF2UVp1a05JdVFLQTFEUUItUGlrY25iZEUtZjBibTlWMDd0OFlHNHBx0gFfQVVfeXFMTUFtOFVkRWsyeWxna3RvVnhqajRnM3FwLXFxZ3ZHRDJ6THBBbU9tRWllVV9rNzlkNXVsVTlVVE8wcHdRbEFBRHNMNnNCTnROUi1ySThZTkRRY2E5VjZLS0U?hl=zh-TW&gl=TW&ceid=TW%3Azh-Hant,"古巴當局今天表示，颶風奧斯卡（Hurricane Oscar）上週末侵襲該國，造成6人死亡，並導致大規模停電。目前首都哈瓦那（Havana）大部分地區已恢復供電。
法新社報導，古巴最大發電廠18日倒塌，導致整個電網癱瘓，1000萬人民無電可用。
哈瓦那的電力公司在官方新聞網站「古巴辯論」（Cubadebate）宣布，截至今天下午，在約有200萬人口的哈瓦那，近90%用戶的供電已恢復。
哈瓦那居民、59歲主婦葛梅茲（Olga Gomez) 在燈光重新亮起後表示：「我當然很開心！」
她告訴法新社：「我要照顧85歲的老母親和自閉症兒子，停電時真的很不方便。」
不過，當局表示，哈瓦那以外地區仍有許多居民無電可用。",經濟日報,2024-10-22,https://news.google.com/api/attachments/CC8iK0NnNWFkek5VY0VGcFowTjFZVE0zVFJESkFSajdBU2dCTWdhUmtwS0xQUWM=-w200-h112-p-df
日本茨城縣推估規模4.3地震 無海嘯威脅,https://news.google.com/read/CBMiWkFVX3lxTE92TDljUTV1SS1uYy1NT3loRGJJR0xMejlHeVJ1dmRtT21IY1NkR0c5cldvdXlBMGtmNWNmQzZWWFoyT2sxdUNtTXNaS2YtT1d2OWNyeGVnRlJnd9IBX0FVX3lxTE01VFFfR3pweXJKWEZZc2VXcjQ5a1BTV3JyUUVKYmR5SHFVSnBWRENaMzQ5ejdHSDEya3dCOGRfNW9NbUMwRnJwOFo3VXUwNDRvRE5HLWgzRG5xdnRpUmx3?hl=zh-TW&gl=TW&ceid=TW%3Azh-Hant,"日本茨城縣南部在當地時間今天下午5時53分左右發生推估規模4.3地震，關東地方北部及埼玉縣被觀測到最大震度3級。這起地震不會帶來海嘯威脅。
日本放送協會（NHK）報導，日本氣象廳觀測，這起地震震源位於茨城縣南部、深度約50公里，推估規模4.3。被觀測到最大震度3級的地區包括茨城縣笠間市、栃木縣宇都宮市等地、群馬縣板倉町，及埼玉縣久喜市等地。
至於關東地方及福島縣的部分地區，也被觀測到震度2級或1級。",經濟日報,2024-10-16,https://news.google.com/api/attachments/CC8iK0NnNWFkek5VY0VGcFowTjFZVE0zVFJESkFSajdBU2dCTWdhUmtwS0xQUWM=-w200-h112-p-df
土敘強震受重創 土耳其東部再傳5.9地震暫無傷亡,https://news.google.com/read/CBMiWkFVX3lxTE5kcmpLOXg3MHFyX1lSNERJa1NIYWlUSmx1NGZQXzlHSWV4MnBEY1NKaGtHc1F1MU1SUDJseGQ0aDdBb29XdW9mWGo1VS1YeENuSVlqdlBnS1lJd9IBX0FVX3lxTE9PYTdJRU1mTjdsX1lGc0hQWFRHMkpuck1QT3BCdlZUakFNYldadWJCQl9JaTRqWEJSdjJYbGFrZl9CLThsVUt1UmZpWmNDVFk3WUpJcnRacnpJcHpTLWhN?hl=zh-TW&gl=TW&ceid=TW%3Azh-Hant,"土耳其東部今天發生規模5.9地震，官員表示，許多地區都受到影響，暫無人員受傷通報。
法新社報導，馬拉特雅省（Malatya）卡內市（Kale）當地時間上午10時46分發生規模5.9地震。土耳其和敘利亞邊境去年2月6日發生規模7.8強震，在土耳其和敘利亞分別造成超過5萬3500人、將近6000人死亡。馬拉特雅省當時也遭到重創。
土耳其災害與應變管理署（AFAD）在X平台發文表示：「規模5.9地震過後，截至目前沒有喪失生命和財產毀損。」
但是不久之後，內政部長耶里卡亞（Ali Yerlikaya）表示，位在3個不同區域的3棟建築「部分倒塌」，緊急服務機構已接獲數十通求助電話。
路透社報導，敘利亞國營通訊社指出，東北部代爾祖爾省（Deir al-Zor）的哈沙卡（Hasakah）和西北部阿勒坡省（Aleppo）也感受到搖晃。
歐洲地中海地震中心（European-MediterraneanSeismological Centre）測報這起地震規模為6.1，震源深度為9公里。",經濟日報,2024-10-16,https://news.google.com/api/attachments/CC8iK0NnNWFkek5VY0VGcFowTjFZVE0zVFJESkFSajdBU2dCTWdhUmtwS0xQUWM=-w200-h112-p-df
影／土耳其5.9地震引發恐慌！民眾驚逃,https://news.google.com/read/CBMi9AFBVV95cUxQV0pyY2FQLWh5WnBaUWR1T1ZKXzVORHZ5WGpjZmRzN0xGNWVYeEZQMFBuTWxwRm1vcWtfUWc1UGxVT0tpZTRFMV83Y21oTExYR21zT0FGWkhPQzRnbFR4V0dGS1ZVS3hnUFVOZHRvZ2hvaDJOZ1I1UzEzYkNOdDJYazhRVUpFbUd1aGdTRU15dGdRdFBDTTFLdVJlNHVIR1pmeWJoUHg3WUpabndNMHZWYmlvbkdfSUpuVkpBbFJMUThzSEZ1X2lScUtPWjNzbXdnV0k1YjhXbVNnai1KYS1MMkw2WXhaYVJvV3VyWHZyQWNfbmNz?hl=zh-TW&gl=TW&ceid=TW%3Azh-Hant,"[NOWnews今日新聞] 土耳其中部的馬拉蒂亞省（Malatya），當地時間週三發生規模5.9地震，深度僅10公里，大批民眾驚惶逃至室外，已知有超過40人在醫院接受觀察，但所幸沒有重大傷亡或經濟損失的報告傳出。
綜合《美聯社》等外媒報導，土耳其災害和緊急事務管理局（AFAD）表示，地震發生在當地時間16日上午10點46分，鄰近地區甚至遠至敘利亞北部都有震感，許多民眾逃至大街上，地震結束後好一段時間後，仍不敢返回室內。
馬拉蒂亞省和鄰近的埃拉澤（Elazig），當地學校緊急關閉，土國內政部長耶利卡亞（Ali Yerlikaya）表示，近190人受到地震影響，其中43人正在醫院接受觀察。
埃拉澤市長塞里福古拉里（Sahin Serifogullari）則指出，當天有十幾人在驚慌之下跳出窗戶，所幸都只受到輕傷。《BBC》的一段畫面顯示，地震時一群人差點被高空掉落的碎片砸中。
值得注意的是，馬拉蒂亞是2023年土耳其-敘利亞大地震時，受災嚴重的11個省份之一。馬拉蒂亞省長亞武茲（Seddar Yavuz）透露，去年的大地震發生後，當地許多面臨倒塌風險的建築物，基本上都已經拆除或進行人口疏散。
更多 NOWnews 今日新聞 報導
在野議員被判當選無效！土耳其國會大鬥毆 數十人打成一團濺血
林郁婷被比X手勢羞辱！土耳其部長還轉發幫腔 土粉留言輸不起
林郁婷遭土耳其對手比X手勢！她IG被洗版後「禁評」 轉私帳",Yahoo奇摩新聞,2024-10-17,https://news.google.com/api/attachments/CC8iK0NnNVZkMGhZWTJ0eGJEWlpUVzFXVFJDNUFSaVJBaWdCTWdhWk00WlBJUWM=-w200-h112-p-df
