標題,連結,內文,來源,時間,圖片,地區,摘要,地點,災害
萬那杜近海地震 德國地球科學研究中心：規模6.2,https://news.google.com/read/CBMigAFBVV95cUxNTmVJX2xxRUNnT0ZhcFFpcElVTnFYVU1LWFJadGxmQWR1YkhjM0tZNjMzZmc3TmhaZWxSaGlOelZlQkEtVmIxR0xxOFBYY3BWaUJqY3FRSFdRVHA4V3luSmdaZW55dWl6V1dJNVRxM3NyemJrU1RYZi1pN2FBM0FLVdIBX0FVX3lxTE9LZHIycGdFMDZGdFN4azFTcHhMS1UtLUZMMEF0WEdQVkJxQnVqNC0yQnZWVldaRWVZM2hEVFIxTTM4UXFJQkx1aDAtcF9QQ1FuZ2RYNFZSQ1k0NVZmYlZV?hl=zh-TW&gl=TW&ceid=TW%3Azh-Hant,"德國地球科學研究中心（GFZ）數據顯示，大洋洲島國萬那杜的近海今天發生規模6.2地震。
GFZ的數據還指出，這起地震的震源深度為10公里。",經濟日報,2024-12-22,null,國外,萬那杜近海發生6.2級地震。,萬那杜近海,- 地震
萬那杜爆發規模7.3 強震災情慘重多國使館都成受災戶| 國際,https://news.google.com/read/CBMiWkFVX3lxTE9UWV9nZ0VTZHg2RFR4VDVpZTFKT3lScXFOMnVEQm1uMDY0NGtRSUVBQzMwZEtRV1ExRjJiajBiRkliWmRiQWZVR3hxQktMdEx5bXFhdlhBSFRUZw?hl=zh-TW&gl=TW&ceid=TW%3Azh-Hant,"太平洋島國萬那杜今日( 17 日)爆發規模 7.3 強烈地震，國內各地多處建物受損，對外通訊也瀕臨中斷，包含啟用不到半年的美國大使館在內，多個西方國家的大使館也受到嚴重的傷害。雖然此次地震對萬那杜造成十分嚴重的災害，但美國的專業機構認為，此次地震所造成的災害可能集中在局部地區，太平洋沿岸國家也不太可能被地震引發的海嘯威脅。
根據美國《有線電視新聞網》( CNN )報導，此次地震的震央位於萬那杜首都維拉港西部約 30 公里，震源深度約 57.1 公里，屬於淺層地震。且在地震發生後，萬那杜又發生規模 5.5 的餘震。維拉港的國際航運碼頭附近地區也發生山體滑坡，對外聯繫道路遭切斷。由於萬那杜與外界的通訊接近中斷，目前仍無法確定具體的死亡與受傷人數，僅能確定有 1 人死亡。
該報導指出，包含美國大使館在內，多個國家設立在維拉港的大使館建築都在地震中受到嚴重的傷害，美國大使館的窗戶幾乎都在地震中被震碎，建築底層野的部分區域也出現倒塌的情形。紐西蘭外交部也證實，包含法國、英國大使館以及高級外交官辦事處在內，鄰近地區的外交建築都在地震中遭受嚴重的損壞。
地震發生後，美國駐巴布亞新幾內亞大使館發言人接受《 CNN 》訪問時表示，「美國駐萬那杜大使館在地震中受到非常嚴重的破壞，目前已經宣布關閉，開放時間將另行通知」。該名發言人也強調，美國政府將繼續與萬那杜的合作夥伴進行密切合作，「我們的心與這次受地震影響的每個人同在」。
紅十字會與紅新月會國際聯合會駐斐濟地區負責人凱蒂．格林伍德(Katie Greenwood )受訪時表示，此次地震在萬那杜造成的損害範圍極大，除了維拉港是中心外，許多省級地區的基礎設施都在地震發生後癱瘓。「這是我在太平洋地區見過最嚴重的地震破壞事件」。然而，格林伍德也強調，目前紅十字會的志工已經做好準備，即將前往萬那杜幫助那些受地震影響的民眾。
該報導也引用美國地質勘探局公布的損害預測報告稱，此次的地震僅為「黃色警報」，雖然會對地震發生的地區造成一些傷亡與損害，但具體影響較為局部。該報告也指出，此次地震對萬那杜可能造成的經濟損失，應該介於 1% 至 10% 之間。
美國國家氣象局太平洋海嘯預警中心也發布聲明表示，此次萬那杜發生的大地震「不會對周邊地區構成海嘯威脅」。該聲明稱，在未來的數個小時內，鄰近地震發生地區的太平洋沿海國家，可能會出現輕微的海平面波動現象，但規模不會大到形成海嘯。
雖然此次地震對萬那杜各地造成嚴重傷害，但美國方面仍預估，此次地震造成的影響「較為局部」，周邊國家不太可能遭受海嘯襲擊。   圖：翻攝自 @jeangene_vilmer X 帳號",Newtalk新聞,2024-12-17,https://images.newtalk.tw/resize_action2/800/album/news/950/67614c1fc9d37.jpg,國外,萬那杜7.3強震，造成嚴重破壞。,萬那杜 維拉港,"- 地震
- 餘震
- 山體滑坡"
俄羅斯東部海域發生規模6.6地震,https://news.google.com/read/CBMic0FVX3lxTE92bm4wZUlJRGt3bG5VYlczejRUUkRzZWhvb2c4R21nZHVRRk1oQXhCb2RTc2ZzTWE3SFg0MHd4NUpHWkJrc2p5Wm05b0hqYkZiTE5Od3ZUYzRFY2hxVkxiR0hYbzNMSVpPdXRSdTZoOElVZU3SAWtBVV95cUxNcVRUYk10MlhwbzdWUVRzZm5kZjJSSExpaHNfeU8wS2dkbUt2RE9OeUlyM2J0MzBnUlJ3UnpNcG5fUjFTenpVRG10T0FpenVQYlFSaGQ4Y09PXzJTWldON2FYLWdaY3VrdGJHUQ?hl=zh-TW&gl=TW&ceid=TW%3Azh-Hant,"俄羅斯25日下午發生芮氏規模6.6地震。（圖擷取自推特）
〔即時新聞／綜合報導〕根據美國地質調查局（USGS）的觀測顯示，今（25）日台灣時間下午5點5分俄羅斯發生芮氏規模6.6地震。
這起規模6.6地震，震央位於尼科利斯科耶（Nikol’skoye）西北方152公里的科曼多爾群島（Komandorskiye Ostrova），地震深度約33公里，目前暫無傷亡消息傳出，也未發布海嘯警報。
不用抽 不用搶 現在用APP看新聞 保證天天中獎　 點我下載APP　 按我看活動辦法",自由時報,2024-12-16,https://img.ltn.com.tw/Upload/news/600/2019/06/25/phprRHHFg.jpg,國外,俄羅斯發生6.6級地震。,俄羅斯 科曼多爾群島,"- 地震
- 海嘯警報"
南太平洋島國萬那杜7.4強震 已出現海嘯,https://news.google.com/read/CBMiZkFVX3lxTE1haVFma08wY0lUT0NQeFFvSFlveGFaUjlvTWhWRmxlUUl0MkRTNE5WQlZsN3pMRDhHNmZuaWNtbDVqWFB2OEZHODdBUmliX2hMc1laRnRSZzJyVkpOX0xwdFF0VkpsQdIBa0FVX3lxTE9zR05fNTNQekpvVzAzN3BtandRSDk5Y2lCLXlaZGpmMFZLdzV1VklFYlhHTGxWSHE5LU9icXFnakVjNTcyVzI4M2ZKbE45ckc3RzM2TThVbGIwZHZldXluUEhHOEs3aFlhS25Z?hl=zh-TW&gl=TW&ceid=TW%3Azh-Hant,"南太平洋島國萬那杜在台灣時間今上午9點47分發生規模7.3強震，目前已觀測到海嘯。（圖擷自USGS）
黃邦平／核稿編輯
〔即時新聞／綜合報導〕南太平洋島國萬那杜在台灣時間今（17）日上午9點47分發生規模7.3強震，美國太平洋海嘯警報中心發布代表「有潛在海嘯威脅」的紫色警報，目前已觀測到海嘯。
根據美國地質調查局（USGS）觀測顯示，台灣時間今早9點47分，在萬那杜首都維拉港（Port Vila）以西30公里處海域發生規模7.3強震，震源深度約57.1公里，美國太平洋海嘯警報中心發布海嘯紫色警報，估有潛在海嘯威脅。
最新海嘯警報顯示，目前已有海嘯發生，截至台灣時間今上午10點07分，萬那杜已觀測到0.25公尺的海嘯出現，估萬那杜海岸可能有0.3至1公尺海嘯。
目前尚未有人員傷亡消息傳出，不過美國地質調查局發出黃色警告，估計這起地震可能會造成一些傷亡和損害。
不用抽 不用搶 現在用APP看新聞 保證天天中獎　 點我下載APP　 按我看活動辦法",自由時報,2024-12-17,https://img.ltn.com.tw/Upload/news/600/2024/12/17/phpyHqZNf.jpg,國外,萬那杜發生7.3強震，觀測到海嘯。,萬那杜 維拉港,"1. 強震
2. 海嘯"
萬那杜地震多處坍塌 救難隊擴大搜尋生還者,https://news.google.com/read/CBMigAFBVV95cUxQc1pGSmplNk1YMzlSaXJUQmRZSHN5RlpPank0TDc3SlBUdmkwX2llblhEMEhWVmpDcEhERjdoQm5fVHF5d09OdWZ0ejJmcTZuX2JCTXlacTN4amFtYy11RER3ZDJ3Rm9UZ1hSdFB3YlNZb2ozLVIxN05vLWFuNzg3X9IBX0FVX3lxTE8wcmJwU1U1Mk45cmFzbWZvWU5FaXpDVTZ0anZnX25yY1YwcURyd2UxTU1KdEY1MTFHMFdjMndjWm9rb1VycExQRTI5TTlXdm9FaVJ6UDV4YmZ2blJhMXo0?hl=zh-TW&gl=TW&ceid=TW%3Azh-Hant,"南太平洋島國萬那杜近海本月17日發生規模7.3強震，救難人員表示，首都維拉港以外地區「多處坍塌」，因此已擴大搜尋受困的生還者。
法新社報導，這起強震導致維拉港（Port Vila）多棟混凝土建築倒塌，並引發山崩。供水、行動網路皆受影響，維拉港主要航運港口停擺，商業航班也暫停運作。
根據聯合國人道事務協調廳昨天轉達的政府數據顯示，目前為止已有10人證實罹難。中國和法國大使館也已證實，其中兩名死者是中國人和法國人。
聯合國表示，約有8萬人直接受到這起強震影響，其中1萬4000多人是兒童。萬那杜人口約32萬人。
澳洲和紐西蘭已派出上百名人員及搜救犬、救援設備和物資馳援。
根據澳洲今天提供的最新影片，澳洲69人救難隊隊長梅伊（Douglas May）表示當地有「幾個主要的坍塌地點，建築物被夷為平地」，還有很多規模較小的坍塌。
梅伊說：「我們現在開始擴大搜尋，看看是否有更多人受困及更多的災損。而我們已發現首都維拉港的東郊和西郊多處坍塌」。",經濟日報,2024-12-20,null,國外,萬那杜7.3強震，10人罹難，救援擴大。,萬那杜 維拉港,"- 強震
- 山崩
- 坍塌"
