標題,連結,內文,來源,時間,圖片
澳洲東南熱浪侵襲 森林野火風險升高,https://money.udn.com/money/story/5599/8517095,"澳洲東南部今天遭逢熱浪，推升森林野火風險，促使當局對維多利亞州（Victoria）多個地區發布禁火令。
路透社報導，這樣的極端氣溫讓人再次想起2019至2020年間的「黑色夏季」（Black Summer），當時大火成災，吞噬掉的土地相當於土耳其國土面積，並奪走33條人命，造成數十億動物死亡。
澳洲氣象預報員今天警告，維多利亞州首府墨爾本（Melbourne）的氣溫可能達到攝氏41度，比當地1月最高均溫高出攝氏14度以上。
相關部門今天將維多利亞州5個地區的火災風險列入等級次高的「極端」。
預報中心資深氣象學家奈拉莫爾（DeanNarramore）向澳洲廣播公司（Australian BroadcastingCorporation）表示，維多利亞州炎熱多風的氣候可能引發「大火」，接著於2月2日轉涼。
另外，奈拉莫爾在網站表示，新南威爾斯州（NewSouth Wales）、南澳州（South Australia）、西澳州（Western Australia）、昆士蘭州（Queensland）與北領地（Northern Territory）今天都發布高溫警報。
納拉莫爾表示，在澳洲人口最多的新南威爾斯州，今天預計出現「低至嚴重的熱浪」，明天則預計出現更強烈的熱浪。",經濟日報,2025-01-27,
「借我躲一下！」 為避加州野火238公斤黑熊「巴里」躲到民宅地板下| 國際,https://newtalk.tw/news/view/2025-02-11/956310,"美國加州南部日前發生大規模火災，許多民眾被迫撤離，避免遭到野火吞噬，並於大火結束後陸續返回家中。就在此時，有民眾發現自家房屋地板下，竟然出現一頭超過 200 公斤的巨大黑熊，相關消息也立即引發當地政府的消防局與野生動物部門關注。幸運的是，在政府部門的合作努力下，黑熊已經被正式帶離地板下方的空間，並被帶至洛杉磯國家森林公園內野放。
根據美國《有線電視新聞網》( CNN ) 報導，美國加州南部於當地時間 1 月發生大規模火災，影響範圍超過 56.66 平方公里，是加州有史以來最具威脅性的三場野火之一。由於大火不斷吞噬當地居民的房屋，許多民眾被迫撤離，並於 1 月底火勢結束後逐漸返回家園。然而，居住在加州阿爾塔迪納地區的薩米．阿爾比德 ( Samy Arbid ) 卻在回到家後，發現了一名意外的「訪客」。
阿爾比德接受《 CNN 》訪問時指出，他在與妻子回到家後，陸續聽到家中地板下傳來各種奇怪的嘶嘶聲，甚至多次聽到動物的吼聲。阿爾比德表示 :「我們一開始以為只是一隻負鼠，直到我們放了一台相機，並看見那隻巨大的熊」。阿爾比德稱，在大火發生以前，他就曾多次從鄰居口中聽說附近有熊出沒的消息，「但沒有人知道這隻熊為了躲避火災，藏進我家房子與地面的空隙內」。
報導稱，由於該隻黑熊經常在阿爾塔迪納地區活動，附近的居民將其命名為「巴里」。阿爾比德也在後續的訪談中表示 :「『巴里』的個性較為溫和，通常只關心與自己有關的事」。該報導指出，「巴里」是一頭成年的雄性黑熊，體重高達 238.14 公斤，體型十分巨大。阿爾比德也轉述一位野生動物學家的解釋表示，「『巴里』很可能覺得我家房子底下比較安全，所以才選擇在此避難」。
雖然當地居民認為「巴里」性情較為溫和，但與黑熊共同生活仍可能發生意外事故。最終，加州魚類與野生動物部 ( CDFW ) 與當地消防局聯手，透過各種手段嘗試將「巴里」帶離阿爾比德家。該報導指出， CDFW 從不同角度設置了多個攝影鏡頭，以監控「巴里」在阿爾比德家地板下的活動情形，並研擬「帶走巴里」的策略。
最終， CDFW 的行動小組因「巴里」體型過大，放棄使用麻醉，改以捕熊器與烤雞相互配合，成功捕獲了自行離開地板下空間的「巴里」，整個過程耗費超過 24 小時。最後，「巴里」被帶到洛杉磯國家森林公園野放， CDFW 也在「巴里」身上安裝了 GPS 項圈，以監控「巴里」後續的移動軌跡。",Newtalk新聞,2025-02-11,https://images.newtalk.tw/resize_action2/800/album/news/957/67aaf1ceb2a2f.jpg
洛杉磯野火受災區 面臨今年最大降雨,https://money.udn.com/money/story/10511/8542738?from=edn_newestlist_rank,"美國國家氣象局預報，南加州地區包括1個月前的野火受災區域，將從12日起面臨今年度最大一波降雨，須預防山崩與土石流。
「洛杉磯時報」報導，這波預計是南加州今年最強烈的一場暴風雨。氣象預報指出，洛杉磯郡、文杜拉郡、聖巴巴拉郡地區降雨量約40到75毫米，山區大約有75至150毫米的降雨量。
洛杉磯市長巴斯（Karen Bass）今天舉行記者會，說明市府團隊因應即將到來的降雨，已清理排水系統和滯洪池。她表示，市府部門高度警戒，消防人員已提前部署，特別關注斷崖社區大火燒毀的區域。
洛杉磯1年前也曾經大雨成災，當時市中心3天內降下216毫米雨量，引發多處土石流災害。
這場將到的大量降雨來自「大氣河流」（Atmospheric River）系統，這是長條狀的水氣帶，從太平洋將大量的水氣帶到加州，產生豐沛降雨；因為雨量極大，被形容為「天空中的河流」。",經濟日報,2025-02-12,
川普拍板！將於24日視察加州野火災區,https://news.ltn.com.tw/news/world/breakingnews/4928844,"川普宣布24日將前往南加州視察野火災情。（法新社）
黃其豪／核稿編輯
〔即時新聞／綜合報導〕即將於20日就職的美國候任總統川普，19日晚間在華府第一資本體育館（Capital One Arena）的政治集會上，透露自己將於本週五（24日）前往南加州視察野火災情。
據《Politico》報導，這可能是川普重返白宮後的首次外出訪察，川普在台上向集會民眾表示，他去探視災區後，會聘請全球最好的建築商，力求讓當地恢復原貌。
加州洛杉磯野火從本月7月肆虐至今，至少已造成27人死亡，民主黨籍州長紐森（Gavin Newsom）和川普之間關係緊張，雙方並未就野火問題進行過任何溝通。
不用抽 不用搶 現在用APP看新聞 保證天天中獎　 點我下載APP　 按我看活動辦法",自由時報,2025-01-20,https://img.ltn.com.tw/Upload/news/600/2025/01/20/phpXRd1YV.jpg
