標題,連結,內文,來源,時間,圖片
丹娜絲明起影響台灣陸地！「淹水警戒地區」一次看| 生活,https://newtalk.tw/news/view/2025-07-05/980088,"輕度颱風「丹娜絲」估計明(6)日、後(7)天影響全台陸地，對此，國家災害防救科技中心彙整相關資料指出，丹娜絲朝台灣西南方海域接近，暴風圈將影響西南部海域，丹娜絲朝台灣西南方海域接近，暴風圈將影響西南部海域淹水警戒地區則共有8縣市、18鄉鎮市區，涵蓋東南部以及澎湖。
國家災害防救科技中心表示，丹娜絲暴風圈約80公里，今晚起影響西南部海域，預計6日晚上起到7日影響台灣陸地，主要強降雨地區為台中以南及東半部地區，根據高中低風險評估，台東縣鄰近的高雄、屏東山區為強降雨高風險區；台中以南為中風險區，桃竹苗與宜蘭為低風險區；雙北、基隆未列入風險。另外，全台沿海與離島及中部山區則列為強陣風的中風險區。
持續更新：懶人包》「丹娜絲」來勢洶洶！海陸空交通異動一次看
根據潮位監測，今日滿潮時間為下午4點到晚上7點，受到丹娜絲低壓影響，預估沿海潮位將偏高，提醒低窪區滿潮期間須注意強降雨造成的局部積淹水；水庫的調節性放水則提醒各主責政府單位透過細胞廣播平台發送預警；西南部及恆春半島沿海須留意長浪影響。
至於淹水警戒地區則共有8縣市、18鄉鎮市區，包含花蓮縣花蓮市、鳳林鎮、新城鄉；台東縣台東市、鹿野鄉；高雄市新興區、楠梓區、旗山區；台南市中西區、安平區、安南區；澎湖縣馬公市；屏東縣枋山鄉、恆春鎮；嘉義縣竹崎鄉、民雄鄉；彰化縣田尾鄉、溪州鄉。預警時間為今日10點到9日0點。
分析的坡地易致災區則有台南市、高雄市、屏東縣、花蓮縣、台東縣等5鄉鎮市，易造成孤島聚落的重要道路有：台8、台9（乙、丙、丁、戊）、台11（甲、乙、丙）、台14甲、台20（甲、乙）、台23、台24、台26、台27甲、台29約20條。
輕度颱風「丹娜絲」影響，主要強降雨地區為台中以南及東半部地區   圖：國家災害防救科技中心／提供
受到丹娜絲低壓影響，預估沿海潮位將偏高，西南部及恆春半島沿海須留意長浪影響。   圖：國家災害防救科技中心／提供",Newtalk新聞,2025-07-05,https://images.newtalk.tw/resize_action2/800/album/news/981/6868d4584c139.jpg
風暴來襲淤泥覆蓋軌道 法國義大利高鐵暫停行駛數日,https://money.udn.com/money/story/5599/8843949,"法國國家鐵路公司（SNCF）今天表示，受到本週稍早來襲的猛烈風暴影響，法國與義大利之間的高速列車將暫停行駛「至少數日」。
法新社報導，法國國家鐵路公司表示，將全面清理並檢修巴黎到米蘭的高速鐵路軌道，以避免任何可能導致復駛時間延後的損壞。
SNCF指出，風暴襲擊鄰近法國邊境車站莫丹（Modane）的莫赫延谷（Maurienne Valley），導致莫丹車站淹水，軌道也出現大量淤泥堆積，這條路線因此從昨天下午3時起暫停通行。
洪水在莫丹鎮造成財產損失，所幸沒有人員傷亡通報。
在此之前，連接巴黎與義大利杜林（Turin）和米蘭（Milan）的火車路線由於山崩損壞隧道，被迫關閉19個月，直到今年3月底才恢復通車。
SNCF和其義大利競爭對手「義大利國營鐵路公司」（Trenitalia）都在這條鐵路提供高速運輸服務。通常僅需6、7個小時就能將乘客從巴黎運送到義大利北部大城。",經濟日報,2025-07-01,
（影）中國強降雨災情慘! 甘肅山體滑坡2死貴州榕江洪水一週兩淹4萬人撤離| 中國,https://newtalk.tw/news/view/2025-07-03/979766,"2 日 至 3 日中國甘肅隴南市局部出現強降雨天氣，隴南市徽縣有街道被淹，部分山區因降雨導致山體滑波。3 日，《新京報》記者從隴南市徽縣政府部門獲悉山體滑坡致 2 人不幸身亡，上述兩人均為當地一處施工工地內人員，目前，救援工作仍在進行中。
有畫面也顯示出，貴州榕江爆發嚴重洪水，原先洪水退去、居民都開始清理家園了，結果強降雨再次侵襲，城區一周內兩度被洪水淹沒。
延燒焦點：巴基斯坦否認要買中國殲-35 ！ 巴國防長突改口 疑與「這2大」因素有關.....
貴州榕江縣近日遭遇嚴重水患，因地處三江交匯、地勢低窪，成為此次洪災重災區。雖然前一波洪水退去，居民才剛開始忙著清理家園，沒想到 28 日官方又發布最新防汛預警，緊急呼籲全城居民儘速撤離避險。
根據《央視》報導，截至 28 日晚間 6 點，榕江縣已有超過 4.1 萬名民眾緊急撤離家園，部分地區車輛被要求全面撤出、只出不進。央視記者也在現場直擊，街頭可見大批民眾攜家帶眷、開車逃往城外，主要路口一度大塞車，市區交通幾乎癱瘓。
據統計，28 日下午 5 點過境的洪峰水位已達 253 公尺，災區街道洪區副指揮長田耕說：「對我們低窪地帶的小區，看還有沒有人員，我們把他全力疏散出來。」
另外，河南西峽發生強降雨發生大洪水，據河南省南陽市消防部門了解，截至目前，已搜尋到5名人員，均無生命體徵，現場搜救工作仍在進行中。
貴州榕江縣的水
傷亡人數目前沒有官方報出 pic.twitter.com/9jq1d5Nu4a
有畫面也顯示出，貴州榕江爆發嚴重洪水，原先洪水退去、居民都開始清理家園了，結果強降雨再次侵襲，城區一周內兩度被洪水淹沒。   影：翻攝自 X 沐陽
河南西峽發生強降雨發生大洪水，據河南省南陽市消防部門了解，截至目前，已搜尋到5名人員，均無生命體徵。   圖：翻攝自 央視",Newtalk新聞,2025-07-03,https://images.newtalk.tw/resize_action2/800/album/news/980/686641b0652e1.png
遏制中國 日本將首開先例出口二手護衛艦給菲律賓 | 國際,https://newtalk.tw/news/view/2025-07-06/980194,"面對中國軍隊在南海日益咄咄逼人，只有兩艘護衛艦的菲律賓近日尋求日本協助。根據《讀賣新聞》稍早的報導，東京方面已經已同意出口6艘日本海上自衛隊「阿武隈級」二手護衛艦給馬尼拉。
報導指出，此舉將首開日本首度出口護衛艦的先例。其目的是藉此提升與菲律賓軍方的互通能力，並共同加強對正在海上單邊擴張的中國的威懾和應對能力。
當前熱搜：管仁健觀點》韓國瑜為何要暗酸黃國昌是「三姓家奴」？
報導指出，日本防衛大臣中谷元和菲律賓國防部長特奧多羅（Gilberto Teodoro）6月初在新加坡會晤時確認了二手護衛艦的出口。預計此次出口的將是海上自衛隊六艘「阿武隈級」護衛艦。 「阿武隈級」驅逐艦服役已超過30年，由於自衛隊人員短缺，需要更換人員較少的新艦艇，因此這些艦艇原本計劃陸續退役。
報導引述消息人士，指出菲律賓軍方計劃今年夏天對「阿武隈級」進行檢閱，檢查其主砲等裝備和維護狀況，並預計進行其他出口準備工作。
報導指出，日本《防衛裝備轉移三原則》的實施方針將可出口的裝備限制為救援、運輸、警戒、監視和掃雷五種類型，而高攻擊力的護衛艦則不能直接出口。但是，如果共同開發高攻擊力的裝備，例如日本正在與英國和義大利合作開發的下一代戰鬥機，以及日本向澳洲提議的基於最上級驅逐艦的新艦，則可以出口。計畫共同開發二手驅逐艦，修改其規格，加入菲律賓所需的設備和通訊設施，並進行出口。未來，也計劃出口新型驅逐艦。
報導指出，菲律賓和日本正在深化安全合作，並建立準同盟關係。在今年4月的峰會上，雙方同意就簽署《採購和相互服務協議》（ACSA）展開討論，該協議將允許自衛隊和菲律賓軍方共享食品、燃料和其他物資。
菲律賓與中國在南海存在領土爭端，日本則面臨中國在東海的海上擴張。如果菲律賓軍方部署日本開發的驅逐艦，預計聯合應對能力將得到提升，海上自衛隊一位高級官員希望「我們能夠制止中國軍方的動向」。",Newtalk新聞,2025-07-06,https://images.newtalk.tw/resize_action2/800/album/news/981/686a042e544cf.png
美擬提供以色列超過7千枚炸彈! 伊朗緊急關閉領空應對戰爭恐捲土重來| 國際,https://newtalk.tw/news/view/2025-07-04/980006,"美國擬向以色列提供轟炸機、炸彈制導系統及炸彈，被視為是「對伊朗釋出威懾信號」。專家對此以「陰影籠罩」來形容現今中東局面。
根據《法新社》（AFP）及《以色列時報》（TOI） 1 日報導，美國國防安全合作署（DSCA）當地時間週一宣布，為補足以色列彈藥庫存，其已批准向以色列出售總價值 5.1 億美元（約合 147 億新台幣），超過 7,000 套精準制導炸彈套件及相關支援設備。此案目前已獲國務院的批准，DSCA 也正式向國會送案。
現正最夯：管仁健觀點》韓國瑜為何要暗酸黃國昌是「三姓家奴」？
國際專欄作者「星球調研室」在《騰訊網》上指出，與此同時，伊朗宣布關閉中、西部領空，並拒絕與國際原子能總署（IAEA）合作調查。他說，種種跡象表明以伊衝突可能再起，目前中東局面可謂「陰影籠罩」。他進一步指出，DSCA 本次提案內容包括 3,280 個 JDAM 制導套件、500 磅級 MK-82 炸彈；還有 3,845 個重型 JDAM 制導套件，以及 2,000 磅級 BLU-109 鑽地炸彈。
「星球調研室」稱，美國國會更計劃授權以色列使用 B-2 「幽靈」隱匿戰略轟炸機。他表示，B-2 的加入，將提升以色列對伊核設施的打擊能力，也使衝突風險再進一步上升。面對美、以軍事壓力，伊朗則是迅速採取反制措施，本月 2 日宣布關閉中、西部領空，首都德黑蘭機場、伊瑪目霍梅尼國際機場等重要航空樞紐將暫停營運。
「星球調研室」總結，從當前局面來看的話，戰爭的可能性正在上升。美、以軍事合作對伊釋放出強烈威懾信號，而伊朗則採取多項措施加強防禦，包括關閉領空、儲備彈藥和肅清間諜網絡，表明其對美以軍事威脅已有充分準備。
美軍午夜之錘行動使用 GBU-57 MOP 巨型鑽地彈。   圖 : 翻攝自 U.S. Air Force",Newtalk新聞,2025-07-04,https://images.newtalk.tw/resize_action2/800/album/news/980/686676fcaec02.jpg
國土署補助2.7億施作湖內雨水下水道新設抽水站 解決田尾舊社區淹水,https://news.ltn.com.tw/news/life/breakingnews/5094106,"立委邱志偉歷經長期協調，爭取到國土署2.7億補助經費，完成湖內區L幹線雨水下水道及新設抽水站工程。（邱志偉服務處提供）
〔記者蘇福男／高雄報導〕高市湖內區田尾舊社區地勢低窪易淹水，立委邱志偉爭取內政部國土署2.7億元補助經費，施作L幹線雨水下水道和新設抽水站，工程發包期間因國際原物料上漲問題，歷經2次追加預算才順利發包，並在今年完工，完工後徹底解決田尾舊社區的長期淹水問題。
田尾里長謝秋影指出，田尾為開發甚早聚落，早期排水都往西排至海埔社區等方向，但因社區開發早、排水先天不良問題難以克服，以致低窪地區下大雨即易淹水，邱志偉說，田尾和大湖地區的淹水問題一直是地方的沉痾，長期以來都難以解決，高市水利局規畫L幹線下水道，將原本往東排的水改往西排入下水道，截流後不但減輕海埔地區的排水負擔，近期豪大雨當地排水非常順暢，排水問題大幅改善，之後颱風的考驗將能真正確認L幹線的排水效益。
水利局表示，湖內L幹線雨水下水道及抽水站工程在2023年初動工，新建近1.1公里的雨水下水道，並在二仁溪畔新建抽水站，設置2組2.5CMS的抽水機，將田尾、大湖社區的水引流至下水道後，藉由抽水機將水抽出，邱志偉說，因應未來極端氣候，L幹線抽水機組還有預留空間，最多可從原本的5CMS增加到10CMS，對當地排水將能有效因應。
不用抽 不用搶 現在用APP看新聞 保證天天中獎　 點我下載APP　 按我看活動辦法",自由時報,2025-07-02,https://img.ltn.com.tw/Upload/news/600/2025/07/02/5094106_1_1.jpg
颱風丹娜絲逼近氣象署估午夜後發陸警| 生活,https://newtalk.tw/news/view/2025-07-05/980051,"今年第4號颱風丹娜絲生成，氣象署發布海上颱風警報，預估深夜後發布陸上颱風警報，隨著颱風外圍環流逐漸靠近，花東、恆春可能出現局部性大雨，降雨帶將逐漸向北擴展。
中央氣象署今天上午發布第4號颱風丹娜絲海上颱風警報，根據氣象署網站，颱風上午8時中心位置在鵝鑾鼻的西南西方約410公里處，以每小時8轉11公里速度，向北北東進行。
延燒焦點：輕颱「丹娜絲」生成最新路徑曝光！週一最接近台灣 2地區首當其衝
氣象署簡任技正伍婉華表示，根據各國颱風預報模式研判，預估颱風丹娜絲未來將逐漸往北、再往北北東方向，朝台灣海峽南部方向移動，明天至7日上半天影響最明顯，若依目前預估方向和速度，有可能在今天深夜後發布陸上颱風警報。
伍婉華指出，今天清晨至目前為止，颱風外圍環流逐漸靠近，氣象署已針對恆春半島發布大雨特報，她提醒，無論是今天颱風外圍環流或明天颱風本身環流，一旦旺盛對流雲系移到上空，就會帶來瞬間短延時強降雨，也會有閃電、雷擊狀況。
隨著颱風丹娜絲逐漸接近，伍婉華表示，除了台東、恆春外，預估花蓮今天斷斷續續都會下短暫性陣雨或雷雨，花東地區、恆春可能會出現局部性大雨，降雨帶將逐漸向北擴展，東北部、宜蘭、中部地區、澎湖、金門會有短暫性陣雨或雷雨，而北部地區午後有雷陣雨。
伍婉華指出，颱風丹娜絲明天將朝著台灣海峽南部逐漸北上，各地都會下短暫性陣雨或雷雨，澎湖、金門、馬組可能有局部性大雨，南部和東南部甚至可能出現局部性豪雨。
伍婉華表示，7日颱風丹娜絲到達台灣海峽北部附近，預估強度會稍微減弱，降雨稍微緩和，但仍須視颱風移動狀況而定。
對於輕颱丹娜絲是否有機會增強為中颱，伍婉華表示，颱風丹娜絲目前逐漸增強，但到北部後環境對其發展不利，預估最強強度可能為輕度颱風等級，但她提醒，大氣狀況和模擬狀況可能會有差異，仍須持續監測。
伍婉華指出，雖然大家可能覺得颱風丹娜絲是規模不算很大的颱風，但只要是颱風，暴風圈所在區域可能會有強風、豪雨，她提到澎湖可能是颱風中心接近的地方，提醒當地民眾提高警覺、注意安全。
颱風丹娜絲路徑潛勢預報。   圖/中央氣象署網頁cwa.gov.tw",Newtalk新聞,2025-07-05,https://images.newtalk.tw/resize_action2/800/album/news/981/68688e36902be.jpg
2熱帶擾動將形成颱風！專家：其一恐「登陸」台灣西部| 生活,https://newtalk.tw/news/view/2025-07-02/979418,"中央氣象署預報，今(2)日各地依舊高溫炎熱，維持多雲到晴好天氣。氣象專家林德恩則提醒，目前台灣周圍有TD05和98W倆熱帶擾動正在發展，強度將增強為颱風。此外，歐洲EC-AIFS模式預估，位於菲律賓東部外海的98W生成颱風後，將沿台灣海峽北行，颱風中心有可能登陸台灣。
林德恩今日在臉書「林老師氣象站」指出，目前在西北太平洋海域的TD05熱帶擾動；以及菲律賓東部外海的98W熱帶擾動都有機會在未來幾天內發展成為颱風。
當前熱搜：丹娜絲變大又增強 台灣颱風論壇:穿越黑水溝西部風雨更猛烈
林德恩說明，位於西北太平洋上的TD05，正以北北西轉北，之後再轉東的運動方向，朝日本外海前進，雖然有機會發展成為颱風，但不對對台造成影響。
須特別注意的是，儘管TD05不會靠近台灣，但今日上午各國對於該熱帶擾動的最新模擬結果，仍有許多分歧。林德恩強調，根據歐洲EC-AIFS模式評估，目前位於菲律賓東部海域的98W發展成颱風後，將向西北方向前行，先經過呂宋島，進入南海後，再沿著台灣海峽北上。通過台灣海峽期間，颱風中心有機會登陸台灣陸地。",Newtalk新聞,2025-07-02,https://images.newtalk.tw/resize_action2/800/album/news/980/68648dddbeb1e.jpg
木恩颱風生成！氣象署曝最新移動路徑| 生活,https://newtalk.tw/news/view/2025-07-03/979655,"中央氣象署針對今(3)日凌晨生成的輕度颱風「木恩颱風」指出，木恩颱風目前位於日本東南方海面，正在往日本方向移動，不會對台灣造成影響。氣象署提醒，雖然木恩颱風不會影響台灣天氣，但目前位於菲律賓海域的熱帶擾動98W仍在發展，其外圍環流將在本周末掃過台灣東南部地區。
位於西北太平洋海域的TD05熱帶擾動已在今日凌晨2時許，生成編號第3號「木恩颱風」，中心位置約在北緯26.7度，東經145.7度，並以每小時9公里速度，向西北方向前進。
精選報導：國際醫學會研究報告 證實地中海型飲食降低失智症致死率 兩種人最有效
氣象署於今日上午10時30分許，召開編號第3號木恩颱風最新預報說明會。氣象署說明，木恩颱風目前位於日本東南方海面，正在往日本方向移動，預估木恩颱風移動路徑僅限於海面，不會接觸陸地，也不會影響台灣天氣。
此外，氣象署提醒，位於菲律賓海域的熱帶擾動98W正在發展為熱帶性低氣壓，且98W的外圍環流在周六、周日時，將為台灣東南部地區帶來豐沛雨量。",Newtalk新聞,2025-07-03,https://images.newtalk.tw/resize_action2/800/album/news/980/6865c97d043fa.jpg
6日國內線多取消國際線部分異動 民航局籲留意,https://money.udn.com/money/story/7307/8852946,"颱風丹娜絲來襲，民航局今天表示，明天國內線多數取消，華航與台灣虎航國際線有部分異動，除要求業者航機派遣作業需符合防颱作業程序並妥善維護旅客權益，也提醒旅客留意航班動態。
交通部民用航空局發布新聞稿表示，隨著颱風丹娜絲逐漸接近台灣，截至晚間6時止，國內線取消22架次、延誤4架次，國際線未受影響。
民航局表示，因澎湖、金門航線今天候補旅客較多，為協助疏運旅客，已協調立榮航空澎湖-台北航線放大機型2架次，華信航空金門-台北航線加開班機2架次。
民航局指出，根據國籍業者提供最新動態，明天立榮與華信國內線全部取消，德安西線取消，東線則逐班視颱風動態調整；國際線部分，長榮與星宇維持正常，華航與虎航則有部分調整，後續業者今晚與明天上午，均會根據颱風最新動態召開防颱會議調度航班。
民航局表示，已要求航空公司需妥善維護旅客權益，在官網公布即時航班訊息並通知旅客及提供必要協助，同時提醒旅客出發前，務必先向航空公司確認航班動態，以利行程安排。
此外，民航局表示，還要求各航空公司應嚴格遵循防颱標準作業程序，並就航機派遣作業、飛航作業安全、氣象資訊即時發布等方面，要求充分整備與應變，確保旅客安排與飛航安全，並要求業者應滾動檢討航班執行與乘客服務規劃，視颱風動態準備各種備案，機隊調度、油量增載及備降場等，後續均應做出相對調整。",經濟日報,2025-07-05,
丹娜絲颱風》7/6國內線258架次、國際線49架次取消,https://news.ltn.com.tw/news/life/breakingnews/5097957,"丹娜絲颱風接近台灣，民航局統計，7月6日國內線258架次、國際線49架次取消。示意圖。（記者吳亮儀攝）
首次上稿 11:10
更新時間 14:42
〔記者蔡昀容／台北報導〕受丹娜絲颱風影響，今天（7月6日）截至下午2時，民航局統計，國內線取消268架次、國際暨兩岸航線取消49架次。
7月6日航班異動如下：
●華信航空
國內線航班全數取消。
●立榮航空
國內線航班全數取消。
●德安航空
西線（往返七美、望安）取消，東線（往返蘭嶼、綠島）逐班視颱風動態調整。
●華航航班
取消
高雄往返東京成田 CI126／CI127
高雄往返曼谷 CI839／CI840
高雄往返大阪 CI176／CI177
高雄往返沖繩 CI132／CI133
高雄往返上海浦東 CI583／CI584
高雄往返香港 CI935／CI936
提前
高雄往返深圳 CI585／CI586
延遲
首爾仁川往高雄 CI165
東京成田往高雄 CI103
●長榮航空
下午高雄出發，往返福岡、首爾、香港、浦東航班均取消。
●台灣虎航
取消
高雄往返金浦 IT662／IT663
高雄往返福岡 IT274／IT275
高雄往返東京成田 IT280／IT281
延後
高雄往返峴港IT585／IT586，延後至7月7日執行
提前
高雄－沖繩IT288航班 提前至8：15起飛
沖繩－高雄IT289航班 提前至12：00起飛
高雄－澳門IT321航班 提前至13：05起飛
澳門－台中IT372航班 提前至15：50起飛
不用抽 不用搶 現在用APP看新聞 保證天天中獎　 點我下載APP　 按我看活動辦法",自由時報,2025-07-06,https://img.ltn.com.tw/Upload/news/600/2025/07/06/5097957_1_1.jpg
7/6國內線全取消! 華航、虎航、長榮國際線航班異動,https://news.ltn.com.tw/news/life/breakingnews/5097612,"丹娜絲路徑圖。（氣象署提供）
首次上稿 20:16
更新時間 21:24
〔記者吳亮儀／台北報導〕〔記者吳亮儀／台北報導〕輕度颱風丹娜絲預計明天和下週一上半天影響台灣最劇烈，交通部民航局今天（5日）晚間統計，明天立榮、華信的國內線航班全數取消，華航、長榮和虎航有部分航班異動。
民航局表示，受丹娜絲颱風影響，明天空運國內線多數取消，華航與台灣虎航國際線則有部分異動；長榮航空晚間也取消明天高雄往返福岡BR119/120、高雄往返首爾BR171/172、高雄往返香港BR849/850、高雄往返浦東BR705/706航班。
民航局表示，今天已啟動防颱應變機制，除要求業者航機派遣作業需符合防颱作業程序並妥善維護旅客權益，民航局也提醒旅客留意航班動態。隨丹娜絲颱風逐漸接近台灣，今天（5日）截至傍晚18時，國內線取消22架次、延誤4架次，國際線未受影響。因澎湖、金門航線今日候補旅客較多，為協助疏運旅客，民航局已協調立榮航空澎湖—台北航線放大機型2架次，華信航空金門—台北航線加開班機2架次。
民航局指出，根據國籍業者提供的最新動態，明日立榮與華信國內線全部取消，德安西線取消，東線則逐班視颱風動態調整；國際線部分，華航、長榮與虎航則有部分調整，後續業者在今晚與明天上午都會根據颱風最新動態召開防颱會議調度航班。
民航局已要求航空公司需妥善維護旅客權益，除於官網公布即時航班訊息並通知旅客及提供必要協助。旅客出發前，也務必先向航空公司確認航班動態，以利行程安排。
民航局整理7/6日各家航空公司航班異動。（民航局提供）
不用抽 不用搶 現在用APP看新聞 保證天天中獎　 點我下載APP　 按我看活動辦法",自由時報,2025-07-05,https://img.ltn.com.tw/Upload/news/600/2025/07/05/phpap5vqG.jpg
日本鹿兒島規模4.0地震 無海嘯風險,https://money.udn.com/money/story/5599/8838819,"日本鹿兒島縣當地時間今天下午4時56分（台北時間下午3時56分）發生規模4.0地震，最大震度4，沒有引發海嘯的風險。
根據日本氣象廳，震央位於吐噶喇列島近海，震源深度20公里，鹿兒島縣十島村觀測到最大震度4。
吐噶喇列島近海今天下午連續發生多次地震，規模最大的為下午4時12分規模5.1地震，最大震度4。
吐噶喇群島的寶島、小寶島、惡石島近海一帶，向來是群發地震頻繁發生的地區，在2023年9月，曾在2天內觀測到292次有感地震。",經濟日報,2025-06-29,
