標題,連結,內文,來源,時間,圖片
熱浪席捲歐洲 西班牙山林大火2死,https://news.ltn.com.tw/news/world/breakingnews/5093932,"加泰隆尼亞地區主席伊拉在X上指出，他得知2人因火災喪生後感到震驚。（歐新社）
〔編譯謝宜哲／綜合報導〕西班牙消防員1日說，西班牙東北部熱浪侵襲，一場大火過後，他們發現了2具屍體。本週席捲歐洲熱浪打破高溫紀錄，學校停課，加劇火災風險。
根據《法新社》報導，雷里達省1日幾乎同時發生2起山火，1.4萬人被加泰隆尼亞地區當局要求在家隔離。消防和緊急服務部門指出，起發生在科斯科市（Cosco）附近的火災發現2人死亡。
火災具體原因尚不清楚，但消防部門說，近期高溫、乾燥天氣以及風暴帶來的強風加劇火勢。加泰隆尼亞地區主席伊拉（Salvador Illa）在X上指出，他得知2人因火災喪生後感到震驚。
西班牙正處於強烈熱浪中，許多地方氣溫超過攝氏40度，創下了6月多項高溫紀錄。南部城市科爾多瓦和巴塞隆納都有1人死亡，2人均在6月28日道路施工時死亡，很可能是中暑。
科學家指出，人為造成的氣候變化，熱浪和暴風雨等極端天氣事件正變得更加猛烈。
在過去的熱浪中，歐洲已有數萬人喪生，這促使當局向老年人、兒童、病人以及其他易受專家所稱的「隱形殺手」影響人群發出警告。
不用抽 不用搶 現在用APP看新聞 保證天天中獎　 點我下載APP　 按我看活動辦法",自由時報,2025-07-02,https://img.ltn.com.tw/Upload/news/600/2025/07/02/5093932_1_1.jpg
加州今年最大野火「馬德雷大火」 延燒逾7萬英畝,https://news.ltn.com.tw/news/world/breakingnews/5097657,"美國加州爆發「馬德雷大火」（Madre Fire），消防員在New Cuyama附近滅火。（路透）
〔中央社〕美國加州今年以來最大規模野火過去3天來已吞噬超過7萬英畝土地，當局已經派出數百名消防員救火，力圖控制火勢。
法新社報導，「馬德雷大火」（Madre Fire）2日在加州中部鄉村地區聖路易奧比斯波郡（San Luis Obispo County）爆發。約200人接獲疏散命令，數十棟建築受火勢威脅。
根據加州森林防火廳（Cal Fire）今天提供的最新數據，這場野火2日以來已吞噬7萬800英畝土地，當局已派出超過600名消防員以及40輛消防車，力圖控制火勢。
這是加州今年以來最大規模野火；年初，加州就曾遭野火肆虐，當時燒毀洛杉磯大片地區。
這是美國總統川普（Donald Trump）下令削減氣候災害應變相關聯邦機構預算及員額後的第一個夏季，受影響機構包含農業部林務署（Forest Service）、國家海洋暨大氣總署（NOAA）與聯邦緊急事故管理總署（FEMA）。
加州州長紐松（Gavin Newsom）今天指出，過去24小時，加州的聯邦土地上新增了15起野火。他呼籲總統川普優先撥款以強化消防資源。
紐松在社群平台X上寫道：「川普必須清醒過來，開始提供資金給這些鄉村地區的聯邦消防員與土地管理團隊，而不是幫億萬富豪減稅。」
紐松2日指控川普未編列足夠經費支持野火防治計畫。紐松在記者會上說：「我們需要相稱的資源投入，而非空泛口號。」他指出，加州超過50％土地是由聯邦政府管轄。
不用抽 不用搶 現在用APP看新聞 保證天天中獎　 點我下載APP　 按我看活動辦法",自由時報,2025-07-05,https://img.ltn.com.tw/Upload/news/600/2025/07/05/php8gDhHz.jpg
土耳其西部伊茲米爾省野火 死亡增至3人,https://money.udn.com/money/story/5599/8853113,"土耳其官員今天表示，西部伊茲米爾省（Izmir）厄代米什縣（Odemis）爆發的野火再添1名林業工人傷重不治，使得罹難人數上升至3人，所幸當地火勢已獲控制。
法新社報導，土耳其過去一週雖未如南歐其他地區遭遇熱浪侵襲，卻受乾旱所苦，當地消防員必須撲滅600多起野火，但大風助長火勢。
厄代米什位在度假勝地伊茲米爾市東方約100公里處，當地野火已在3日奪走2人性命，分別是1名81歲臥床男子及1名39歲林業工人。
土耳其農林部長尤馬克里（Ibrahim Yumakli）今天在社群媒體平台X發文表示，另1名林業工人沙辛（Ragip Sahin）在滅火時受傷送醫治療，如今也傷重不治。
尤馬克里還說，截至昨天晚間，厄代米什和土耳其另外6地野火已獲控制，大多在西部與中部地區；但南部哈泰省（Hatay）濱海的多提爾縣（Dortyol）野火仍未獲控制。
厄代米什市長杜欒（Mustafa Turan）在X平台發布影片表示：「大火來得猛烈，把一切燒得精光，約5000公頃土地化為灰燼。」
土耳其救難人員已在6月30日撤離了5萬多人，以免受到連串野火波及。",經濟日報,2025-07-05,
野火摧殘森林面積廣 加拿大利用無人機加速復育,https://money.udn.com/money/story/5599/8846119,"加拿大一架大型無人機飛越遭野火摧殘的森林上方，向地面投放種子膠囊，以加速林地復育的腳步。
法新社報導，2023年夏天，魁北克省北部地區遭嚴重野火摧殘，而今年是當地連續第2年嘗試利用無人機復育林地，種植新的黑雲杉和短葉松。
主導這項試驗計畫的「佛拉西森林」（FlashForest）公司，並不是直接從高處撒下種子，而是用膠囊來保護種子，膠囊內還有水分、養分和真菌，以最佳化種子的成長潛力。
在每年有數以百萬計公頃的森林遭野火蹂躪的情況下，光靠森林本身的自我復原方式已經行不通。
2023年加拿大的野火數量破紀錄，野火波及每個省，總計近1800萬公頃的土地遭野火摧殘。尤其以魁北克省北部受創最嚴重。
無人機飛手和地理空間資料科學家盧卡斯（OwenLucas）說明，他們的做法是事先利用人工智慧（AI）標出地點。然後根據氣候變數、地理特徵、地形變數來挑選地點，以確保種子撒在正確的位置。
除在魁北克省，佛拉西森林在加拿大的亞伯達省和美國的科羅拉多州也有專案。每架無人機每天可運送種子，種植5萬棵樹。
盧卡斯說：「在播下種子的時候還看不出任何端倪。但等到秋天回來的時候，看到這些樹苗成長。就會瞭解自己正在做一件有意義的事。」",經濟日報,2025-07-02,
致命真菌正在擴散，我們能阻止新威脅出現嗎？,https://www.bbc.com/zhongwen/articles/cx203re831xo/trad,"圖像來源，
BSIP/EDUCATION IMAGES/UNIVERSAL IMAGES GROUP/GETTY IMAGES
氣候變化通常讓人聯想到山火、水災以及對建築與農作物的破壞。但隨着氣溫上升，真菌性疾病亦開始蔓延至過往因氣候寒冷而無法生存的地區。
英國曼徹斯特大學的一項新研究指出，一種在氣候較熱地區每年感染數百萬人的致命真菌，可能隨全球變暖而逐步擴散至歐洲。
這種名為「麴菌」（Aspergillus）的真菌會引發致命肺部感染，據估計每年在全球導致約180萬人死亡。研究預測，該真菌將自非洲和南美洲向北擴散。
這項警告與近年熱播的科幻劇《最後生還者》（The Last of Us）不謀而合。劇中描繪一種可改變人類大腦的恐怖真菌，消滅大批人口。儘管劇情極度誇張，英國埃克塞特大學兒童傳染病教授阿迪莉亞·華莉絲（Adilia Warris）指出，真菌疾病的確正日益引起關注。
「真菌性疾病的嚴重程度不一，小則像腳癬這類惱人但輕微的疾病，大則可致命，例如引發敗血症或腦部感染。」
End of 熱讀
雙腳是真菌的理想棲息地，因為皮膚表面常有裂縫讓真菌入侵，而且穿著襪子與鞋子形成黑暗潮濕的環境。
然而，當另一種真菌——黴菌病原體——被吸入我們的肺部時，情況就不同了，特別是當我們的免疫系統已經處於弱勢時。
華莉絲解釋，這些真菌釋放孢子，進入肺部後會發芽，形成類似「麵包結構」的組織，並在肺組織中生長，引起疾病。
另一類主要真菌則早已存在於人體之內：酵母菌。最廣為人知的例子是白色念珠菌（Candida albicans），它屬於人體正常菌群的一部分。
「這種酵母菌在許多健康人體內的腸道中都可發現，它與腸道中的多種細菌一起幫助維持良好的腸道健康。」華莉絲表示。
但若個人體內免疫力低下，或因創傷或手術造成器官損傷，這些酵母菌進入血液後，便可能引發與細菌感染類似的敗血症（血液中毒），這是一種嚴重疾病。
圖像來源，
GETTY IMAGES
這些真菌早已存在於我們周遭，那為何如今它們造成的問題越來越嚴重？
尼日利亞拉各斯大學臨床微生物學教授歐拉戴爾（Rita Oladele）指出，我們應該非常關注真菌疾病，尤其是在新冠疫情之後。
她表示，氣溫升高導致新型病原體出現；同時，醫療科技進步和人類壽命延長，亦增加了感染風險——愈來愈多人在免疫系統受損情況下活得更久。
「現在我們幾乎對所有器官都進行了更多的移植⋯⋯接受化療的癌症病人也愈來愈多；任何抑制免疫系統的治療都會增加真菌感染的風險，」她說，長期使用類固醇治療其他疾病的患者也同樣面臨風險。
她亦指出，從全球北方到全球南方，在真菌感染診斷與治療能力方面存在明顯差距——不僅在於診斷斷症的能力，還有如何妥善管理有真菌感染風險或嚴重真菌感染的患者，也包括抗真菌藥物的可及性與可負擔性。
她補充，在氣候較熱地區，真菌感染確實更為普遍，特別是愛滋病毒感染率高的地方，因愛滋病會削弱免疫系統。
「儘管真菌疾病在全球南方的負擔較重，但這也會驅使人們遷移，因為他們會尋求更好的醫療照顧。」她說。
圖像來源，
GETTY IMAGES
美國約翰·霍普金斯大學彭博公共衛生學院分子微生物學與免疫學教授卡薩德瓦爾（Arturo Casadevall）指出，隨著全球氣溫上升，真菌性疾病將開始蔓延至過往從未出現的地區。
「我們知道生命具有適應與生存能力，但令人擔憂的是，隨著世界變暖，許多本來只會感染植物或昆蟲——這些體溫接近室溫的生物——的真菌，將能在更高溫環境下存活。若真如此，我們將見到一些醫學上前所未見的真菌疾病。」
此外，他指出：「濕度是影響真菌的重要因素……真菌需要大量水分，在高濕度環境中才能繁盛。」
不過，他補充，乾燥條件同樣會影響某些真菌的傳播。
「例如美國有一種名為『球孢子菌』（Coccidioides immitis，粗球黴菌）的真菌，會導致感染，在美國西南部的沙漠地區出現。但隨著沙漠擴張，這種真菌的分布範圍也在擴大。所以我認為濕度將成為一個關鍵變項，而我們知道濕度深受氣溫影響，兩者都將受到氣候變化影響。」
卡薩德瓦爾教授的研究團隊目前在約翰·霍普金斯大學所在的巴爾的摩（Baltimore）進行研究，觀察城市中不同地區的真菌分布，嘗試模擬真菌疾病的傳播範圍將如何變化。
研究發現，城市中的真菌已開始適應當地氣候，這一現象可能正在全球發生。
「我們正試圖理解這種變化如何發生。例如，較涼快的社區通常有大量樹木與草地，而較炎熱的社區則多是水泥地與缺乏綠蔭，兩者的氣溫差距可達攝氏4至5度。」
我們體內也出現了另一種溫度變化。過去，由於人體溫度較高，真菌不易滋生。但過去幾十年間，我們的體溫其實在逐漸下降。
「我們之所以能有效抵禦真菌，是因為我們擁有高度發展的免疫系統。」卡薩德瓦爾教授解釋說。
「脊椎動物都有進階的免疫系統，但人類同時還有一個優勢，就是我們的基礎體溫高，達攝氏37度。這樣的高溫能阻擋大多數真菌入侵。」
「這也是為什麼真菌感染多發生在皮膚表層，例如趾甲感染，因為那是較涼的部位。」
然而，卡薩德瓦爾指出，現代人的體溫平均比100年前低了約一度，這改變了我們對真菌疾病的易感性。
「隨著現代醫學治癒了許多傳染病，生活環境變得更潔淨，我們體內的發炎程度也下降，因此體溫隨之降低。」
換句話說，我們今天因感染而引發的免疫反應變少，導致體溫降低；而此時，地球整體氣候卻在變暖。
圖像來源，
UNIVERSAL IMAGES GROUP/GETTY IMAGES
那麼，我們可以如何保護自己？
目前最廣泛使用的一類抗真菌藥物稱為「唑類」（azoles），其作用機制是干擾真菌細胞的運作與生長。唑類藥物可用於治療多種真菌感染，同時也廣泛應用於農業上，以防止作物遭真菌侵襲。
問題在於，由於唑類使用過於頻繁，真菌已開始出現抗藥性。
英國曼徹斯特大學真菌疾病教授布羅姆利（Michael Bromley）指出，「我們觀察到這類化合物的抗藥性正迅速出現，而原因之一，是環境中殺真菌劑的使用——特別是農業上用於作物保護、避免真菌感染植物的殺菌劑。」
農業上大量使用唑類藥物，如今已被視為導致真菌在臨床上產生抗藥性的主要推手。
麴菌屬（Aspergillus）是真菌的一種，廣為人知的原因是它會導致食物腐敗與分解。
布羅姆利教授指出，歐盟每年在農作物上噴灑的唑類殺菌劑約達一萬公噸，而麴菌正是生活在土壤與堆肥中。
由於這些地區長期接觸大量殺菌劑，麴菌已進化出抵抗力——這些農業用唑類與醫院中治療真菌感染所用的藥物非常相似，導致麴菌對醫療用藥物也產生了抗藥性。
布羅姆利教授指出，有些人要求禁止在農作物上使用唑類殺菌劑，但若全面禁用，農作物的產量將下降，食品生產也會減少。
他正致力研發替代療法，並表示已成功開發出可破壞真菌細胞DNA的新型化合物，最終可導致真菌死亡。
另一種療法則是抗真菌藥物「fosmanogepix」，這是一種突破性的藥物，對酵母菌與黴菌均有效。
它的作用機制與傳統藥物不同，是干擾真菌細胞內運送維生蛋白的結構。
布羅姆利教授表示，這些新藥將在未來幾年內上市。
另外一個令人樂觀的訊號是：麴菌病——一種在體溫下能迅速繁殖、每年估計造成全球數十萬人死亡的致命真菌感染——有一項重要的限制。
「我們沒有觀察到麴菌病會在人與人之間傳播，這種情況非常罕見。看起來，我們是從環境中感染。」布羅姆利教授解釋。
「這代表，如果我們能阻止環境中抗藥性的產生，就有很大的希望讓這些新研發的藥物能長期有效。」
隨著世界人口不斷增加，人類不得不依賴殺菌劑來保護農作物，這也促使真菌逐漸進化以逃避治療。因此，研發新療法刻不容緩——而現在，部分解決方法已逐漸浮現。
問題是：我們能否及時趕上真菌的進化速度？",BBC News 中文,2025-07-03,https://ichef.bbci.co.uk/ace/ws/640/cpsprodpb/3721/live/7ad2b610-57fc-11f0-8225-6b541d104cf3.jpg.webp
日本7/5發生大地震？「末日預言」為何引發遊客恐慌,https://www.bbc.com/zhongwen/articles/c80pg389edpo/trad,"日本漫畫家竜樹諒在其作品《我所看見的未來》中暗示2025年7月5日日本將發生大地震，這被一些人當成「末日預言」。
儘管日本政府多次駁斥該說法沒有科學依據，但其仍在赴日遊客群體中引發恐慌。香港是日本主要的遊客來源地之一，在該傳言影響之下5月訪日香港遊客減少11%。",BBC News 中文,2025-07-04,https://ichef.bbci.co.uk/ace/ws/660/cpsprodpb/1329C/production/_133529487_whatsubject.jpg.webp
磁鐵在烏克蘭戰場拯救生命：「他們從我的心臟取出了彈片」,https://www.bbc.com/zhongwen/articles/ckg5dxkzjx8o/trad,烏克蘭的醫護人員表示，彈片傷如今佔戰場創傷的80%，許多前線士兵都受到近乎致命的傷害。但一種在烏克蘭製造的新型磁性裝置正在改變前線醫療的面貌。這款設備專為快速且安全地從傷口中取出彈片而設計，目前已被分發至全國各地的醫院和前線軍醫。,BBC News 中文,2025-07-02,https://ichef.bbci.co.uk/ace/ws/660/cpsprodpb/1b8a/live/3c53da30-52b2-11f0-a2ff-17a82c2e8bc4.png.webp
從中國到世界：「頂流」拉布布和它背後的千億潮玩帝國,https://www.bbc.com/zhongwen/articles/cx20jlygnx7o/trad,"尖耳朵、大眼睛，露出九顆牙齒的壞笑，這隻毛茸茸的拉布布（Labubu）正席捲全球，成為潮流玩具的超級明星。從上海到倫敦，搶購長龍隨處可見。這隻小怪獸究竟有何獨特魅力？其背後的泡泡瑪特如何憑藉盲盒模式與精準營銷，打造出千億級潮玩帝國？
本片將深入剖析拉布布的爆紅現象，探討其營銷策略、谷子經濟與情緒價值的結合，並分析這股熱潮是否能持續發酵。",BBC News 中文,2025-06-29,https://ichef.bbci.co.uk/ace/ws/660/cpsprodpb/29d8/live/f01fda20-4cbb-11f0-ae45-6122cea1a75e.jpg.webp
香港國安法5週年：你愛國嗎？國安教育工程下的師生和公眾怎麼看,https://www.bbc.com/zhongwen/articles/cly88515gp4o/trad,"香港國安法實施滿五年，在執法行動以外，教育成為當局最重點執行的其中一環。自2020年6月30日國安法時代展開後，官方全方位大推國安及愛國主義教育。這五年來，學界出現了全新的必修學科「公民與社會發展科」，歷史博物館翻新加入大型國安展廳，「全民國安教育日」被列作官方的重要日子。從校園、社區到輿論場，迎來劇烈變化的例子還有很多。
BBC親訪香港本地的大專和中學生、統籌國安教育的老師以及普羅大眾，從民間的角度看國安教育成效，並梳理這項教育工程的要點。在鋪天蓋地的官方宣傳下，愛國和國安教育走進日常視野，年青一代有真的「被教育」嗎？",BBC News 中文,2025-06-30,https://ichef.bbci.co.uk/ace/ws/660/cpsprodpb/9d0c/live/d83b14e0-518b-11f0-ba3c-7f05fe8a00f9.jpg.webp
