標題,連結,內文,來源,時間,圖片
加州近年頻遭野火肆虐控制火勢關鍵在於天候| 國際,https://news.google.com/read/CBMiWkFVX3lxTE5tbTlVdDlhWW1yamtONlBXVGtBQkFyZTlzRk9tczVtTXM3SkJ1TDBGclYwdXMzTjU3aHhxQ0lYZDFfSVdOZjhveW9VRVBYemljdGtxZDNmRUdfdw?hl=zh-TW&gl=TW&ceid=TW%3Azh-Hant,"美國南加州遭數場大型野火肆虐，消防人員仍在努力救火。專家稱在天候條件改變前，「基本上不可能」撲滅火勢。而回顧加州過往大型野火，有利天氣也是最終控制住火勢的原因。
「今日美國報」（USA Today）引述加州森林防火廳（CalFire）說法報導，截至今天中午，肆虐洛城西緣的「太平洋斷崖大火」（Pacific Palisades Fire）火災控制率僅有11%；洛杉磯東緣的「伊頓大火」（Eaton Fire）控制率為15%。
洛杉磯北部塢蘭山莊（Woodland Hills）的「肯尼斯大火」（Kenneth Fire）截至今天下午的控制率為80%；希爾馬社區（Sylmar）的「赫斯特大火」（Hurst Fire）則為76%。
洛杉磯郡（Los Angeles County）北部的「利迪亞大火」（Lidia Fire）今天上午已完全受控；而8日晚間在好萊塢山莊（Hollywood Hills）竄燒的「日落大火」（Sunset Fire）9日下午控制率即達100%。
根據加州森林防火廳，控制率是指整個火場外圍被某個界線圍住的百分比，且這道界線被認為可遏制火勢蔓延。界線可能是自然地物，例如河川或全面移除植被的空地，也可能是人為部署的消防水線。只要火勢尚未完全撲滅，就可能越過界線。
當火勢越過控制線的威脅不復存在時，才能稱火災已經「受到控制」。
現在除了鄰近的7個州和美國聯邦政府，加拿大也派遣人力至加州馳援，空中團隊朝山丘的火勢噴灑水和阻燃劑，地面工作人員則手持工具和水管管線試著撲滅火勢。
南加州秋冬季節從內陸吹向海洋的離岸風俗稱「聖安娜焚風」（Santa Ana Winds），是野火肆虐的主要因素。除了風勢強勁，也特別乾燥。
美國「財經內幕」（Business Insider）日前報導，英國斯旺西大學（Swansea University）專長野地火災科學的教授多爾（Stefan Doerr）表示，在對抗野火這方面，加州消防員的訓練及裝備在全球可說是名列前茅。
然而此時風勢極度強勁，又同時有多場大火肆虐，在助長大火的風勢減弱前，「基本上不可能撲滅這種規模的火災」。
近年來加州飽受野火肆虐。2020年8月發生在加州北部海岸山脈（Coast Range）的8月複合大火（August Complex Fire）燒掉近42萬公頃，是加州歷來最嚴重的野火。
根據哥倫比亞廣播公司新聞網（CBS News），8月複合大火源於門多西諾國家森林（Mendocino National Forest）一系列由雷擊引發的野火。消防人員共耗費87天才將火勢完全控制下來。由於火場地處偏僻，沒有平民死亡，但有1名消防人員殉職，另有約935棟建築物被毀。
當年是因為下了幾場小雨，加上天候轉為有利，消防人員和飛機才得以在11月中旬控制絕大部分火勢。
2021年7月在加州北部爆發的迪克西大火（Dixie Fire）則是加州史上第2大野火。根據哥倫比亞廣播公司新聞網，迪克西大火延燒104天、摧毀近39萬公頃後才被完全控制下來。這場大火是因樹木接觸到太平洋瓦斯電力公司（Pacific Gas and Electric Company）的電線而起。
「洛杉磯時報」（Los Angeles Times）分析，迪克西大火停止蔓延，除了天候突然轉變、有利滅火，也得歸功於當地進行「策略燒除」（prescribed burn）的歷史，這種做法有助在野火來襲前，提前清除可作為燃料的乾燥植被。
2018年7月在北加州爆發的門多西諾複合大火（Mendocino Complex Fire）是加州史上第3大野火，總共燒毀約18.6萬公頃的土地，持續161天才完全受控。
哥倫比亞廣播公司新聞網指出，門多西諾複合大火由河流大火（River Fire）和牧場大火（Ranch Fire）組成，其中河流大火成因不確定，牧場大火則是意外引發，而大火最終獲得控制也與天候有關。這場野火總共吞噬280棟建築物，並造成1名消防人員殉職。
加州史上最致命且最具破壞性的野火則是2018年11月的坎普大火（Camp Fire）。根據哥倫比亞廣播公司新聞網，這場大火延燒17天，北加州天堂鎮（Paradise）95%慘遭祝融。火災共奪走85人性命，並摧毀近1萬9000棟建築物。
當年野火熄滅前降下大雨，雖有助撲滅剩餘火勢，但也導致救難人員更難搜尋遺體。而根據調查野火的公開報告，太平洋瓦斯電力公司疏於維護電線，任由1處老舊電線劣化，因而引發這場森林野火。",Newtalk新聞,2025-01-12,https://images.newtalk.tw/resize_action2/800/album/news/953/67807c494a899.jpeg
洛杉磯野火又擴大！空拍畫面驚人 控制率仍為0%,https://news.google.com/read/CBMiWkFVX3lxTE0wU1o5M1NPazFTRUpBR3o5QS10UElWYndrUzRUalJCbTlvZ1NremJHMGhfNmZIV1lvSDl4TkhfRk1VM2MxT2t4M2YzZVpkbDhyWkVFX1FIVnVMUQ?hl=zh-TW&gl=TW&ceid=TW%3Azh-Hant,"美國加州洛杉磯野火持續狂燒，當地時間週四又出現新的地區發生大火，從空拍影像可看到，火災覆蓋範圍相當廣泛。
根據CNN報導，幾個小時前在洛杉磯郡和文圖拉郡邊境附近突然發生的肯尼斯大火，正在逼近該地區的房屋，非常危險。
報導提到，這場火災似乎是從附近的山上開始的，火災正好位於隱山 (Hidden Hills) 社區的邊緣。疏散令已到位。
火勢迅速蔓延，滾滾濃煙嚴重遮擋了視線。蔓延面積約 50 英畝，隨後發布了強制撤離令。
洛杉磯消防局在最新警報中表示，伍德蘭希爾斯的肯尼思火災正在南部燃燒。「洛杉磯消防局正在向伯班克大道以南的範諾文發出強制疏散令。 County Lane Road以東至E Valley Circle Blvd.這是針對該地區所有居民的立即疏散令。
此外，最早延燒的伊頓大火，目前已燒毀 13,690 英畝，且火勢仍在繼續擴大。洛杉磯消防局坦言，目前控制率仍為0%。",Newtalk新聞,2025-01-10,https://images.newtalk.tw/resize_action2/800/album/news/953/67807c494a899.jpeg
亂砍預算禍及民眾！洛杉磯野火史上最慘 市長去年「大砍5.5億消防預算」,https://news.google.com/read/CBMiWkFVX3lxTE9lWkFjaXQxQ2JmdmxrS1JHN3dNOTR2VEMyZWtUVDBnWjZEczVBZm9TRVZNRnByWnltU0MtaWkxbm5tcXpxcFozVWhRWUpTaFV1THdhcWRnYnhPUQ?hl=zh-TW&gl=TW&ceid=TW%3Azh-Hant,"美國洛杉磯面臨史上最嚴重野火，目前已確定至少6人死亡，上千棟房子被燒毀，18萬人撤離，延燒面積逾2.5萬英畝。美媒指出，洛杉磯市長巴斯（Karen Bass）去年才大幅削減了洛杉磯消防局預算，且消防預算遠低於街頭遊蕩的救濟支出預算。
洛杉磯市長巴斯在洛杉磯大火第一時間，正在非洲迦納參加總統馬哈馬（John Dramani Mahama）的就職典禮，儘管她立即返國，仍止不住輿論撻伐。
她8日在記者會上，面對大批媒體提問，一名英國天空新聞記者問到，「市民家園陷入火海，你卻不在，是否該道歉」，巴斯當下不發一語，接著她又被追問，「您是否後悔削減消防部門數百萬美元的預算？」巴斯隨即快閃，包含特斯拉創辦人馬斯克等人也在社群平台大力批判巴斯的無能。
此外，根據福斯財經新聞報導，巴斯去年削減了消防部門的預算，同時優先考慮為該市無家可歸者提供支出援助。洛杉磯市府2023-2024財政年度僅為洛杉磯消防局 (LAFD) 提供了 8.37 億美元的預算，僅是街頭遊蕩民眾預算 13 億美元的 65%，而在2024-2025財政年度，LAFD的預算又減少了超過1700萬美元。
這些被刪減的預算原用於消防員培訓，然而，巴斯8日在記者會不斷試圖滅火，宣稱削減預算並未影響到消防員應對野火的能力，",Newtalk新聞,2025-01-10,https://images.newtalk.tw/resize_action2/800/album/news/953/677f715943973.jpg
媽媽，妳走吧！前童星喪生洛杉磯野火| 國際,https://news.google.com/read/CBMiWkFVX3lxTFBWU3dXUlNfSlk3YTUxeWU2WW16YXRkTWJLX3BYeUZDQlRNcGE4dEFfTmg1WlRKend1YXp4VS01Y3FQamE0Wk05WVhHNGoybmduM2RUZzZQa0xWUQ?hl=zh-TW&gl=TW&ceid=TW%3Azh-Hant,"美國加州洛杉磯近期野火肆虐，已造成至少 11 人死亡，數萬居民被迫撤離。其中， 32 歲的前童星羅里 · 賽克斯（Rory Sykes）因罹患腦性麻痺，未能及時逃離火場，不幸喪生。
羅里 · 賽克斯曾參與 1998 年播出的英國實境節目《Kiddy Kapers》，因身體狀況無法外出工作，後來成為職業遊戲玩家。根據《New York Post》報導，羅里的母親雪莉（Shelley Sykes）在社群媒體上表示，當大火迅速逼近位於馬里布山的莊園時，她試圖用水管撲滅屋頂上的火星，但未見成效。在火勢蔓延之際，羅里對她說：「媽媽，妳走吧！」然而，雪莉因手臂骨折，無法抱起羅里撤離。消防員將雪莉救出後，房屋已全毀，羅里也未能倖免。
根據《The Sun》報導，此次野火對好萊塢明星的豪宅區造成嚴重破壞。包括巴黎 · 希爾頓（Paris Hilton）、比利 · 克里斯托（Billy Crystal）和安東尼 · 霍普金斯（Anthony Hopkins）等名人的住宅皆在火災中被毀。此外，洛杉磯郡的伊頓大火（Eaton Fire）和斷崖大火（Palisades Fire）已摧毀近 2000 間建築，約 18 萬人被迫撤離。
加州州長加文 · 紐森（Gavin Newsom）已部署超過 1400 名消防員進行救援，並呼籲對消防栓水壓下降的報告展開調查。目前，經濟損失估計高達 1500 億美元。儘管面臨巨大損失，居民們仍抱持希望，期盼能夠重建家園，從災難中恢復過來。
加州州長加文 · 紐森（Gavin Newsom）已部署超過 1400 名消防員進行救援，並呼籲對消防栓水壓下降的報告展開調查。   圖:擷自Gavin Newsom 個人X帳號",Newtalk新聞,2025-01-12,https://images.newtalk.tw/resize_action2/800/album/news/953/67832f5143110.jpg
洛杉磯野火肆虐哈利王子夫婦敞開豪宅大門收容災民| 國際,https://news.google.com/read/CBMiWkFVX3lxTE1ONXpUVVhCdi1YMVhwb1piNHNUa014dkxMYmZsMXZ6N3E3VjhXa2l3QlpuQjd1SmpaaTBudjlmUEdEeUVYNk42cWdMMElEZTZpRnRjNFppQ2NWZw?hl=zh-TW&gl=TW&ceid=TW%3Azh-Hant,"美國洛杉磯的野火災情持續擴大，威脅多個居民區，包括英國哈利王子一家在加州的住所也可能受波及。不過，哈利王子與妻子梅根目前尚未接獲撤離通知。他們已主動打開家門，收留無家可歸的親友，並於 10 日前往帕薩迪納會議中心探視災民，展現出溫暖與關懷。
綜合外媒報導，綜合外媒報導，哈利王子與妻子梅根自2020年就已搬到加州居住。而帕薩迪納會議中心已被當局設為疏散中心，為因野火而流離失所的居民提供庇護。哈利與梅根到訪時，不僅協助分發食品和生活必需品，還與災民互動交談，了解他們的需求。現場的志願者表示，哈利夫婦的到來給予受災家庭極大安慰與鼓舞。
此外，哈利夫婦也特別慰問前線急救人員，感謝他們為控制野火所付出的努力。他們還與「世界中央廚房」創始人、知名廚師安德烈斯（José Andrés）會面，了解為災民提供免費熱食的相關工作。
帕薩迪納市長戈多（Victor Gordo）對哈利夫婦的善舉表示高度讚賞，稱他們的到訪傳遞關懷與支持，也激勵災區的救援人員與志願者。早前，哈利與梅根也在官網發表聲明，呼籲外界關注野火災情。他們強調，野火已摧毀無數家庭與社區，導致成千上萬人受災，並呼籲社會大眾積極支持疏散中心及救援行動。
消息指出，哈利王子一家在洛杉磯的住所位於野火威脅範圍內，可能面臨斷電與撤離的風險。目前，雖未直接受影響，但哈利夫婦已做好應對準備，並持續為災民提供力所能及的援助。",Newtalk新聞,2025-01-12,https://images.newtalk.tw/resize_action2/800/album/news/953/67836a18502ef.png
洛杉磯野火颳「火龍捲」！狂燒一個舊金山聖塔安娜風又要來了| 國際,https://news.google.com/read/CBMiWkFVX3lxTE1PMGNsUDNvSTd0YVRuZXdiT2lKUVZJNmVvSWtYMmlLWXhCd3hIVHdKcEVic203ZmhQenRQcmFWVHBFLVdsMTBaZFRoa0o0d2ZuZnh0dWotbG5rUQ?hl=zh-TW&gl=TW&ceid=TW%3Azh-Hant,"美國加州洛杉磯野火持續狂燒，目前已增至24人罹難、至少16人失蹤，燃燒面積已比舊金山還要大，影響最為劇烈的富人區太平洋斷崖社區，甚至在山坡上颳起罕見的「火龍捲」，雪上加霜的是，美國氣象單位預估，造成大火的兇手之一「聖塔安娜風」，在當地時間周一到周三將再度增強。
根據美聯社報導，美國國家氣象局（National Weather Service）指出，聖塔安娜風將在本周一到本周三再度增強，洛杉磯野火地區直到本週三（15日）之前都在「紅旗警告」範圍內，持續風速最高可達時速80公里，山區陣風最高可達時速113公里，氣象學家湯普森（Rich Thompson）研判，14日是最危險的一天。
目前主要2場野火已焚毀1.4萬公頃土地與1.2萬座建築，太平洋斷崖野火（Pacific Palisades Fire）僅11%得到控制。逐漸威脅附近Brentwood等地區，位於洛杉磯東側的伊頓野火（Eaton fire）則有約27%火場面積受控。
太平洋斷崖野火10日火勢迅速朝向布倫特伍德（Brentwood）附近的曼德維爾峽谷（Mandeville Canyon）方向蔓延時，甚至在山坡上出現罕見的「火龍捲」，只見火焰漩渦逐漸形成後，如一條龍往上竄升，並在商坡上到處亂竄，景象驚人。",Newtalk新聞,2025-01-13,https://images.newtalk.tw/resize_action2/800/album/news/953/67848f0e4cbe9.jpg
洛杉磯野火助燃劑「聖塔安娜風」飆風再起！ 罕見紅旗警告 野火元兇被揪出了？,https://news.google.com/read/CBMiWkFVX3lxTE9IY1MtUUZqU2RjZzhhTGVtdnhvdFRtUVNSVk9ibXlPSXM5MDRnMXlhUF9NWXBIUjMxWkZjQVlOU0gyb09ua0RPRVdTUWJLOWxmMU5Md1BvWERDdw?hl=zh-TW&gl=TW&ceid=TW%3Azh-Hant,"美國加州洛杉磯野火自7日起延燒多日，目前造成至少24死29失蹤，雪上加霜的是，造成大火迅速蔓延的「聖安娜焚風」（Santa Ana Winds）本週一到周三飆風再起，美國國家氣象局更為此罕見發布「特別危險情況」紅旗警告（RED FLAG WARNINGS）。
美國國家氣象局提醒，當地時間13日晚間「聖安娜焚風」將再度增強，預估14日清晨4點風力達到顛峰，風速將高達時速120公里。
洛杉磯郡消防單位指出，聖塔安娜焚風加上溼度超低的乾燥環境，使得火災風險大大提高，自13日至15日，該郡和加州的文杜拉郡均將維持「紅旗警告」。
洛杉磯野火元兇眾說紛紜，根據《CNN》報導，房產伊頓山（Mount Eaton）大火中被燒毀的受災戶葛爾西（Jeremy Gursey）13日對南加州愛迪生電力公司（Southern California Edison，SCE）提告，他指出，鄰居艾瑞科（Marcus Errico）在7日下午6時15分左右拍攝到伊頓峽谷1座SCE的電塔下方出現小火災、質疑這就是洛杉磯野火元兇。",Newtalk新聞,2025-01-14,https://images.newtalk.tw/resize_action2/800/album/news/953/677f3f1b4fc22.jpg
洛杉磯野火蔓延釋出有毒煙霧 當局呼籲待在室內 外出配戴N95口罩,https://news.google.com/read/CBMiWkFVX3lxTE5HMVc5bzY5WUhrbGwybk5SNWJhejhWNkVFWWtJRnFZNUZpdS1NbHYyNXNhdW8zSy1ITlE2RF8tVkNWWEgwbXJKTDRSSEtLdGNPblZ0OGlELWp1Zw?hl=zh-TW&gl=TW&ceid=TW%3Azh-Hant,"美國加州洛杉磯地區近日遭受猛烈野火侵襲，大片地區被濃煙籠罩，當地公共衛生官員警告，這場災難性的大火不僅吞噬房屋與植被，更釋放大量有毒煙霧，對健康造成嚴重傷害。
根據《法新社》報導，這場野火正向洛杉磯地區釋放大量有毒氣體，使美國第二大城市的空氣品質急劇惡化，大片區域瀰漫令人窒息的煙霧。而洛杉磯郡公共衛生局局長馬哈揚（Anish Mahajan）於當地時間1月12日的記者會上表示，野火煙霾的主要成分包括細小顆粒、氣體與水蒸氣，這些物質會進入人體呼吸道，引發喉嚨痛、頭痛等不適症狀。他強調：「即使是在看不到煙霾的地區，空氣品質仍然可能受到影響，因此所有居民應盡量減少戶外活動。」
馬哈揚進一步指出，健康狀況良好的人也應盡可能待在室內，並使用空氣濾清機改善室內空氣品質。對於需要在戶外工作的民眾，他建議佩戴 N95 口罩，以過濾掉有害微粒，降低健康風險。
馬哈揚警告，最需特別注意的是健康較脆弱的族群，包括兒童、老人、患有呼吸系統與心血管疾病的民眾，以及免疫力較弱者。這些族群可能會出現較為嚴重的症狀，如呼吸困難、喘息、咳嗽與胸痛等。
此次野火已摧毀大量房屋、商業建築、車輛與大片植被，使塑膠、化學品、燃料與建材燃燒後的有害物質懸浮於空氣中，進一步加劇污染狀況。隨著野火持續蔓延，當局呼籲居民保持警覺，遵循防護建議，以確保自身及家人健康安全。",Newtalk新聞,2025-01-12,https://images.newtalk.tw/resize_action2/800/album/news/953/67836cff5a94c.jpeg
洛杉磯野火24死！動物也遭殃小貓被燒傷可憐畫面曝光| 國際,https://news.google.com/read/CBMiWkFVX3lxTFBWel9LQ3pndVIta283blRsSDBzZ2lnSlIxdWtPNDhhQmR3QzBlaE0wVFV6OUN2LW9obk04dFdfOVdfR0tVVldJRm01QWwzdzdKbWJDNE1GaGZWdw?hl=zh-TW&gl=TW&ceid=TW%3Azh-Hant,"美國加州洛杉磯野火肆虐，目前已造成至少24人罹難，就連動物也無法倖免，許多動物或寵物在大火中遭到燒燙傷，大量動物湧入動物收容所，且情緒相當低落。
根據美聯社報導，洛杉磯當地的薩迪納人道協會（Pasadena Humane）在野火爆發首日就展開動物收容作業，短短幾天就收容了大約400隻來自洛杉磯市郊阿爾塔迪納（Altadena）的動物，當地逾5600公頃的土地已遭大火燒毀。
薩迪納人道協會透過粉專發出捐款呼籲，強調現在非常需要民眾的幫忙，，他們將繼續收留失蹤、受傷和無家可歸的動物，希望透過大家的捐款，可以幫助他們為最需要的動物提供緊急資源。
薩迪納人道協會臉書粉專也貼出許多在收容所的動物醉心近況，可看到有許多貓和狗身上都帶著燒傷，只見一隻貓咪的貓毛幾乎都被火燒到，呈現捲曲狀，一隻哈士奇的顏色也被大火燻灰，且有多處受傷的情況出現。",Newtalk新聞,2025-01-13,https://images.newtalk.tw/resize_action2/800/album/news/953/67849c5b2d6b2.jpg
洛杉磯野火燒毀10面奧運獎牌 國際奧委會將補發美國游泳名將復刻品,https://news.google.com/read/CBMiZkFVX3lxTE1MR1RNb1lHeEdpMGhEQkdtMWF5bEZ5NE9MSkJkQmxQLXVjcTZ6ZkFMQVZ5UWM0Qzd4NWh6aXNndnFiZTJyVDliMmNHUHF5YzZfU1JrUk90TzBrWWVYb0RNWHQ5Ni1kd9IBa0FVX3lxTE5ZYWxxWDFXMm9TTGZlTDRMZnpVa3N5U2VMNk5SdGNQQUt6YXdBWmdmc3VVV295NFhyYkdiTy1LTUdfYUZVdlJ2Qmw3SlNOb0ZxR1JGUHduS1NXNXRpeVlaUVNaVUtJN1BiLTlN?hl=zh-TW&gl=TW&ceid=TW%3Azh-Hant,"美國游泳奧運名將霍爾。（美聯社檔案照）
黃其豪／核稿編輯
〔即時新聞／綜合報導〕美國加州洛杉磯爆發嚴重森林野火，死亡人數增至24人，上萬棟建物遭燒毀，數萬人被迫撤離家園。住在高級社區「太平洋帕利薩德」（Pacific Palisades）的名人首當其衝，其中包括美國游泳奧運金牌得主霍爾（Gary Hall Jr.），他在撤離時來不及帶走10面奧運獎牌。對此，國際奧林匹克委員會（IOC）主席巴赫今日承諾，將補發一套新的獎牌給他。
綜合外媒報導，當時霍爾看見山頂冒出第一縷煙霧後僅有3分鐘時間反應，他僅攜帶愛犬、糖尿病治療用的胰島素、一幅祖父的畫作及女兒贈送的宗教木製藝品匆忙撤離，而放置在臥室的10面奧運獎牌隨大火付之一炬。
霍爾曾在1996年、2000年及2004年三屆奧運上贏得5面金牌、3面銀牌及2面銅牌，是美國泳壇的重要人物。
國際奧委會主席巴赫（Thomas Bach）12日表示，將準備一套復刻的獎牌給霍爾，以代替他在火災中失去的榮譽，「我們也知道偉大的奧運選手霍爾在大火中失去他的獎牌，國際奧委會將為他提供複製品」。
巴赫也對洛杉磯市民表達關心與支持，高度讚揚消防隊和安全部隊為撲滅大火所付出的努力。他強調，目前首要任務是集中力量撲滅火勢，並保護更多人員與財產安全。
不用抽 不用搶 現在用APP看新聞 保證天天中獎　 點我下載APP　 按我看活動辦法",自由時報,2025-01-13,https://img.ltn.com.tw/Upload/news/600/2025/01/13/phpmyDXVa.jpg
洛杉磯知名博物館遭野火逼近！驚險畫面曝光,https://news.google.com/read/CBMiZkFVX3lxTE14WWNMRVhfdmFBUUhJbUxoREg4ZFducE1jbUVrdGE1bUVTZHdhT1d5bTNmXzFOdjBKZXpBWmtCT19uSEM5OG4zSHN1REJIMlc5dERIZTBoV0t0MlVQaWkwMDhvdi12d9IBa0FVX3lxTFBNUW1Jd0RFUG5IUmZxWnZQV3hHMW9qZGNlQlcwOGVjaWJKVlRCQ21CVXRrcWJES19sSFVpemFRMENUOFprSWxUUmxjOUZNbU5UeGVMNUhWVW41MUdhbDhoVGNGbHhsbXZZX0NV?hl=zh-TW&gl=TW&ceid=TW%3Azh-Hant,"美國洛杉磯博物館蓋蒂別墅收藏了不少古文物，遭野火逼近險象環生。（法新社）
黃邦平／核稿編輯
〔即時新聞／綜合報導〕美國加州洛杉磯野火肆虐！J·保羅·蓋蒂博物館（J. Paul Getty Museum）位於洛杉磯的場館蓋蒂別墅（Getty Villa）收藏了不少古文物，此次遭野火逼近險象環生，從現場畫面可以看到鄰近一整排建物都已燒毀，隔壁陷入熊熊野火。
據《福斯新聞》報導，J·保羅·蓋蒂信託執行長弗萊明（Katherine E. Fleming）11日表示，他們被通知風勢會越來越強，館員正在密切觀察豪宅區的太平洋斷崖（Pacific Palisades）野火動向，至少到目前為止都是安全的。
蓋蒂別墅收藏了古希臘、古羅馬、伊特拉斯坎文明（義大利半島和科西嘉島西元前12世紀至前6世紀）的文物，館方工作人員一直在清除附近的灌木叢，避免火勢延燒過來。
從另個角度可以看到博物館旁邊建物燒掉一整排。（法新社）
指向蓋蒂別墅的路牌被煙霧壟罩。（法新社）
不用抽 不用搶 現在用APP看新聞 保證天天中獎　 點我下載APP　 按我看活動辦法",自由時報,2025-01-12,https://img.ltn.com.tw/Upload/news/600/2025/01/12/phpcBsCCL.jpg
加州野火宛如末日 15萬人撤離,https://news.google.com/read/CBMiXEFVX3lxTFBSdUFJMDhxRjlacHJzSWs1S2syNUhmT2Jfb3Bsd25GUGpUVE8yTmwtV3d0N2psM1JmYW5ZNjg3RjhDaEZmOGgtVEh3TjIwMVVDdFE5cmNQV3RtSXdY0gFiQVVfeXFMTUZ0S29IbHNZeHFiR0pHTVRIRVNRa0kyNXpINVpINnYtbTR6WVVtVC1zUEpKVWtoZnR2d3pXU25tU3lVLXFVRVQtSHI3STdFTW5ybnhoWXZNaHJ5X041c09LeEE?hl=zh-TW&gl=TW&ceid=TW%3Azh-Hant,"美國加州洛杉磯野火持續肆虐，至少5人死亡，摧毀1500棟建築物。（法新社）
美國加州洛杉磯野火持續肆虐，成為當地史上破壞力最強的野火，造成至少5人死亡，摧毀1500棟建築物，數十萬戶家庭和企業停電，加州最受好萊塢名人青睞的大片房地產陷入火海。當局下令15萬名民眾撤離，總統拜登宣布加州進入聯邦緊急狀態，將提供經費和資源協助救災，並取消出訪義大利行程，連奧斯卡主辦單位也宣布延後公布入圍名單。據報導，野火已燒毀濱海小鎮聖塔蒙尼加及馬利布（Malibu）之間至少1.2萬英畝土地。當地居民表示，野火擴散又快又急，「宛如世界末日」。（法新社）
不用抽 不用搶 現在用APP看新聞 保證天天中獎　 點我下載APP　 按我看活動辦法",自由時報,2025-01-10,https://img.ltn.com.tw/Upload/news/600/2025/01/10/171.jpg
川普拍板！將於24日視察加州野火災區,https://news.google.com/read/CBMiZkFVX3lxTE5YNUV1V2pwMXllLTd6bGxJRXpCWFVWRFA1ZTdhTmxRYlJrc2VyT1BvUEgyZU91Y24yN0twUFZBc0ZxeF9JMERFWU50Ql9oeW1Vbzgxa3E1WG9GcWIzWnRUMmhENzBRZ9IBa0FVX3lxTE9xSU9NTm12WnBydkZlOGJqNmxKdUlvZFpQbXF4cDZRWldrMDduTUMtTVVfZlBoX3NtbVlMTEJLajFnMFBwWHVVMlp2RmFKZ0tWcFl6bFFvMHZhU0VodE1fQkIyUGVNOHVFRUUw?hl=zh-TW&gl=TW&ceid=TW%3Azh-Hant,"川普宣布24日將前往南加州視察野火災情。（法新社）
黃其豪／核稿編輯
〔即時新聞／綜合報導〕即將於20日就職的美國候任總統川普，19日晚間在華府第一資本體育館（Capital One Arena）的政治集會上，透露自己將於本週五（24日）前往南加州視察野火災情。
據《Politico》報導，這可能是川普重返白宮後的首次外出訪察，川普在台上向集會民眾表示，他去探視災區後，會聘請全球最好的建築商，力求讓當地恢復原貌。
加州洛杉磯野火從本月7月肆虐至今，至少已造成27人死亡，民主黨籍州長紐森（Gavin Newsom）和川普之間關係緊張，雙方並未就野火問題進行過任何溝通。
不用抽 不用搶 現在用APP看新聞 保證天天中獎　 點我下載APP　 按我看活動辦法",自由時報,2025-01-20,https://img.ltn.com.tw/Upload/news/600/2025/01/20/phpXRd1YV.jpg
