標題,連結,內文,來源,時間,圖片
快訊》宜蘭大雷雨還要下一小時！氣象署針對5縣市發大雨特報| 生活,https://newtalk.tw/news/view/2025-04-20/966436,"氣象署下午發布大雨特報，對流雲系發展旺盛，易有短延時強降雨，今(20)日宜蘭地區及新北至苗栗山區有局部大雨發生的機率，請注意雷擊及強陣風，山區慎防坍方、落石及溪水暴漲。氣象署針對「宜蘭縣」發布大雷雨即時訊息，持續時間至17時45分止。
氣象署下午對5縣市發布大雨特報，包括新北市、桃園市、新竹縣、苗栗縣、宜蘭縣，另氣象署針對「宜蘭縣」發布大雷雨即時訊息，持續時間至17時45分止。
大雨特報。   圖：翻攝自中央氣象署官網",Newtalk新聞,2025-04-20,https://images.newtalk.tw/resize_action2/800/album/news/967/6804b6fe5fdb9.png
3縣市大雨特報明回溫後、週一又有鋒面報到| 生活,https://newtalk.tw/news/view/2025-04-26/967610,"今天(26日)日東北季風影響及華南雲雨區東移，北部及東半部有短暫陣雨，基隆北海岸、宜蘭、花蓮地區及大台北山區有局部大雨發生的機率，戶外活動請攜帶雨具，明天(27日)短暫放晴後，下週一又有另一波鋒面快速通過，各地再轉為不穩定天氣。
氣溫方面，北部、東北部及東部整天偏涼，其他地區早晚亦涼，預測低溫在中部以北及東北部約18至21度，其他地區22至23度，白天北部、東北部及東部高溫約23至25度，其他地區約27至31度，南北溫差較大，南來北往請留意溫度變化，澎湖：陰時多雲，氣溫22至25度；金門：陰時多雲短暫陣雨，氣溫18至23度；馬祖：陰短暫陣雨，氣溫17至20度。
氣象署提醒，下週一又有鋒面通過及東北季風增強，雨區擴大，幾乎全台容易受影響，由於大氣不穩定，可能出現局部較大雨勢。
空氣品質方面：26日東北季風影響及華南雲雨區東移，環境風場為東北風，中部以北降雨機率上升，受降雨洗除作用影響，擴散條件稍轉好，南部污染物仍稍易累積；北部、竹苗、中部、雲嘉南、高屏、宜蘭、花東空品區及馬祖、金門、澎湖為「普通」等級，北部局部地區可能達橘色提醒等級。",Newtalk新聞,2025-04-25,https://images.newtalk.tw/resize_action2/800/album/news/968/680c1b9aa452b.png
雨帶已達大台北地區！專家：東北部地區單日雨量達「大雨」等級,https://newtalk.tw/news/view/2025-04-25/967440,"根據中央氣象署雷達合成回波圖顯示，目前一波雨帶已進入大台北和苗栗地區，將為苗栗以北地區帶來較大雨勢。天氣風險公司氣象分析師薛皓天表示，今日(25)受東北季風影響，基隆北海岸、東北角及宜蘭等迎風面地區單日雨量有機會達到大雨等級，出門務必攜帶雨具。
薛皓天說明，今日東北季風增強，帶動鋒面往南移動，加上台灣海峽上仍有對流雲系發展。根據中央氣象署雷達合成回波圖顯示，今日上午10時許，雨帶已抵達大台北地區，籠罩範圍包括基隆、台北市、新北市、北桃園、苗栗、台中和南投山區，預計未來幾小時內，雨帶將為上述地區帶來較大雨勢。
薛皓天分析，今日嘉義以北及東半部地區皆有短暫雨或雷雨發生機率，南部地區僅山區有短暫陣雨機會，但基隆北海岸、東北角及宜蘭局部地區將有較大雨勢，日雨量有機會達「大雨」等級。
此外，薛皓天提醒，受鋒面影響，今日中北部及花東地區明顯轉涼，白天高溫僅24至26度，且日夜溫差較大，凌晨氣溫有機會下探1字頭，中部以北地區的朋友出門除了要記得攜帶雨具外，外套也不能少。
根據中央氣象署雷達合成回波圖顯示，目前一波雨帶已進入大台北和苗栗地區，將為苗栗以北地區帶來較大雨勢。   圖：翻攝自中央氣象署雷達合成回波圖",Newtalk新聞,2025-04-25,https://images.newtalk.tw/resize_action2/800/album/news/571/609213d0a3a0b.jpeg
土耳其逮捕反對黨領袖掀波 德國擬阻止數十架「颱風」戰機軍售案,https://def.ltn.com.tw/article/breakingnews/5018291,"西班牙空軍所屬「颱風」戰鬥機，土耳其擬採購40架，卻可能因為國內政局動盪而生變。（彭博社檔案照）
〔記者涂鉅旻／綜合報導〕土耳其伊斯坦堡市長、反對派領袖伊瑪莫魯（Ekrem Imamoglu）上月遭土耳其政府逮捕，不僅引發大規模抗議，也對土耳其對外軍購造成影響。綜合外國媒體與軍聞網站報導，土耳其原欲採購「颱風」（Eurofighter Typhoon）戰機，卻因合作生產國之一的德國，對土耳其民主有所質疑，因此主張拒絕這項軍售案。
土耳其3月19日以伊瑪莫魯涉嫌貪汙、協助恐怖組織為由予以拘捕，由於伊瑪莫魯是土國最大反對黨共和人民黨（CHP）領袖，有機會在2028年問鼎總統大位，在他被捕後，旋即引發土國內部動盪，數萬名民眾上街抗議，國際社會也密切關注此事對於土國民主制度的影響。
值得注意的是，土耳其原有意採購40架「颱風」戰鬥機，由於這款第四代戰機是英國、德國、西班牙與義大利共同研製，因此相關軍售案也須獲得這四國首肯。原本立場趨於保留的德國，在其他三國說服下，2023年底終於給予正面回應，土耳其於上月正式遞交採購申請。
伊斯坦堡市長伊瑪莫魯（Ekrem İmamoğlu）遭逮捕後，掀起土耳其國內軒然大波，反對黨亦號召群眾上街示威。（法新社檔案照）
但在土耳其政治風暴下，德國媒體《商報》（Handelsblatt）與多家外國軍聞網站17日起報導，德國看守政府聯盟擬再轉向，拒絕向土耳其供售「颱風」戰機，德國官員私下表示，土耳其總統艾多根（Recep Tayyip Erdogan）之舉是對該國「民主的攻擊」，若在此情況下批准軍售案並不妥適。
「颱風」戰鬥機是英國、德國、西班牙與義大利共同研製，採用雙發動機並搭載先進雷達，具備視距外空戰、電子作戰與追蹤多目標能力，最高時速可以達2馬赫左右。除了上述四國，還有奧地利、沙烏地阿拉伯、阿曼、科威特與卡達等五國採用。
不用抽 不用搶 現在用APP看新聞 保證天天中獎　 點我下載APP　 按我看活動辦法",自由時報,2025-04-21,
