標題,連結,內文,來源,時間,圖片
霍爾木茲海峽：美國務卿盧比奧呼籲中國阻止伊朗封鎖行動，這一波斯灣咽喉有多重要？,https://www.bbc.com/zhongwen/articles/c98j5721024o/trad,"圖像來源，
GETTY IMAGES
美國國務卿盧比奧呼籲中國採取行動，防止伊朗關閉霍爾木茲海峽（Strait of Homuz）這個全球最重要的石油運輸咽喉。
在此之前，伊朗國有電視台報導稱，議會已經批准了關閉該海峽的計劃，但最終決定要由最高國家安全委員會（Supreme National Security Council）作出。
美國日前對伊朗核設施發動攻擊後，原油價格應聲上漲，布倫特原油價格更創下五個月來新高。
盧比奧週日接受福斯新聞訪問時表示：「我鼓勵中國政府打電話給他們（伊朗），因為他們非常依賴霍爾木茲海峽運輸石油。」
他補充說：「如果伊朗真的封鎖海峽……那就是經濟自殺。我們已有應對選項，但其他國家也應正視此事，因為他們的經濟受創將遠大於我們。」
End of 熱讀
BBC波斯語部對這條海峽的經濟戰略意義和伊朗可能採取的具體行動分析如下：
全球約五分之一的原油經由這條最窄處僅40公里的航道運輸。
英國軍情六處（MI6）前處長亞歷克斯·楊格爵士（Sir Alex Younger）曾向BBC表示，他預測的最壞情境包括封鎖該航道，「關閉霍爾木茲海峽將對油價造成巨大衝擊，帶來嚴重的經濟問題。」
美國能源資訊署（EIA）估計，2023年上半年每天約有2000萬桶石油經過該海峽，相當於每年約6000億美元的海路能源貿易。
任何對該水道的干擾都可能導致全球石油運輸延誤，並立即推高油價。
但分析人士警告，更嚴重的後果可能是以伊衝突升級，甚至引發包括依賴海灣石油進口的美國在內的其他國家介入。
霍爾木茲海峽位於伊朗與阿曼之間，進出口處約50公里寬，最窄處約40公里。
但是，只有中間部分水深足以容納大型船隻。
航海圖上劃定了安全的進港航道、出港航道，以及兩者之間的緩衝區——這些都是專為重型油輪設計的。整體而言，大型船隻只能在約10公里寬的航道中航行。
當油輪駛入波斯灣時，會接近大通布島與小通布島——這兩座島嶼是伊朗與阿拉伯國家之間的爭議領土。
許多專家認為，若要干擾海上交通，最可能的方式是採取軍事行動。這種情況曾在1980年至1988年的兩伊戰爭期間發生過。
圖像來源，
GALLO IMAGES VIA GETTY IMAGES
分析人士指出，對伊朗而言，關閉霍爾木茲海峽是一種「威懾力量」，類似於擁有核武。
國際社會長期反對伊朗發展軍事核計劃，也多次表明不會允許德黑蘭利用其地理優勢來扼制全球能源供應。
專家普遍認為，伊朗或許能暫時封鎖海峽，但美國及其盟友可迅速以軍事手段恢復航運。
圖像來源，
NURPHOTO VIA GETTY IMAGES
美國國會研究處（US Congressional Research Service）在2012年報告指出，伊朗可能採取漸進式策略，包括：
圖像來源，
AFP VIA GETTY IMAGES
在兩伊戰爭期間，伊朗曾使用飛彈攻擊油輪，並在波斯灣佈雷。
其中一次佈雷行動擊中美國海軍薩繆爾·B·羅伯茲號護衛艦（USS Samuel B Roberts），促使美軍反擊。
伊朗當時雖未能完全封鎖海峽，但已大幅提高航運保險費用，並造成出口瓶頸。
圖像來源，
NORBERT SCHILLER VIA GETTY IMAGES
在以色列空襲德黑蘭、導致伊斯蘭革命衛隊（IRGC）指揮官侯賽因·薩拉米（Hossein Salami）少將身亡前兩天，他曾視察駐守霍爾木茲海峽的海軍部隊。
他強調波斯灣及其周邊是伊朗最重要的防禦區域之一，並指出快速導彈艇可在三分鐘內航行10公里。
圖像來源，
NURPHOTO VIA GETTY IMAGES
薩拉米將軍表示，這些快速攻擊艦艇、重型戰艦與飛彈將用於防禦行動。他強調反艦水雷是「海戰中最具決定性的武器之一」。
他還表示，海軍無人機的「射程、破壞力和任務範圍」已得到擴展。
專家預測，伊朗若要阻止每月約3000艘船隻通過霍爾木茲海峽，最有效的手段之一可能是利用快艇與潛艇佈設水雷。
伊朗正規海軍與伊斯蘭革命衛隊（IRGC）海軍也可能對外國軍艦與商船發動攻擊。
然而，大型軍艦本身也可能成為以色列或美國空襲的明顯目標。
伊朗的快艇通常配備反艦飛彈，此外還擁有多種水面艦艇、半潛艇與潛艇。
目前，使用衛星影像的海上追蹤網站已偵測到伊朗軍艦在其南部海域附近活動的跡象。
圖像來源，
GETTY IMAGES
數據公司Vortexa指出，沙烏地阿拉伯每天經霍爾木茲海峽出口約600萬桶原油，為鄰國中最多。
中國、印度、日本與南韓則是原油的主要進口國。
美國能源資訊署估計，2022年約82%的原油與凝析油（通常與天然氣一同產生的低密度液態碳氫化合物）出口至亞洲。
2025年4月16日，以色列導彈攻擊伊朗防空系統之後僅三天，伊朗官方新聞社伊斯蘭共和國通訊社（IRNA）即援引時任韓國總統尹錫悅表示，該國60%的石油經由霍爾木茲海峽輸送。
美國每天從該海峽進口約70萬桶原油與凝析油，約佔其總進口量的11%、汽油消耗的3%。
歐洲的總進口量則不到每日100萬桶。
因此，似乎阿拉伯與亞洲國家在霍爾木茲海峽封鎖情境下的損失，將遠大於政治上站隊以色列的美國與歐洲。
圖像來源，
CFOTO / FUTURE PUBLISHING VIA GETTY IMAGES
中國是經霍爾木茲海峽輸送石油的最大消費國之一，其中相當部分來自伊朗，價格低於全球市場價，對備受美國制裁的伊朗經濟至關重要。
作為伊朗石油的主要買家，北京不太可能接受油價上漲或航運中斷，預料將全力透過外交手段避免海峽關閉。
能源顧問公司Outlook Advisors合夥人阿納斯·艾爾哈吉（Anas Alhajji）對CNBC表示，關閉海峽對伊朗盟友的傷害要大於對它的敵人：「他們（伊朗）不會做出首先傷害自己的事。」
圖像來源，
CHIP HIRES VIA GETTY IMAGES
封鎖霍爾木茲海峽的威脅多年來持續存在，這促使海灣地區的石油出口國積極發展替代路線。
根據美國能源資訊署報告，沙烏地阿拉伯已啟用其東西輸油管線，這條長達1200公里的管線每日可輸送多達500萬桶原油。
2019年，沙特曾暫時將一條天然氣管線改作原油輸送用途。
阿聯酋則已建成一條管線，將內陸油田與阿曼灣的富查伊拉港（Fujairah）連接起來，日輸送能力達150萬桶。
2021年7月，伊朗啟用戈雷－賈斯克（Goreh–Jask）輸油管線，目的是將原油運往阿曼灣。該管線目前每日可輸送約35萬桶原油——儘管有報導指出其尚未完全投入運作。
國能源資訊署估計，這些替代路線合計每日可處理約350萬桶原油，約占目前經霍爾木茲海峽運輸量的15%。",BBC News 中文,2025-06-18,https://ichef.bbci.co.uk/ace/ws/640/cpsprodpb/abc6/live/bb814f70-4fee-11f0-873a-9d43976f36cd.jpg.webp
美國空襲伊朗已知細節：七架B2隱形轟炸機，14枚鑽地彈，戰斧導彈，18小時橫跨大西洋的奔襲,https://www.bbc.com/zhongwen/articles/cwykx01lgrzo/trad,"圖像來源，
REUTERS
美國總統特朗普表示，美軍對伊朗的三個核設施發動了一次「成功的」轟炸攻擊，並稱這些設施已被「徹底摧毀」。
週日，五角大樓表示，雖然需要時間來全面評估此次攻擊的效果，但看起來所有設施都遭受「極其嚴重的破壞」。
以色列表示，他們在策劃這次打擊行動時與美國「完全協調」。伊朗官員則確認設施遭到攻擊，但否認遭受重大打擊。
這次空襲標誌著伊朗與以色列持續衝突中的一次重大升級。
以下是我們目前掌握的情況。
End of 熱讀
美國參謀長聯席會議主席丹·凱恩（Dan Caine）將軍表示，「午夜鐵鎚行動」（Operation Midnight Hammer）出動了125架美軍軍機，其中包括7架B-2隱形轟炸機。
美方表示，三個核設施成為攻擊目標——分別是福爾多（Fordo）、納坦茲（Natanz）和伊斯法罕（Isfahan）。
在五角大樓的簡報中，凱恩表示轟炸機從美國出發，飛行了18小時，其中一些飛往太平洋方向作為「誘餌」，而主要攻擊機群則由七架B-2轟炸機組成，飛向伊朗。
就在飛機進入伊朗領空之前，美國一艘潛艇向伊斯法罕目標發射了20多枚戰斧（Tomahawk）巡航導彈。
當轟炸機進入伊朗領空時，美軍部署了「數項欺敵戰術，包括誘餌」，並由戰鬥機事先清理空域，偵查是否有敵機和地對空導彈。
領頭的B-2轟炸機在福爾多核設施投下兩枚GBU-57「巨型鑽地炸彈」（MOP，又稱「地堡破壞者」）。凱恩表示，在兩個目標區域總共投放了14枚MOP炸彈。
凱恩說，三個伊朗核基礎設施目標在美東時間下午6時40分至7時05分之間被擊中。轟炸任務結束後，飛機離開伊朗領空，開始返航。
凱恩說，「伊朗的戰機沒有起飛，伊朗的地對空導彈系統似乎也沒有偵測到我們。」
在同場簡報會上，國防部長皮特·海格瑟斯（Pete Hegseth）表示，此次行動沒有針對伊朗軍隊或伊朗人民。他補充說，這次任務「並不是、也從來不是為了政權更迭」。
這位國防部長也表示，他感謝「我們在以色列的盟友」所提供的支持，並指出這次行動經過數月及數週的策劃。
隱藏在偏遠山區的福爾多（Fordo）核設施內，設有一座對伊朗核野心至關重要的鈾濃縮工廠。這座設施位於德黑蘭以南，被認為埋藏在地下的深度甚至超過連接英國與法國的英吉利海峽隧道。
由於福爾多基地位於深地下，只有美國擁有足以穿透該設施的「地堡破壞者」炸彈。
據專家指出，這種炸彈重達13,000公斤（30,000磅），能穿透約18米的混凝土或61米的土層後爆炸。
儘管福爾多隧道深不可測，「巨型鑿地炸彈」未必一定成功，但它是唯一有可能接近摧毀該設施的炸彈。
凱恩將軍證實，在七架B-2「幽靈」轟炸機的打擊行動中，14枚MOP炸彈屬於對伊朗發動攻擊所用的「75枚精確制導武器」的一部分。
凱恩將軍表示，全面評估美軍攻擊所造成的損害程度仍需一些時間。
但他指出，「初步的戰損評估顯示，三個核設施都遭受了極為嚴重的破壞與摧毀」。
根據6月22日拍攝的新衛星圖像顯示，福爾多核設施出現了六個新彈坑，可能是美軍炸彈的進入點，又可見灰色粉塵與碎片散落山坡。
在美方確認此次攻擊使用了「巨型鑽地彈」（Massive Ordnance Penetrator, MOP）後，麥肯錫情報服務公司的資深圖像分析師斯圖·雷（Stu Ray）對BBC事實查核表示：「你不會在爆炸點看到巨大的爆炸痕跡，因為這種炸彈並不是在接觸地面時引爆，而是在深入設施內部後才爆炸。」
他補充說，看起來有三枚炸彈分別落在兩個不同的目標點，而地面呈現灰色的區域可能是爆炸後被炸出的混凝土碎片。
斯圖·雷還指出，隧道入口似乎已被封鎖。由於周圍沒有明顯的彈坑或撞擊痕跡，他推測這可能是伊朗方面為了「防止入口成為空襲目標而主動封閉」。
伊朗原子能機構稱，轟炸這三處核設施是對國際法的「野蠻侵犯」。
沙特阿拉伯和國際原子能機構（IAEA）都表示，空襲後並未偵測到輻射水平上升。
伊朗國家廣播公司政治副主任哈桑·阿貝迪尼（Hassan Abedini）表示，伊朗早已將這三處核設施「提前撤離」。他在國營電視台上表示，伊朗「並未遭受重大打擊，因為材料早已被轉移」。
圖像來源，
REUTERS
在美國發動轟炸的數小時內，伊朗發射新一輪導彈襲擊，擊中了特拉維夫與海法的部分地區。官員表示至少有86人受傷。
週日，伊朗總統馬蘇德·佩澤什基安（Masoud Pezeshkian）表示，美國「必須為其侵略行為付出代價」。
他在聲明中表示：「我們一直表示願意在國際法框架下進行接觸與談判，但對方沒有接受理性，而是要求伊朗民族投降。」
BBC安全事務記者法蘭克·加德納（Frank Gardner）指出，面對美國的突襲，伊朗現在可能在三條戰略路徑中做出抉擇：
美東時間晚上7時50分，特朗普在他的Truth Social平台上確認了對福爾多、納坦茲和伊斯法罕的打擊行動。
兩個多小時後，特朗普與副總統萬斯（JD Vance）、國務卿盧比奧（Marco Rubio）及國防部長海格瑟斯（Hegseth）一同出現在電視講話中。
他表示，除非伊朗尋求外交解決方案，否則未來的打擊將會「更為猛烈」。
「記住，我們還有很多目標未動手。」他補充說。
特朗普的多位共和黨同僚已發表聲明支持此次行動，其中包括德州參議員特德·克魯茲（Ted Cruz），他「讚揚」了總統的決定。
參議院少數黨領袖米奇·麥康奈爾（Mitch McConnell）——一位有時對特朗普持強烈批評態度的建制派共和黨人——則稱這是「對德黑蘭好戰分子的審慎回應」。
但並非所有共和黨人都表達支持。通常堅定挺特朗普的喬治亞州國會女議員瑪喬麗·泰勒·格林（Marjorie Taylor Greene）則表示：「這不是我們的戰爭。」
共和黨眾議員湯瑪斯·馬西（Thomas Massie）本週稍早才提出一項法案，試圖禁止特朗普在未經國會批准下對伊朗採取軍事行動。他在社交平台X上發文稱，這次打擊「不符合憲法」。特朗普則在社交媒體上反擊，稱馬西是個「可悲的失敗者」。
根據美國憲法第一條，宣戰權屬於國會，即由眾議院與參議院選出的民意代表。但憲法第二條則規定，總統為三軍總司令，賦予其在面對實際或預期攻擊時動用軍力的權力。
美國民主黨領袖哈基姆·傑弗里斯（Hakeem Jeffries）表示，特朗普此舉讓美國面臨「可能在中東陷入一場災難性戰爭」的風險。也有其他人士指責他繞過國會，發動一場新的戰爭。
圖像來源，
REUTERS
英國、法國與德國呼籲伊朗避免採取可能進一步「破壞中東穩定」的行動。
英國首相施紀賢（Sir Keir Starmer）、法國總統馬克龍（Emmanuel Macron）及德國總理梅爾茨（Friedrich Merz）在一份聯合聲明中表示，他們「一貫明確伊朗絕不能擁有核武」，並表示他們支持以色列的安全。
聯合國秘書長安東尼奧·古特雷斯（António Guterres）則表示，美國的空襲是一場危險的升級行為；歐盟外交政策主管卡婭·卡拉斯（Kaja Kallas）呼籲各方克制，回到談判桌上。
沙特阿拉伯表達「高度關切」，而阿曼則譴責這次攻擊並呼籲降溫。
印度總理莫迪（Narendra Modi）表示，他已與伊朗總統馬蘇德·佩澤什基安（Masoud Pezeshkian）通話，呼籲「對話與外交才是前進之路」。
俄羅斯政壇人物、總統普京的盟友德米特里·梅德韋傑夫（Dmitry Medvedev）則說：「以和平締造者姿態上任的特朗普，現在為美國開啟了一場新戰爭。」
「有這種『成功』，特朗普是不可能拿到諾貝爾和平獎的。」
以色列在6月13日對數十個伊朗核與軍事目標發動突襲，稱其目的是瓦解伊朗的核計劃，總理內塔尼亞胡表示，伊朗即將具備製造核彈的能力。
伊朗堅稱其核計劃為和平用途。作為報復，德黑蘭向以色列發射了數百枚火箭與無人機。此後兩國持續互相空襲，這場空中戰爭至今已持續逾一週。
特朗普長期以來聲稱，他反對伊朗擁有核武器。
今年三月，美國國家情報總監圖爾西·加巴德（Tulsi Gabbard）表示，儘管伊朗的鈾儲量已升至史無前例的水平，但其並未製造核武——特朗普近日則稱這一評估是「錯誤的」。
在競選過程中，特朗普曾批評過去美國政府捲入中東「愚蠢且無止盡的戰爭」，並誓言讓美國遠離外國衝突。
在以色列突襲發生時，美國與伊朗仍處於核談判之中。就在兩天前，特朗普還表示會給伊朗兩週時間展開實質談判，否則將採取攻擊——但實際時間遠比預期短。",BBC News 中文,2025-06-22,https://ichef.bbci.co.uk/ace/ws/640/cpsprodpb/a7b7/live/6b125210-4f0c-11f0-8b4f-c51cf60152a7.jpg.webp
以色列伊朗衝突下的中國人：撤離路漫漫，一票難求,https://www.bbc.com/zhongwen/articles/cq53e0v7583o/trad,"圖像來源，
PROVIDED
中國留學生朱啟明在6月15日晚間準備從耶路撒冷撤離，由公車輾轉至以色列最南端港口城市埃拉特（Eliat），由此經塔巴（Taba）口岸進入埃及，由此前往開羅機場購買任意一張可以離開中東的機票。
此時距離6月13日凌晨以色列突襲伊朗過去兩天，伊朗亦在隔天宣布對以色列發動反擊，向以色列發射數十枚彈道飛彈與無人機。
出於對簽證安全的考慮，朱啟明要求化名接受BBC採訪。
在他的手機上，來自中國駐伊拉克大使館的消息偶有彈出——提醒中國當地公民注意個人人身安全，此外再無其它。以色列官方的警告消息則頻繁彈出，宣佈以色列官方對於伊朗飛彈軌跡、數量的預測，以及以色列對反制伊朗的決心。
伊朗宣布反擊以色列時，朱啟明認為這不過是當地又一場「再常見不過」的小型衝突，直到他打開手機發現鄰國領空逐漸關閉、甚至在15日晚，他原定於19日返回中國的航班被取消，他意識到「事情不對」並開始著手收拾行李，預備逃離耶路撒冷。
End of 熱讀
在過去幾天裡，雙方局勢不斷升溫，以色列總理內塔尼亞胡宣稱已控制德黑蘭領空，伊朗最高領袖哈梅內伊強硬表態不會投降，伊朗革命衛隊稱已做好長期全面戰爭準備，而美國總統特朗普再開戰情室會議。
伊朗媒體通報稱，已有585人在此次衝突中遇難，另有1,326人受傷。
6月17日下午，中國外交部發言人郭嘉昆表示中國正會同相關部門組織撤離在伊朗和以色列的中國公民。
截止6月19日下午，中國外交部稱已有1,600名中國公民撤離伊朗，數百名撤離以色列。
身在貝魯特的BBC記者納菲塞·科納瓦德（Nafiseh Kohnavard）認為，此次伊朗和以色列之間的衝突或是1980年兩伊戰爭之後，伊朗領土遭受的最大規模軍事打擊，兩名伊朗高級核科學家在空襲中喪身，伊斯蘭革命衛隊總司令侯賽因·薩拉米（Hossein Salami）也在空襲中身亡。
圖像來源，
PROVIDED
圖像來源，
GOOGLEMAP
和朱啟明相比，承受打擊更早的伊朗方面民眾反應更為快速。
在伊朗的中國公民柳珊（因簽證安全考量，要求化名接受訪問）在6月13日下午即開始著手逃離。她回憶起，從6月13日下午3點開始，伊朗網絡中斷，從那時起，她就一直在尋找可以回國的方式。
「我們當時在設拉子（Shiraz），飛機肯定不會飛了，所以首選水路。但不知道阿巴斯港（Abbas）是否關閉，」柳珊這樣說。
柳珊一家在6月14日一早聯繫上了中國駐伊朗大使館，得知隔天中午可能有船，他們立刻托酒店預定巴士票，預備前往阿巴斯港。因情況緊急，酒店拒絕預定，要求柳珊必須前往車站購票，抵達後又告知只能購買一張。
「我們求他們給我們兩張，萬幸他們最後同意，」柳珊這樣說。
巴士旅程總長584公里，耗時10小時，高溫45攝氏度，巴士空調無法製冷，在這樣的環境下柳珊一行兩人在晚上九點捱到了阿巴斯，並在當地遇到了遊行的隊伍——由於貨運港口被炸，群情激憤。
隔日，即6月16日凌晨兩點，柳珊乘出租前往倫格港（Lengeh）。當地時間才早上六點，港口排隊人數就很多，幾乎超出柳珊預期，但他們都已提前完成線上購票。一位在伊朗經商的中國男子告訴柳珊，他這張原價50美金的船票是花500美金買到的。
在「小紅書」上，身在伊朗的多位中國公民不斷抱怨，從港口城市離開伊朗的船票和車票被炒到極高，一千美金一張的價格依然難搶到一張，陸路撤離的巴士票價亦水漲船高。
從六點到八點，柳珊一直在尋找可以買票的管道——購票處不肯把票賣給他們，直到排隊處的人全部走掉，還有兩張沒有賣出去，柳珊這才得以買票上船，此時已經是下午一點，船將在一點四十四離港。
柳珊一直用「幸運」概括自己的撤離：最早做出撤離計畫，能買到票，能快速離開。
同在德黑蘭的于女士表示，13日凌晨一點，轟炸還沒到來，她照例玩手機到沉沉入眠，直到凌晨五點起夜收到多位友人發來的關心消息，她仍不以為意，在微信朋友圈發帖表示「哪有的事」。
但于女士逐漸開始意識到事情不對，立刻著手打包行李，一邊喊女兒起床收拾東西，一邊讓異地的兒子幫忙申請鄰國亞美尼亞簽證，得知機場關閉之後，她決定嘗試陸路離開伊朗、前往亞美尼亞或土耳其。
13日上午，即遭遇空襲後的第一個早晨，德黑蘭民眾依然情緒穩定，當她背著大包小包上車離開時，當地民眾還在問她為什麼要走。
她說，在大巴站，她們遇到了正在發車的士兵，大家還在互相致意，道一聲「保重，平安」。
圖像來源，
GOOGLEMAP
伊朗在德黑蘭遇襲隔天宣布反擊，向以色列發射逾百枚飛彈。
朱啟明當時沉浸在即將離開、但不知航班是否會取消的迷茫狀態裡。他所居住的樓宇附近沒有防空洞，以色列官方在發送給民眾的短訊裡信誓旦旦地稱將攔截大部分飛彈。
6月14日的空襲預計在當地時間下午一到兩點裡開始，朱啟明躺在出租屋內焦慮地看著鄰國領空一一關閉，在實時全球航班航線追踪網FlightRadar24上，全球航線潮水般覆蓋陸地和海洋，但唯獨繞過他所在的以色列和伊朗，他於是順勢遞交了約旦和埃及的簽證申請。
朱啟明抱怨中國駐以色列大使館的兩通領事電話一直沒有打通，這讓他更加焦慮。
16日凌晨，以色列襲擊伊朗三天后，朱啟明拿到了約旦電子簽，埃及簽證也已到手，他由此踏上了從耶路撒冷前往埃及開羅的遷徙之旅——他計劃從開羅乘飛機離開中東。
「任何能離開這裡的機票都可以，」朱啟明這樣說。
在接下來的兩天裡，他乘坐巴士從耶路撒冷市中心前往埃拉特，在邊境被多要了一些服務費用後排隊離開了以色列。
另一位同在以色列的中國人也在生活分享平台「小紅書」上記錄了自己的撤離路徑：耗時4天，經以色列前往約旦，但航班再次取消。他經由陸路穿越到沙特阿拉伯境內，從那裡飛回中國。
小紅書上，不少撤離中的中國人發圖零碎記載自己的回國旅程，多段影片顯示各個關口排隊人潮擁擠。有伊朗青旅和酒店打開店門歡迎民眾免費暫居趕路，還有民眾在詢問「如果被困住要怎麼辦？」
和伊朗相比，在以色列的中國人人數稍少，以學生為主體，然後是外勞商人。朱啟明說截止他離開以色列，中國人要撤離全靠自己，在開羅等待登機過程中，他看到中國駐以色列大使館開始在學生群裡組織大巴車陸路撤離。
兩年前報考以色列的大學時，朱啟明對中東問題並無太多研究，因為學校排名高、性價比不錯，他並未多想就來到了以色列。結果在他落地後不久即遇上2023年10月7日事件，哈馬斯襲擊以色列，此後他目睹了長達兩年依然綿延不絕的、以加沙為中心的巴以衝突。
「我來的時候幾乎一無所知，走的時候一肚子火，」朱啟明說。 「打仗到最後受苦的都是老百姓。」",BBC News 中文,2025-06-19,https://ichef.bbci.co.uk/ace/ws/640/cpsprodpb/8137/live/bf363d00-4cc0-11f0-9641-750766f20854.jpg.webp
