title,url,publisher,date,cover,event,content,summary,region,overview,recent_update,location,author,publish_date
地牛翻身！台南楠西規模3.9淺層地震 最大震度2級,https://newtalk.tw/news/view/2025-02-09/955999,Newtalk新聞,2025-02-09,https://images.newtalk.tw/resize_action2/800/album/news/956/67a7f38806fa8.jpg,台灣台南地震,台南市楠西區清晨發生芮氏規模3.9地震，震央位於台南市政府東北東方，深度16.7公里。,此次地震最大震度為2級，影響範圍包括高雄市甲仙、嘉義縣及台南市，無人員傷亡或財產損失報告。,國內,2024年12月23日，台灣南部地區發生地震，最大震度為2級，影響範圍包括高雄市甲仙、嘉義縣及台南市，無人員傷亡或財產損失報告。,2025-02-25,"台灣 台南市,楠西區,高雄市,甲仙,嘉義縣,雲林縣,彰化縣",Newtalk新聞,2025-02-09
希臘桑托里尼島因地震進入緊急狀態 逾1萬人撤離,https://money.udn.com/money/story/5599/8534477,經濟日報,2025-02-07,,希臘桑托里尼地震,桑托里尼島因連續地震進入緊急狀態，逾1萬1000人撤離。地震群發生在島嶼周邊，專家不排除6級地震的可能性。,桑托里尼島在10天內記錄超過7000次地震，最強達5.2級，導致超過1萬1000人撤離。目前未造成人員傷亡或重大財產損失，但學校關閉至7日，緊急狀態持續至3月3日。,國外,桑托里尼島自1月31日起連續4天發生約200次規模3.0以上地震，10天內記錄超過7000次地震，最強達5.2級，導致超過1萬1000人撤離。學校停課至2月7日，航空公司增開3架航班協助居民和遊客離開。目前未造成人員傷亡或重大財產損失，但緊急狀態持續至3月3日。專家表示，雖有低概率發生規模5.5地震，但不會發生規模6以上的強震。,2025-02-25,"希臘 桑托里尼,雅典,伯羅奔尼梭半島,賽克拉德茲群島,尼亞卡美尼島,科倫坡島,羅得斯島,阿莫爾戈斯島",經濟日報,2025-02-07
嘉義縣大埔鄉地震規模4.4 最大震度4級,https://newtalk.tw/news/view/2025-02-10/956080,Newtalk新聞,2025-02-10,https://images.newtalk.tw/resize_action2/800/album/news/957/67a92dd88474d.jpg,台灣嘉義地震,凌晨1時39分，嘉義縣大埔鄉發生芮氏規模4.4地震，震央位於嘉義縣政府東南方35.2公里，深度14.7公里。,此次地震未造成人員傷亡或財產損失報告，但最大震度達到4級，影響範圍主要集中在嘉義縣。,國內,2024年12月23日，嘉義縣發生地震，震度達4級，雖未造成人員傷亡或財產損失，但影響範圍內居民感受到明顯震動。,2025-02-25,"台灣 嘉義縣,大埔鄉",Newtalk新聞,2025-02-10
印度地牛翻身 德里清晨大地震嚇醒人,https://money.udn.com/money/story/5599/8552569?from=edn_newestlist_rank,經濟日報,2025-02-17,,印度德里地震,印度德里清晨發生強烈地震，持續約10秒，許多民眾被驚醒。,地震規模和受影響程度尚待觀察，目前無具體損失數據，但有民眾被驚醒並短暫逃到路上。,國外,2025年1月6日，薩爾瓦多發生規模6.1地震，震源深度87公里。1月10日，該國再次發生規模5.8地震，震源深度95公里，首都居民感受到強烈震動，紛紛逃到街上。目前尚無災損或傷亡消息，地震規模和受影響程度尚待觀察。,2025-02-25,"印度 德里,德里國家首都區",經濟日報,2025-02-17
地震連震4天 希臘島嶼民眾心慌走海空兩路暫撤,https://money.udn.com/money/story/5599/8525796,經濟日報,2025-02-04,,希臘桑托里尼地震,桑托里尼連續4天發生地震，民眾心慌，搭乘渡輪和增開的航班暫時撤離。,桑托里尼島自1月31日起連續4天發生約200次規模3.0以上的地震，導致1.5萬居民中許多人選擇在戶外過夜或暫時撤離。學校停課至2月7日，航空公司增開3架航班協助居民和遊客離開。專家表示，雖有低概率發生規模5.5地震，但不會發生規模6以上的強震。,國外,桑托里尼島自1月31日起連續4天發生約200次規模3.0以上地震，10天內記錄超過7000次地震，最強達5.2級，導致超過1萬1000人撤離。學校停課至2月7日，航空公司增開3架航班協助居民和遊客離開。目前未造成人員傷亡或重大財產損失，但緊急狀態持續至3月3日。專家表示，雖有低概率發生規模5.5地震，但不會發生規模6以上的強震。,2025-02-25,"希臘 桑托里尼,阿莫爾戈斯島,伊奧斯島,阿納菲島",經濟日報,2025-02-04
多明尼加東北部規模5.9地震 暫無災損通報,https://money.udn.com/money/story/5599/8571438?from=edn_newest_index,經濟日報,2025-02-25,,多明尼加地震,多明尼加東北部發生規模5.9地震，震央位於朋達卡納北北東方約100公里處，震源深度46公里。,目前暫無災損通報，也未發布海嘯警報。多明尼加共和國部分地區和鄰近的波多黎各都有震感。,國外,2024年12月17日，南太平洋島國萬那杜發生規模7.4的淺層地震，震源深度僅10公里，隨後發布海嘯警報。2025年1月6日，薩爾瓦多發生規模6.1地震，震源深度87公里。1月10日，該國再次發生規模5.8地震，震源深度95公里，首都居民感受到強烈震動，目前尚無災損或傷亡消息。多明尼加共和國和波多黎各也有震感。,2025-02-25,"多明尼加共和國 朋達卡納,波多黎各",經濟日報,2025-02-25
阿根廷森林大火跨境延燒 智利多地野火惡化,https://money.udn.com/money/story/5599/8562703,經濟日報,2025-02-21,,智利阿勞卡尼亞野火,阿根廷巴塔哥尼亞森林大火蔓延至智利，智利多地野火惡化，政府動員直升機滅火。,智利阿勞卡尼亞區受災最嚴重，燒毀逾1萬7000公頃，16處活躍火源，58處火點受控。共影響5萬2116.6公頃土地，部分居民撤離，生物多樣性受損，政府部署資源滅火並監測火情。,國外,智利阿勞卡尼亞區發生大規模森林火災，2024年12月23日起，燒毀超過1萬7000公頃，影響5萬2116.6公頃土地。目前有16處活躍火源，58處火點受控。部分居民已撤離，生物多樣性受損，政府正積極滅火並監測火情。,2025-02-25,"智利 阿勞卡尼亞,紐夫萊,比歐比歐,湖大區,河大區,馬烏萊,納韋爾瓦皮國家公園,利昂關口",經濟日報,2025-02-21
日本山林火災延燒5天 燒毀面積約63座東京巨蛋,https://money.udn.com/money/story/5599/8566261,經濟日報,2025-02-23,,日本岩手縣山林火災,日本岩手縣大船渡市山林火災持續5天，燒毀面積約318公頃，相當於63座東京巨蛋。,日本岩手縣大船渡市山林火災持續5天，燒毀面積約318公頃，無人員傷亡或建築物受損。62個家戶共157人收到避難指示。,國外,2024年12月23日，日本岩手縣大船渡市發生山林火災，持續5天，燒毀面積約318公頃，無人員傷亡或建築物受損。62個家戶共157人收到避難指示。,2025-02-25,"日本 岩手縣,大船渡市,三陸町",經濟日報,2025-02-23
