標題,連結,內文,來源,時間
14縣市豪大雨特報! 南部整天雨勢強、北部午後雨變大慎防劇烈降雨| 生活,https://news.google.com/read/CBMiWkFVX3lxTE9mdVlyd2hBWWZuS3h0NHlISjA1bUVKRlFsV2tzWlBSM3RER0xya05ELXA5SFBNN3ZJYWRQY1ZBTFk1ZHd0bFMyMUhVY1NQRHdPOHpYMWpmZEpYUQ?hl=zh-TW&gl=TW&ceid=TW%3Azh-Hant,"受到受熱帶性低氣壓及低壓帶影響，全台今（22）天天氣不穩定。中央氣象署凌晨3點10分針對全台14縣市發布豪雨特報，豪雨特報示警範圍包括台南市、高雄市、屏東縣；大雨特報示警範圍包括基隆市、台北市、新北市、桃園市、新竹市、新竹縣、雲林縣、嘉義縣、嘉義市、澎湖縣及金門縣。
氣象署表示，台灣各地降雨機率偏高，易有短延時強降雨，北部、南部、東南部地區及金門、馬祖有局部豪雨發生，其中南部地區整天雨勢明顯偏強，北部地區預計中午過後雨勢變大增強。其他地區及澎湖亦有局部大雨發生機率，山區請慎防坍方、落石及溪水暴漲，低窪地區慎防積淹水。
氣溫方面，各地高溫普遍為攝氏28至30度，入夜後低溫略降，各地預測約24至26度，下雨時稍有涼感。此外，基隆北海岸、東半部、西南部沿海及恆春半島、蘭嶼、綠島、澎湖、馬祖有長浪發生機率；尤其適逢年度天文大潮，台灣西半部沿海及澎、金、馬潮位亦偏高，沿海低窪區域漲潮期間請注意海水倒灌或局部積淹水情形。
熱帶性低氣壓1000百帕今天凌晨2點位於台北市西北西方約100公里的海面上以時速25公里向西南西移動，受熱帶性低氣壓環流及低壓帶影響，今日台灣附近各海面易有8至10級強陣風，且風浪偏大；環境部空氣品質預報資訊顯示，受降雨洗除作用影響，空品為良好；北部、竹苗、中部、雲嘉南、高屏、宜蘭、花東空品區及馬祖、金門、澎湖為「良好」等級。
週一西半部及東北部地區降雨持續，但中南部地區雨勢趨緩，其他地區午後局部短暫雷陣雨。各地普遍24至26度，白天中南部地區高溫略回升，北台灣降雨仍偏多。週二、週三低壓帶逐漸遠離，整體降雨趨緩，不過中南部仍有降雨，北台灣雨勢減緩，預計週二各地高溫普遍回升到31、32度。週四起至週六北部及東北部地區有局部短暫陣雨，其他地區為多雲到晴。
受到受熱帶性低氣壓及低壓帶影響，今（22）天台灣各地降雨機率偏高，易有短延時強降雨。   圖：氣象署提供
受到受熱帶性低氣壓及低壓帶影響，今（22）天台灣各地降雨機率偏高，易有短延時強降雨。   圖：氣象署提供
熱帶性低氣壓1000百帕今天凌晨2點位於台北市西北西方約100公里的海面上以時速25公里向西南西移動。   圖：氣象署提供
受到受熱帶性低氣壓及低壓帶影響，今（22）天台灣各地降雨機率偏高，易有短延時強降雨。   圖：氣象署提供",Newtalk新聞,昨天
珊珊颱風襲日本 鹿兒島強風豪雨掀巨浪 愛知土石流壓垮民宅,https://news.google.com/read/CBMijgNBVV95cUxPWlNKUzdGQ0JkYXVpRmVhaVZlY1ZqQUhZYTZfbG5fcDFqSXhBRHJuWTN0TXJPQXBZR3hqZU5aRjFQc3FjZmpTTjExRG4tSklUeXFpUkExVG9Wa3d0cXpTVlBuc0V3YkdYRTFtUGNQY0hKem1qMWg4RFFxZkdpSVR5em5pYXFUZkF3anVUVHlYMzZtSTZtaEpCWXVSdzNmUkgzNUN6aGRORFdjeUxYSVZRMEdxSy12ZHpZV0c0c1Vvd3hZdHBsbk5TREFjNk10U2NjWXNaWDZvdVBEVWp6V29IWG9EazUwOEZvRy1feEZjU0FXQmNzQUdUeV9SaGVhUUlIVElfX1NNanZYWjdmVllZNXpTbkUzMWRYYWpjT0pSTnF5NUJUdlV2NTFnZkh1QTJTNWxhTEdVUHRfY2lzNlpkZzJzeVgtemFXTnV4UkRJR1JNVXZFOWtPLWs5TldEN2hMQkhoVTFBZG5Zd2NXLUdUcHJ3MVJWdzBWLXB1cjVjeHpUY2VPU256UUxMUFFKUQ?hl=zh-TW&gl=TW&ceid=TW%3Azh-Hant,"珊珊颱風往北直撲日本，更有可能「縱貫全日」，8月28日鹿兒島地區出現強風豪雨，奄美市路樹倒塌，樹木被吹得劇烈搖晃，海岸則湧現翻騰巨浪。日本氣象廳28日午間已向奄美地區之外的鹿兒島縣，發布強風和巨浪緊急警報，呼籲民眾保持最高警惕，採取提早疏散等安全措施。
截至28日中午24小時，奄美降雨量估達400毫米、風速每小時超過140公里，奄美機場27日已宣告關閉。中部愛知縣27日深夜則因強降雨造成土石流，壓垮民宅，其中3人獲救2失聯，自衛隊搜救中。
珊珊29日將逼近九州南部，之後在九州登陸，本周末將抵達日本中部和東部地區，首都東京也在籠罩範圍內。JR東海28日宣布東海道新幹線靜岡縣和愛知縣的部分區間路段減速運行；九州及本州新幹線至9月1日大部分地區服務，可能也會暫停。
首相官邸的情報聯絡室已升級為官邸對策室，並設置特定災害對策總部。珊珊威力驚人，此前已達氣象廳分類的「非常強烈颱風」，氣象廳表示，由於路徑存在許多不確定因素，可能變成「迷走颱風」，加上海溫升高，又助長颱風能量，恐為關東地區等帶來致災大雨。",Yahoo奇摩新聞,8月28日
氣象局發布多個警報！中南部9縣市大雨特報台中溪水暴漲警戒| 生活,https://news.google.com/read/CBMiWkFVX3lxTE1qZmFUS0RiVWFFUzBiMmVNVGM0Z1VfRHlveldXZE45bEFpblpLbDhMQzc3SjNzWmNTQ2praTJsSTRReGhmYkhSMXJ4VUdYUFhnSml3ekw0ZWV5QQ?hl=zh-TW&gl=TW&ceid=TW%3Azh-Hant,"中央氣象署今（1）日下午針對台灣中南部地區發布一系列天氣警報，包括對台中以南 9 個縣市的大雨特報，以及苗栗縣、台中市、南投縣的大雷雨即時訊息。更值得注意的是，氣象署特別針對台中市發布山區暴雨溪水暴漲警示，呼籲民眾迅速遠離溪流區域。
大雨特報範圍包括：台中市、南投縣、彰化縣、雲林縣、嘉義縣市、台南市、高雄市、屏東縣。氣象署針對苗栗縣、台中市、南投縣發布大雷雨即時訊息，提醒民眾慎防劇烈降雨、雷擊，溪（河）水暴漲，低窪地區慎防淹水，以及低能見度。此警示持續至 16 時 00 分止。
此外，氣象署還發布了針對台中市的「大雷雨即時訊息」和「山區暴雨之溪水暴漲警示」。警示內容指出，台中市附近有暴雨發生的機率，提醒民眾留意溪水暴漲並儘速遠離溪流。這項警示預計持續至當日下午 4 時 54 分。
氣象署呼籲民眾密切關注最新天氣資訊，並採取必要的安全防護措施。
氣象署今（1）日下午針對台灣中南部地區發布一系列天氣警報，包括對台中以南 9 個縣市的大雨特報。   圖：翻攝自氣象署網站
氣象局今發布中南部大雨警報，特別提醒台中山區暴雨可能引發溪水暴漲，請民眾避開溪流地帶。   圖：翻攝自氣象署網站",Newtalk新聞,22 天前
奈及利亞大洪水逾20萬人流離失所170人死亡、蘇丹大雨大壩倒塌災情慘重| 國際,https://news.google.com/read/CBMiWkFVX3lxTE5rLXpiQktQLVZSVzI2dWJuNDZnWl85NFh6UE91eWllOVNsYVJuNThJTDI4WERHVUpfLV96TE5aMUhISDRFVUtndTNSZmZiWjdZN2N5cUxkVVA5dw?hl=zh-TW&gl=TW&ceid=TW%3Azh-Hant,"綜合外媒報導，近日蘇丹因暴雨和潰壩引發的洪水，造成的死亡人數已上升至 132 人。據政府委員會表示，洪水摧毀了 10 個省份的 12,000 多座房屋，超過 30,000 個家庭受到影響。另外，奈及利亞也陷入大淹水。
8 月 26 日，聯合國緊急救援機構報告指出，蘇丹西北部紅海州的阿爾巴特大壩倒塌事故造成至少 30 人死亡。聯合國人道事務協調辦公室（OCHA）警告，已經飽受內戰困擾的蘇丹，許多人仍失蹤和流離失所，洪水遭成的死亡人數可能會進一步上升。
人道協調廳強調，通訊網絡的損壞使得準確資訊的收集變得困難。此外，受損的大壩是蘇丹港的主要淡水來源，其損壞將影響供水，進一步惡化紅海區域的人道主義。自 6 月以來的洪水已經導致超過 10 萬人流離失所，並加劇該國的內政破壞性的分裂。人道協調廳 7 月表示，蘇丹全國一半以上的人口仍面臨嚴重飢餓。
科學家指出，人為造成的氣候變化使極端天氣事件愈加頻繁，蘇丹是受氣候影響最嚴重的國家之一，面臨致命的降雨、洪水及乾旱。
與此同時，奈及利亞的洪水也造成了至少170人死亡，超過 20 萬人流離失所。國家緊急事務管理局（NEMA）表示，北部地區受災最為嚴重，但全國各地仍面臨風險。奈及利亞水文服務局（NIHSA）預警，來自鄰國的洪水有可能進一步影響該國，並敦促沿尼日河的州保持警惕。
根據最新數據，非洲洪災已造成近 2,000 人傷亡，並摧毀了超過 10 萬公頃的農地。人道協調廳的報告指出，該地區的災情仍在加劇，急需國際社會的關注與援助。
 
 
蘇丹內戰仍在持續中，街道殘破不勘   圖：美聯社／達志影像
非洲人口最多的奈及利亞連月降雨釀河水暴漲   圖：美聯社／達志影像",Newtalk新聞,8月28日
豪雨特報！17縣市受警示豪雨狂轟新北基隆注意坍方落石| 生活,https://news.google.com/read/CBMiWkFVX3lxTE5TdnFoZWVFQlh6Zk8wZWlmMmw3cTB2T2UxakJFcER3X2taNVJ2VVlDQmVsRGE3M0FOZ2xYejhQcEIwTkRTNHZReV9OekJ4NDV0bVBtTC1oUGVIQQ?hl=zh-TW&gl=TW&ceid=TW%3Azh-Hant,"全台17縣市大雨壟罩，氣象署晚間20時15分更新豪雨特報，受鋒面及低壓帶影響，易有短延時強降雨，今晚至明天基隆北海岸及新北市山區有局部豪雨或大豪雨；宜蘭、台北、台南、高雄、屏東則注意豪雨。
中央氣象署針對17縣市發布示警，今天晚間至明天北海岸及新北市山區有局部豪雨或大豪雨，基隆市、臺北市、新北市、宜蘭縣、臺南市、高雄市、屏東縣有局部大雨或豪雨，桃園、新竹、彰化至嘉義地區、澎湖、金門、馬祖及花蓮山區有局部大雨發生的機率，請注意雷擊及強陣風，低窪地區請慎防淹水，山區請注意坍方、落石、土石流及溪水暴漲。大豪雨地區：新北市。
氣象署提醒，雨區範圍注意雷擊及強陣風，低窪地區慎防淹水，山區注意坍方、落石、土石流及溪水暴漲。",Newtalk新聞,16 小時前
19縣市大雨特報！氣象署：6縣市大雷雨持續一小時| 生活,https://news.google.com/read/CBMiWkFVX3lxTE1PcUFpYTlVeWhzYXlNOThBZmhGQUxCcm55dnMwcFJoWWFHU05GazVqbExqYWJaYnFibGExNjlucUhSRjFXdlc2YTlwTFlrVkpaUFh4NFlCTFg3UQ?hl=zh-TW&gl=TW&ceid=TW%3Azh-Hant,"午後對流雲系發展旺盛，易有短延時強降雨，今(8)日台灣各地有局部大雨發生的機率，請注意雷擊及強陣風。中央氣象署並針對6縣市發布大雷雨即時消息，持續時間將至15時30分止。
氣象署針對19縣市持續發布大雨特報，範圍包括基隆北海岸、台北市、新北市、桃園市、新竹市、新竹縣、苗栗縣、台中市、彰化縣、南投縣、雲林縣、嘉義市、嘉義縣、台南市、高雄市、屏東縣、恆春半島、宜蘭縣、花蓮縣、台東縣
氣象署也針對，「新北市、桃園市、新竹縣、嘉義縣、台南市、苗栗縣」發布大雷雨即時訊息，持續時間至15時30分止，氣象署說旺盛發展的對流常伴隨打雷、閃電與劇烈降雨，並可能出現較強陣風甚或伴隨冰雹發生，若發生於溪流河川上游易於下游出現溪(河)水暴漲。
氣象署針對19縣市持續發布大雨特報。   圖：翻攝自中央氣署官網",Newtalk新聞,15 天前
