標題,連結,內文,來源,時間,圖片
颶風「柯克」重創葡萄牙、西班牙 挾強風大雨逼近法國,https://news.google.com/read/CBMiZkFVX3lxTE0yTVBhNzllemtQZDBhbU9JanVvMWV6enFoS2pqWXBRNW44MlFSUFVqUERoMWxMREJIUjd2ajVNNWFOUFJraDZyQzB1anJxN05YSjc3aEZfay1TYVdZQkdUZTEwdk1tUdIBa0FVX3lxTFBsVlkyZ04wVlVRMnltWXpiQk1rRllXVi1pTC13dnBnNk5kTjZPRUVDRkI5SDNmOVhzOGc5NU1CdUpkNnRSLUI4Yl9xYkpPcTd5dUw3QUVYUEkwQm9ZY3NGcXk3YlFSeGJ0eHVJ?hl=zh-TW&gl=TW&ceid=TW%3Azh-Hant,"
臺北市 28-33 ℃
爆
颶風柯克（Kirk）強風大雨重創葡萄牙和西班牙。（擷取自EU哥白尼計畫Copernicus網站）
〔中央社〕颶風柯克（Kirk）的餘威週三橫掃西歐，將葡萄牙和西班牙的樹木連根拔起，接著挾帶強風大雨侵襲法國。
法新社報導，葡萄牙民防局表示，當地連夜發生1300多起事故，其中3/4涉及葡萄牙北部的樹木倒塌。


受災最嚴重的是北部主要城市波圖（Porto），當地有400棵樹被連根拔起。同樣位於北部的巴塞羅斯（Barcelos）附近有車輛受損、鐵路服務中斷。
葡國電力供應商表示，這場風暴導致超過30萬戶停電。
葡國氣象和民防官員預測風速將高達每小時120公里並伴隨大雨，並出現7公尺高的海浪，因此海岸進入黃色警戒。
西班牙氣象官員對當地北部和西北部地區發出橘色警報，提醒阿斯圖里亞斯（Asturias）地區的風速可能高達每小時140公里。
位於西班牙西北部的加利西亞（Galicia）則傳出土石流和樹木倒塌阻塞道路，但沒有其他重大損失。
法國氣象局（Meteo France）對全國30個省發布橙色警報，預計出現大雨和強風。
不用抽 不用搶 現在用APP看新聞 保證天天中獎　 點我下載APP　 按我看活動辦法
2024年10月14日‧星期一‧甲辰年九月十二日
自由時報版權所有不得轉載© 2024 The Liberty Times. All Rights Reserved.
",自由時報,2024-10-10,
2天暴雨降下全年雨量 撒哈拉沙漠洪水氾濫照片驚人,https://news.google.com/read/CBMiWkFVX3lxTE5KeTBkTTBhS0l3ZXlRaWlQSlZkQS04WWwwLWQ1aS1UVkc3d0tsblVseVRkUE4tYy1UanhUUjM4eUdkTkg0RnFOLU4tVFMxTzJad2lMbGJmdVp3Z9IBX0FVX3lxTE5YeHlZMTY2ZU4xNFl5ZDlRTF9aUW80WUxpdHRQb1E5Y2VxOWVYVVNfS2poeU9PdTdndnZ0MlBvaV9CNk16RXUwWFY4MTNLdVlDeTlyQXc5TkVJck80MXhF?hl=zh-TW&gl=TW&ceid=TW%3Azh-Hant,"美聯社報導，摩洛哥東南部的撒哈拉沙漠是世上最乾燥的地區，夏末也很少下雨，但近來該地區罕見降下暴雨，沙漠很快被淹成湖泊。這場洪水還導致摩洛哥和阿爾及利亞超過20人死亡，並破壞農作物，迫使政府撥出緊急紓困資金援助。

摩洛哥政府指出，有些每年降雨量不到250毫米的地區，在9月間兩天就降下一整年雨量。位於摩洛哥首都拉巴特以南450公里的城鎮塔古尼特（Tagounite），24小時內測得的降雨量超過100毫米。

暴雨留下洪水在撒哈拉沙漠的城堡和沙漠植物間湧出的驚人景象。美國太空總署（NASA）衛星影像顯示，洪水注入當地已經乾涸50年的伊里基湖（Lake Iriqui）。

摩洛哥氣象總局的尤阿貝布（Houssine Youabeb）表示：「30至50年來，從未在這麼短的時間下過這麼多雨。」

尤阿貝布說，這種所謂「溫帶風暴」帶來的降雨，可能改變該地區未來數月甚至數年的天氣型態，因為空氣中保留更多水氣，恐導致更多水氣蒸發並引發更多風暴。

不過，充足的降雨可能有助於補充沙漠下的大型地下水含水層，當地社區水源源自於此。據稱當地水庫整個9月的水源補充速度創下新高。然而，目前尚不清楚9月的降雨能在多大程度上緩解乾旱。連續六年的乾旱為摩洛哥許多地區帶來挑戰，迫使農民休耕及城市和村莊限時供水。
",經濟日報,2024-10-10,
